,Unnamed: 0,tweet,tweet_id,author_id,lang,created_at
3087,3275,end weekend good news thanks strict protection government authority india nepal population rebound few individual today,1602114090561855488,719100622184792066,en,2022-12-12 01:32:19+00:00
3088,3276, matter single wildlife need rebuild habitat go survive life planet,1602113384249532418,2910805565,en,2022-12-12 01:29:31+00:00
3089,3277,george mcinerney find interest primordial germ cell make nohern white stem cell,1602113031282036741,861808531,en,2022-12-12 01:28:07+00:00
3090,3278,censorrottie furry speciesbreeds hot need nerfedpolar bear rottweiler kangaroo badger ,1602112943436419072,907393907293483008,en,2022-12-12 01:27:46+00:00
3091,3279,ioweztt bat pick gold horn ride yellow butterly ride mousefly potionride,1602111262988591104,807108994645028864,en,2022-12-12 01:21:05+00:00
3092,3282,primordial germ cell make nohern white stem cell sciencenews,1602108248605204480,204833926,en,2022-12-12 01:09:06+00:00
3093,3283,tonyjohnstone take dehorn yesterday sanparks massive hugely expensive operation underway dehor,1602106293472337921,1405353690,en,2022-12-12 01:01:20+00:00
3094,3286, deserve put riskendangered white cell turn sperm egg stem cell,1602103252924997638,118851809,en,2022-12-12 00:49:15+00:00
3095,3287,andy vermaut share primordial germ cell make nohern white stem cell race advance assist reproduction stem cell associate technology save nohern thank andyvermautlovesscience respectscience respectlife,1602102197969616899,283604227,en,2022-12-12 00:45:04+00:00
3096,3288,slocumfoexas yet lose single national senate race time retire rnc chair,1602101840384073729,1593940763611725824,en,2022-12-12 00:43:39+00:00
3097,3289,jerichsen livstats think thing commentator good well talk golf wildlife hadnt notice birdie event good see player suppo,1602101093974306816,1520272970127605760,en,2022-12-12 00:40:41+00:00
3098,3290,planet sad news ranger true hero put life line everyday help save wildlife condolence ranger okawas family colleague world lose great man tracey,1602100740042162177,1550316429521457152,en,2022-12-12 00:39:16+00:00
3099,3292, still gon run son bitch back say shouldnt poach ,1602097553771839489,1596199017695920129,en,2022-12-12 00:26:37+00:00
3100,3293,pmileapo nnattawin milephakphum choice quagga mammal closely related modern horse zebra african black funfandxmileapo,1602093630793162752,1261540878641958913,en,2022-12-12 00:11:01+00:00
3101,3295,nytimes nytmag protection pet housefly pet,1602088426140209153,829775857665265664,en,2022-12-11 23:50:20+00:00
3102,3296,fun snake fact color impact venom head impact venom head venomous venomous snake specie hybridize baby venomous gaboon viper hybrid snake great swimmer even dese specie,1602069844811096065,1174222645082165249,en,2022-12-11 22:36:30+00:00
3103,3297,amandadeibe lettersofnote year later know horn leg prove wrong,1602066746516525056,7575072,en,2022-12-11 22:24:11+00:00
3104,3298,daangryostrich thread take brevard zoo melbourne florida,1602063061594112001,1242478659090485248,en,2022-12-11 22:09:33+00:00
3105,3299,nijuustreams get beetle horn,1602061134420672512,1573149636327530496,en,2022-12-11 22:01:53+00:00
3106,3300,hot take environmentally base exhibit zoo african savannah asia australia great overuse begin get boring predictable africa always zebra giraffe lion asia always tiger snow leopard bring,1602060693095829509,1540092492187566080,en,2022-12-11 22:00:08+00:00
3107,3301,furry speciesbreeds hot need nerfedpolar bear rottweiler kangaroo badger boar bull elephant ,1602060243650985984,799033128241287169,en,2022-12-11 21:58:21+00:00
3108,3302,wilkieisback jonstone many tank run plain africa sod cause issue mate well know fact officer want moars xxx big hug friend,1602059212217090049,2339072360,en,2022-12-11 21:54:15+00:00
3109,3303,night market status closedits normally quiet morning comment nearby,1602057990562992128,1487844944807088133,en,2022-12-11 21:49:24+00:00
3110,3304,masculinesoul raw milk stuff crazy comparable powder horn aphrodisiac likely make ill,1602056933321711618,1571484467981688834,en,2022-12-11 21:45:12+00:00
3111,3305,dicendemons first plastic rogue trader land raider so camouflage scheme strange new world guard look homage ,1602054889987018752,2855350344,en,2022-12-11 21:37:05+00:00
3112,3306,eshalegal kanthan chronic thing belief horn pangolin scale shark fin cure erectile dysfunction,1602053510870204417,390481706,en,2022-12-11 21:31:36+00:00
3113,3307, opinion john ratcliffe trump national security chief great run mate thought mike pompeo obvious bush even threaten run trump thought desantis he try trump cant win maga maga trump,1602053066441850880,1518679966732460035,en,2022-12-11 21:29:50+00:00
3114,3308,meeting kenya endanger lonely planet travel video,1602052648248672256,1063880227636563970,en,2022-12-11 21:28:10+00:00
3115,3310,kiss really change market maybe year year ago current condition refine change strategy present market condition year,1602049541276049410,1245048044929810433,en,2022-12-11 21:15:49+00:00
3116,3311,kiss read year experience market league mine do look post little hard understand think price action dont mind question anything reall,1602049206545682432,1245048044929810433,en,2022-12-11 21:14:30+00:00
3117,3312,afamcdk customize bike advocate raise awareness specie protection worldevery day approximately,1602048460437553154,2273829730,en,2022-12-11 21:11:32+00:00
3118,3313,afamcdk left bleed death antipoaching effos frustrate poacher arm soph,1602048448571785222,2273829730,en,2022-12-11 21:11:29+00:00
3119,3314,johndogsongs tnpcollection record honestly look mike nesmith come sho protection payment kink ,1602047386200653824,1597751017889636354,en,2022-12-11 21:07:16+00:00
3120,3315,thedailybeast yearold man kill india sunday onehorned caught paddy field assam,1602045227917012993,2807758891,en,2022-12-11 20:58:41+00:00
3121,3316, first sho story extinction mexicoi poor arent morning wake little house surprised dont recognize even collect ,1602044852241584128,504837725,en,2022-12-11 20:57:11+00:00
3122,3317,drelidavid horn covid,1602044756229505024,1403050011101995010,en,2022-12-11 20:56:49+00:00
3123,3318,tnpcollection record honestly look mike nesmith come sho protection payment kink ray avin little wordnow dont mind youre little light mikey bruvver dave ere well,1602044654593216514,86598218,en,2022-12-11 20:56:24+00:00
3124,3319,hey elonmusk here suggestion give human spend time effos protect wildlife planet ocean human pollution elephant ivory trader animal abuse general thought,1602044481540427777,1525618379771486210,en,2022-12-11 20:55:43+00:00
3125,3320,amaze race wild man scene bald new yorker show old zambian dude picture take zambian dude spit water face give miniature eiffel tower,1602040567248084994,4645253126,en,2022-12-11 20:40:10+00:00
3126,3321,rpsagainsttrump big horn effect common sense ability,1602038691450736640,1511109012955172867,en,2022-12-11 20:32:43+00:00
3127,3322,ladyrocketspace ladyrocketspace abasel lvmh bring satellite save wilde life savingsurvivors copernic,1602034976547028992,1668636510,en,2022-12-11 20:17:57+00:00
3128,3323, female kill poacher arrest horn mokopanesouth african police servicedecember read full aicle different page use follow link farmcrimeupdates poach poach southafrica,1602030880176103425,1599020413358587905,en,2022-12-11 20:01:40+00:00
3129,3325,flapsohoolahan say song conservation,1602026123914874884,94522089,en,2022-12-11 19:42:46+00:00
3130,3326,hybridbrainy exactly cant tell thats horn cock try fun glory hole,1602025995426480128,1459428409893920772,en,2022-12-11 19:42:16+00:00
3131,3327,politikibolt day read repos ramaphosa involve poach dont trust phalaphalafarmg,1602022027279622144,140447020,en,2022-12-11 19:26:30+00:00
3132,3328,planet baby mavric traumatic experience survive werent anti poach care unit pray day stop poach tracey,1602021692062470145,1550316429521457152,en,2022-12-11 19:25:10+00:00
3133,3329,riissaaaslays year slavery year extinct kill ivory suck,1602020315609329664,790489232,en,2022-12-11 19:19:41+00:00
3134,3330, suspect arrest possession horn illegal firearm ammunition limpopo found dead dehorn police also found hunt rifle live round ammunition butcher knife,1602019071838785536,2904694800,en,2022-12-11 19:14:45+00:00
3135,3331,nowplaying powder horn inner consternation,1602018898966188033,111377826,en,2022-12-11 19:14:04+00:00
3136,3332,ghirapurigears god love play whip card seige eidolon blossom doomwake giant sidisi god hornet queen good standard format enable best lil guy satyr wayfinder,1602016424150863872,1147814882336595969,en,2022-12-11 19:04:14+00:00
3137,3333, day track amostheguide book safari infopamojatoursandtravelcompamojatoursandtravelgmailcominfoafricasafaritravellerscom ,1602016139281932288,840210774165446656,en,2022-12-11 19:03:06+00:00
3138,3334,ziwa sanctuary staed white impoed kenya usa themugwildlife plan reintroduce uganda national park amostheguide,1602016120504217601,840210774165446656,en,2022-12-11 19:03:01+00:00
3139,3335,ziwa sanctuary establish reintroduce southern white cero uganda longterm goal sanctuary build sustainable cero population relocate back original habitat uganda protect areasamostheguide,1602016102732685314,840210774165446656,en,2022-12-11 19:02:57+00:00
3140,3336,jamesrodriguez record recordsuk mikekillmon billboard wonderful news gambler madonna,1602015086545092608,1524502373409992704,en,2022-12-11 18:58:55+00:00
3141,3337,breitbanews talk allow demonrats run wild shit country,1602014225190490112,1426681414456594436,en,2022-12-11 18:55:29+00:00
3142,3338, chinese still consume horn much neve use die ,1602009540945387520,1551546591244435461,en,2022-12-11 18:36:53+00:00
3143,3339,spidermanshots say spidey stayed black stayed black still want kill ,1602008758284066818,3068053509,en,2022-12-11 18:33:46+00:00
3144,3340,great action pedal smyhornismyhorn stoppoaching stopthetrade,1602006744070234116,933652559318962176,en,2022-12-11 18:25:46+00:00
3145,3341,cite zimbabwe poacher jail year poach bubye valley conservancy ,1602005458864451584,1601987543779758084,en,2022-12-11 18:20:39+00:00
3146,3342,shrimpfarmer zoo get hand dawg,1602002429662629889,1527775042590887939,en,2022-12-11 18:08:37+00:00
3147,3343, zoo get hand dawg,1602002365573640192,1312509384497520646,en,2022-12-11 18:08:22+00:00
3148,3344,chuckcallesto national geographic,1601999807975165953,3142750596,en,2022-12-11 17:58:12+00:00
3149,3345,atensnut need run field africa rest ,1601998510399918091,1547661580988387329,en,2022-12-11 17:53:03+00:00
3150,3346,hodilu suspect poacher arrest,1601997544296521728,1530626425,en,2022-12-11 17:49:12+00:00
3151,3347, yearold man kill india sunday onehorned caught paddy field assam golaghat district authority say,1601995127374872577,16012783,en,2022-12-11 17:39:36+00:00
3152,3348,leafswan hii leafswantake look beauty nopen offer foundation scifi conceptual detailed photomanipulation mom give bih future specie feel magic emotional do photoshop blender,1601994923758481409,3306303259,en,2022-12-11 17:38:48+00:00
3153,3349,lovepowercoin hii lovepowercointake look beauty nopen offer foundation scifi conceptual detailed photomanipulation mom give bih future specie feel magic emotional do photoshop blender,1601994559084695552,3306303259,en,2022-12-11 17:37:21+00:00
3154,3350,ghirapurigears reanimate sac rescue underworld target next upkeep crash well enter battlefield get love first zone track,1601989377512677389,42408324,en,2022-12-11 17:16:45+00:00
3155,3351,thread take brevard zoo melbourne florida,1601986747625533440,3321579341,en,2022-12-11 17:06:18+00:00
3156,3352,endanger nohern white cell turn sperm egg stem cell,1601986110606942209,1589525311766642688,en,2022-12-11 17:03:46+00:00
3157,3353,flurishingquirk rough animation showreel father dragonproud work alongside skilled aists give ,1601985846806466560,1104802005925617664,en,2022-12-11 17:02:43+00:00
3158,3354, horn grazing kaziranga national park,1601980855941201920,4297689493,en,2022-12-11 16:42:54+00:00
3159,3355,bqkms proudelephantus endanger specie,1601979548429873152,1593060853854642183,en,2022-12-11 16:37:42+00:00
3160,3356,nypost rather zoo see real,1601979487528386560,1596545183381946368,en,2022-12-11 16:37:27+00:00
3161,3357,endanger nohern white cell turn sperm egg stem cell enfotainment hub,1601978715411566594,1569023147608866822,en,2022-12-11 16:34:23+00:00
3162,3358,chuckcallesto little late mccahy time trade fire eat conservative time god family country trumpwasrightabouteverything,1601975185078452225,1303007124382011392,en,2022-12-11 16:20:22+00:00
3163,3359,jstocky dus social crash dozen member lead dominant bull calf ,1601972707486203905,1203254035601645568,en,2022-12-11 16:10:31+00:00
3164,3360,special shout molly molly finger cross plenty feedback dehorn survey,1601971149650464770,44861089,en,2022-12-11 16:04:19+00:00
3165,3361, suspect appear cou monday arrest possession horn illegal firearm ammunition limpopotwo found dead horn remove,1601966651485954058,44861089,en,2022-12-11 15:46:27+00:00
3166,3362,teeird cant complain say chillin ming vase full cristal hand horn full caviar ,1601964719207849986,4788419721,en,2022-12-11 15:38:46+00:00
3167,3363,editzsr alexanderv nope rich dont eat dog catsthey eat exotic animal growth especially men different paschina tiger world rest world combine bread become food horn age tooise everything,1601964188649533442,1352161442594746371,en,2022-12-11 15:36:40+00:00
3168,3364,great horn calf jiya mother asha chester zoo,1601960620534157313,2595390031,en,2022-12-11 15:22:29+00:00
3169,3365,geeking give long history people alongside large animal asia asian elephant tiger several specie banteng leopard etc etc lamentable britain feel fear sight mole hill,1601957846358401030,389988390,en,2022-12-11 15:11:28+00:00
3170,3366, left bleed death antipoaching effos frustrate poacher arm sophisticated weapon blind greed see pain inflict poor creature olpejetaescapeshelpings,1601957438734876677,973910373136064512,en,2022-12-11 15:09:50+00:00
3171,3367, customize bike advocate raise awareness specie protection worldevery day approximately kill poach horn poacher use tranquilizer disable inhumanely cut horn olpejeta,1601957402919723011,973910373136064512,en,2022-12-11 15:09:42+00:00
3172,3368,sharej jamesrodriguez mikekillmon madonna record recordsuk madonnatribe love love dark ballet brilliant song ,1601956764634812416,16263931,en,2022-12-11 15:07:10+00:00
3173,3369, wallstreetsilv perhaps signifies various conservation programme project tiger project elephant project,1601955671825522688,966862224353411073,en,2022-12-11 15:02:49+00:00
3174,3370,jamesrodriguez mikekillmon madonna record recordsuk madonnatribe love love dark ballet brilliant song incredible video amaze madame tour,1601953114948481025,1579982455712292864,en,2022-12-11 14:52:40+00:00
3175,3371,sabreakingnews suspect poacher arrest limpopo,1601951328607010817,925358694,en,2022-12-11 14:45:34+00:00
3176,3372, thing chinesethey sing interrogate interviewedthe told mahlobo involve horn poach,1601950554045005824,1496897184385716231,en,2022-12-11 14:42:29+00:00
3177,3373,foxnews know suppose use gasoline backyard fire nuclear waste radial tire firework tnt black horn,1601950473480708097,1316850050862067713,en,2022-12-11 14:42:10+00:00
3178,3374,suespurgin southafrica yet traumatise orphan tragic collateral damage poach poor little boy ,1601949693424058370,1364618139699458048,en,2022-12-11 14:39:04+00:00
3179,3375,tribelaw join pay loser pay cry day long law skill sense become nonsense never good anyway political hack,1601948589814841344,1464943500739465222,en,2022-12-11 14:34:41+00:00
3180,3376,helping thandi never tire see beautiful thandi thing friday poachingsurvivor,1601948282812522498,1185005725476634624,en,2022-12-11 14:33:28+00:00
3181,3377,thank satao amaze suppo charge event checkpoint sponsor satao suppoer event countless year marjolein put cbml arkark conservation fundraisingforacause conservationheroes rcsponsors,1601942765914537984,216336383,en,2022-12-11 14:11:32+00:00
3182,3378,captainkipkorir tunajibu kill ,1601942479196278784,371164112,en,2022-12-11 14:10:24+00:00
3183,3379,rare spaanryan rhisotope wildaidafrica peteswildlife undp wildaid thegef ugwildlife thamimadou emmaedw,1601941624854020096,1381013077424893953,en,2022-12-11 14:07:00+00:00
3184,3380, suspect arrest possession horn illegal firearm ammunition limpopofollow link read morenews conservation science antipoaching stemcells crime poach southafrica help,1601940975479361539,1381013077424893953,en,2022-12-11 14:04:25+00:00
3185,3381,aquazi rescue orphan rush paner care wild sanctuary south africa emergency care last year thanks generosity really well read full story,1601938367930896389,1118842989458202624,en,2022-12-11 13:54:04+00:00
3186,3382,ctskeeley today saw big serengeti national park include rare black photo distance thri,1601938062069862401,1009794030165733376,en,2022-12-11 13:52:51+00:00
3187,3383,today saw big serengeti national park include rare black photo distance thrill post pic next post big serengeti black,1601937768761942017,257762014,en,2022-12-11 13:51:41+00:00
3188,3384,kimjisoovt thenrepo nohern white netizensrepo jisoo asian celebrity year acoty acotyjisoo thenrepo,1601936172250726401,1427746998464049153,en,2022-12-11 13:45:20+00:00
3189,3385,daangryostrich dont know sure zoo offer time yes get pet handler time wasnt allow enclosure come right fence easily pet rub belly,1601933884429565955,1419748500850593796,en,2022-12-11 13:36:15+00:00
3190,3386,check listing add poshmark closet mountain africa collage lion giraffe zebra elephant shopmycloset poshmarkapp,1601931615089078273,19976806,en,2022-12-11 13:27:14+00:00
3191,3387,rare late rare studio thanks adamhascience travel conservation,1601930117344907265,439439615,en,2022-12-11 13:21:17+00:00
3192,3388,planet negotiator gather cop biodiversity summit new study say biocredits help boost conservation ,1601925327730663425,1265811674520567810,en,2022-12-11 13:02:15+00:00
3193,3389, year slavery year extinct kill ivory suck stuck,1601923888342081536,862707208701784064,en,2022-12-11 12:56:31+00:00
3194,3390,sabcnews suspect arrest possession horn leyden mokopane limpopo expect appear mokopan,1601922600921403392,1246170365828759557,en,2022-12-11 12:51:24+00:00
3195,3391,who ready week jameslewinphotography savethe cero save conservation conservation wildlife wildlifeconservation wild savethecharity,1601918896784785408,707597290161246208,en,2022-12-11 12:36:41+00:00
3196,3392,liaatradess get halo uni cobra bee,1601918524938752001,1315988950910107648,en,2022-12-11 12:35:13+00:00
3197,3393,daangryostrich omg little jewel zoo favorite use live melbourne cant remember number time go often take guest encounter favorite memory ,1601916673862377473,1419748500850593796,en,2022-12-11 12:27:51+00:00
3198,3394,madelsuravilla follow victoria fall international airpo zimbabwe,1601907315283730440,1492455418907578370,en,2022-12-11 11:50:40+00:00
3199,3395,brianclayton fotawildlife marinastrasser take way long figure bloat beach corpse whale,1601905392765878274,4655792000,en,2022-12-11 11:43:02+00:00
3200,3396,arrivealive suspect poacher nabbed possession horn unlicensed firearm ammunition,1601902694838726658,316617933,en,2022-12-11 11:32:19+00:00
3201,3397,calf play zoo keeper youtube,1601902416781201409,834754484,en,2022-12-11 11:31:12+00:00
3202,3398,sproatleyjnrs foundation challenge ball mastery morning incredible skill show sproatleyjnrs deve,1601901665803804672,3273360132,en,2022-12-11 11:28:13+00:00
3203,3399,biorescue produce primordial germ cell nohern white stem cell world first large mammal prevent extinction nohern white biorescue world mammal,1601898763349594113,1390281688513716232,en,2022-12-11 11:16:41+00:00
3204,3400, last survive male white dieddaisyginsberg us technology rare research footage bring visitor nhmlondon face face imperfect lifesized representation endanger animalfrom december,1601894636133433345,23084261,en,2022-12-11 11:00:17+00:00
3205,3402,allege poacher nabbed leyden village mokopanefive men possession unlicensed firearm ammunition tracked discovery carcass game farm,1601894573176856576,21852403,en,2022-12-11 11:00:02+00:00
3206,3403, churo grind today weather described mother land baltic warm weather animal respect he john snow sent nightwatch winter ceainly king mack proud yeahgowon,1601893381675835393,1578411248865222661,en,2022-12-11 10:55:18+00:00
3207,3404,sabisabireserve calf cute,1601892833052467200,1416437382191190017,en,2022-12-11 10:53:07+00:00
3208,3405, watch england fail international tournament money advise predict exit lion expect nothing else osama bin southgate go king jose brought also bottle big game,1601890576693075970,1578411248865222661,en,2022-12-11 10:44:09+00:00
3209,3407,top story endanger nohern white cell turn sperm egg stem cell new scientist see ,1601889220813004801,58377839,en,2022-12-11 10:38:46+00:00
3210,3414,endanger nohern white cell turn sperm egg stem cell new scientist see ,1601889207936507905,143679029,en,2022-12-11 10:38:43+00:00
3211,3417, appear ive found way african animal roam street tik tok need stay way giraffe lion even saw lmao,1601886740083396608,22400271,en,2022-12-11 10:28:55+00:00
3212,3419,chatgpt absolutely crazy cant imagine much gon impact educationi ask thing plasma physic poach quantum entanglement long distance relationship give coherent answer ,1601882186755579907,1028733025,en,2022-12-11 10:10:49+00:00
3213,3420,stand iconic kenya huge ecological significance low forest bamboo zone provide impoant habitat giant forest hog migrate elephant black image credit lara jacksonolpejeta olpejetaconservancy internationalmountainday,1601879507018940416,58425101,en,2022-12-11 10:00:10+00:00
3214,3422, late rare studio thanks adamhascience travel conservation,1601877857411760131,973866358705475584,en,2022-12-11 09:53:37+00:00
3215,3423,sabcnews extinct pple still kill last remain one,1601876779886690307,1585903816846753792,en,2022-12-11 09:49:20+00:00
3216,3424,citizentvkenya wonder kill kenyan he kenyan joyrider,1601872399603040257,1573309708869443584,en,2022-12-11 09:31:56+00:00
3217,3425,kiss ttradesedu damn bro monitor,1601872083168137216,895044350404636673,en,2022-12-11 09:30:40+00:00
3218,3426,jeron dirkpolak fbprovgld number hunt year determine owner financial interest maintain viable breeding population generate future revenue,1601871759254355968,1488217736526319628,en,2022-12-11 09:29:23+00:00
3219,3427,newscientist endanger nohern white cell turn sperm egg stem cell twttimes,1601868145127464960,1051932325,en,2022-12-11 09:15:01+00:00
3220,3428,xposetrophyhunt trophyxpose imo kill bear bad sin par kill human elephant lion govmurphy,1601867644868890624,2626064439,en,2022-12-11 09:13:02+00:00
3221,3430,peteregan philipciwf take horn list desire ivory,1601866552399515648,1600900638,en,2022-12-11 09:08:41+00:00
3222,3431,andibeth pricelessnatureloversan incredible moment different specie interact animal ,1601856646040387586,1867750286,en,2022-12-11 08:29:20+00:00
3223,3432, trade cant blame he adorbs,1601856484652077056,1565211963931639808,en,2022-12-11 08:28:41+00:00
3224,3433,theyouthscat morning reminder chinais emissionshas wet marketsis home covidis cause tiger ,1601855563842863104,1250565558963240964,en,2022-12-11 08:25:02+00:00
3225,3434, morning reminder chinais emissionshas wet marketsis home covidis cause tiger pangolin disappearand foot impoant piece land world americaclimatescam,1601855456489754624,1487852874826661894,en,2022-12-11 08:24:36+00:00
3226,3435,afamcdk need publicize fact notion horn medicine mytholpejeta olpejetaescapes helpingrhin,1601855428824125440,829410490476539908,en,2022-12-11 08:24:29+00:00
3227,3436, suspect poacher nabbed possession horn unlicensed firearm ammunition arrivealive crime poach sapoliceservice,1601854147854221313,154453910,en,2022-12-11 08:19:24+00:00
3228,3437,rare jaymielynnecor spaanryan rhisotope wildaidafrica peteswildlife undp wildaid thegef ugwildlife thamima,1601852837931130881,1308011680652197888,en,2022-12-11 08:14:12+00:00
3229,3438,adopt best christmas gift animal loversadopt elephant gift animal lover receive ceificate adoptionthank suppo conservation work,1601851843084181505,400179207,en,2022-12-11 08:10:15+00:00
3230,3439,welcome sanctuaryour project aim help poach help victim scam web protect poach ask community discord,1601849357959106560,1484017058979401735,en,2022-12-11 08:00:22+00:00
3231,3440, new collar record gps fix send location lion elephant park control room lora tower network vhf transmitter help track team quickly safely locate field monitoring use telemetry antenna receiver ,1601849307954438145,466268619,en,2022-12-11 08:00:10+00:00
3232,3441, day conservation research depament team successfully deployed new track device lion white black elephant lion elephant fit gpsvhf collar deployed inhorn vhf transmitter ,1601849295795236866,466268619,en,2022-12-11 08:00:07+00:00
3233,3442,tunajibu alaah kumbe huyu mkenya wonder kill elephant good reason,1601848026678628352,1573309708869443584,en,2022-12-11 07:55:05+00:00
3234,3443,louisa set trial date allege horn possession case schalk abraham steyn dawie groenewald,1601847927323992064,152321068,en,2022-12-11 07:54:41+00:00
3235,3444,lawrencehughes jamesrodriguez record recordsuk mikekillmon billboard remember gambler vision quest soundtrack,1601843883091980289,1292188133501501440,en,2022-12-11 07:38:37+00:00
3236,3445,nikonik arianaswiftiy ammargonewild yous white lana del fan cant talk ish ahead say aint waste time cuz already ,1601834783180394497,1291880843925794817,en,2022-12-11 07:02:27+00:00
3237,3446,kiss love ttradehave give hope many poor hopeless people thank love,1601830920910213120,2164202054,en,2022-12-11 06:47:06+00:00
