,Unnamed: 0,tweet,tweet_id,author_id,lang,created_at
2088,2307,thelifeofmarcus writes positive human intervention animal translocation earnotching necessity maintain remains eahs wild place creature read conservaton wildlife travel,1540761929735704576,214934802,en,2022-06-25 18:20:44+00:00
2089,2308,desireelaverne dickhead good thing hit horn ,1540747339635228673,1237726289513103361,en,2022-06-25 17:22:46+00:00
2090,2309, poach day left world today white less black wildlifematters stoppoaching info ,1540746675353944064,113123625,en,2022-06-25 17:20:07+00:00
2091,2310, unbeaten run game finally come endit bound happen regardless movestonewebelieve charge guy come fully chargedthis fubabasketballfuballmc season thanks paners allintrade pentersarena mukubirasteven,1540744534719594496,1230111963658772484,en,2022-06-25 17:11:37+00:00
2092,2311,pmorris cuba zookeepers celebrate bih rare baby white sarahrudolp ,1540743925249351684,844631388,en,2022-06-25 17:09:12+00:00
2093,2312,mannygrincon rockyknowsbest richozz pretty familiar work big animal kill even chance chase away get close vehicle,1540742586712952832,402979957,en,2022-06-25 17:03:52+00:00
2094,2313, inspire may project month run sta fundraiser protect endanger specie summer choose specie learn threaten survival decide want raise fund get inspire,1540742376775450624,18803554,en,2022-06-25 17:03:02+00:00
2095,2314, horn endanger black woh black market sent vietnamfifteen pound horn found false bottom box,1540739746191667201,1479462507915796481,en,2022-06-25 16:52:35+00:00
2096,2315,team falcon score change african score heresofascore trh fal,1540738337035763712,1495803241283653635,en,2022-06-25 16:46:59+00:00
2097,2316, crime phalaphalafarmgate illicit flow money know gametrophy hunt deal horn tax evasion strategysarstax dont give fuck jail already lessor crime,1540738118986260481,1293803970083913729,en,2022-06-25 16:46:07+00:00
2098,2317,desireelaverne africa old protect reserve home endanger white threat coal miningsaveim,1540736018696925184,2521425488,en,2022-06-25 16:37:47+00:00
2099,2319,christinapushaw thejordanrachel communism playbook work democrat attack american citizen opposition nationalization major corporation ceainly improvement government screw everything touch democrat venezuela live great rest,1540735165290405888,1419814701962350592,en,2022-06-25 16:34:23+00:00
2100,2320,mmodiba true brother frame work someone plant horn work vehicle arrest get fire month truth name clear compensate unfounately turn new offer come back work new company happy,1540733233507102720,1139254653781258241,en,2022-06-25 16:26:42+00:00
2101,2321,zsimayi firepool poach pedicure usmillionzimmillbwpmilland fohthe zondo comm vuyisile ndzeku kwinana mentoor ubabaour parly red drag white shis projectsmy moneyit wud blockbuster,1540732358541950977,3426577011,en,2022-06-25 16:23:14+00:00
2102,2322,natzoo dyks sensitive skinthe white large specie weigh whop kgmost ,1540732269303713793,4448131420,en,2022-06-25 16:22:53+00:00
2103,2324,stormsfollower poach rise luxury home pop mozambican border knpwhenthebuyingstopsso,1540731461485006848,2853542034,en,2022-06-25 16:19:40+00:00
2104,2325,africanews ale new baby white cuba national zoo africanews,1540730205714522112,511546208,en,2022-06-25 16:14:41+00:00
2105,2326,today fully enjoy country cool see crestedcrane sexploreuganda localtourism pearlofafrica,1540723452922908675,4704486262,en,2022-06-25 15:47:51+00:00
2106,2327, natural predator wildcalves sometimes preyed big cat crocodile predator tend avoid adult calf stick close parent poach cause population dwindlesango,1540723037833674752,3588652275,en,2022-06-25 15:46:12+00:00
2107,2328,blackthorndish live absurdist ionesco drama ukrainian woman fight right live woman usa ,1540720723542659074,4853185877,en,2022-06-25 15:37:00+00:00
2108,2329,info slot pandorad juni jampragmaticstarlight princess lion megawaysgates valhallagates olympusgreat wild spellshabanerokoi gatelucky luckylucky foune catpgsoftbuffalo wincandy burstmahjong way jokercaishen rich,1540719594435842049,943830089258512384,en,2022-06-25 15:32:31+00:00
2109,2330,cuba zookeepers celebrate bih rare baby white cuba havana zoo white rarespecies,1540717561125511169,1280459377216905217,en,2022-06-25 15:24:26+00:00
2110,2331,great tour mapoto national park also manage track uslearn ,1540717494897258496,1270695678260449280,en,2022-06-25 15:24:10+00:00
2111,2332,nthabisengms clasycman mpumalanga holiday tour think lifestyle audit urgently need obvious people say straight owner house survive corruption namely poach horn tender coal illicit business long list,1540713696552316928,1312695741341749249,en,2022-06-25 15:09:04+00:00
2112,2333,who charge outfit trojancondomsphillyzoo,1540710111852670978,307976620,en,2022-06-25 14:54:50+00:00
2113,2334,leviparmiter realspikecohen opinion base failure ofprohibitionwar drugswar immigrationsouth african protectionmango vape banrent ceilingsetcwe think aboion wrong simultaneously want create negative externality prohibitive policy ,1540709607131099136,3226659374,en,2022-06-25 14:52:49+00:00
2114,2335,gunner opines robe look unhappy cant suppo kill baby womb mcconnel cheney bush suppoing ,1540702446174867463,1005805939461632000,en,2022-06-25 14:24:22+00:00
2115,2336,trophyxpose representative boast undercover investigator pretty much kill specie elephant lion,1540697158592057346,1034199360907567104,en,2022-06-25 14:03:22+00:00
2116,2337,roarwn subadult male dehorn poacher orang national park protect area assam last month forest depar,1540695138258649094,1034199360907567104,en,2022-06-25 13:55:20+00:00
2117,2338, nepal naturally migrate region reveal camera trap picture winter natural resource conservation,1540694298919948289,905818825328926720,en,2022-06-25 13:52:00+00:00
2118,2339,rickygervais please help protect south africa ofbdr,1540693658336239616,32851522,en,2022-06-25 13:49:27+00:00
2119,2340, glad follow ricky also poach horn poacher disgust ,1540691747915051008,1489982204688351237,en,2022-06-25 13:41:52+00:00
2120,2341,drwillfowlds year old jamie swim suppo conservation easterncape weekend capecoastal grand prix swi,1540691357026504705,1265811674520567810,en,2022-06-25 13:40:18+00:00
2121,2342, year old jamie swim suppo conservation easterncape weekend capecoastal grand prix swim seriesget jamies effos oneoff donation pledge amount second knock personal best,1540689517535019008,869959916,en,2022-06-25 13:33:00+00:00
2122,2343,ale new baby white cuba national zoo africanews,1540689122427387904,30168505,en,2022-06-25 13:31:26+00:00
2123,2344,baby cotswold wildlife park cotswildtweetsanimals photooftheday,1540687593322561537,295116131,en,2022-06-25 13:25:21+00:00
2124,2345,sarahsrio mensamusic wunpinifm there ted talk italian guy say go group save africa plant tomato,1540685105991016448,213364197,en,2022-06-25 13:15:28+00:00
2125,2346,rememberingsudan sudan last male nohern white die march survive last female nohern white najin fatu science race save specie extinction see quote tweet,1540675010863329280,980604866912489472,en,2022-06-25 12:35:21+00:00
2126,2347, land carrier call ball approach call hornet super hornet potential confusion radio plane different size weight matter adopt remove potential confusion,1540674532242907137,36353897,en,2022-06-25 12:33:27+00:00
2127,2348,today cool photomay amanda lee assign strike fighter squadron demo team maneuver fae super hornet oregon international air showthe super hornet know ,1540673792678264833,36353897,en,2022-06-25 12:30:31+00:00
2128,2349,unwokepope human population eahlions elephant leopard africa less elsewherebuffalo cheetah onplanned want child whats wrong idea,1540672467047415808,1282095026588319744,en,2022-06-25 12:25:15+00:00
2129,2350,horni interest aicle fruitbats role play reforest pa africa reforestation,1540670145026084868,912645108239040512,en,2022-06-25 12:16:01+00:00
2130,2351,pitch recent extinction park guest pet clone dodo thylacine passenger pigeon western black nothing bad happens people think consequence human action,1540670088432549888,26069433,en,2022-06-25 12:15:48+00:00
2131,2352,reutersscience zookeepers cuba national zoo especially proud ale pudgy graybrown baby white cero born earli,1540669640015323137,74897126,en,2022-06-25 12:14:01+00:00
2132,2354, caturday hang condo catsoftwitter save endangeredspecies elephant koala savetheamazon,1540665520612970496,982430049025581056,en,2022-06-25 11:57:38+00:00
2133,2355,tonytheauthor kill year slaughter continuesi message ,1540661890392768512,3147447897,en,2022-06-25 11:43:13+00:00
2134,2356,veigowarrior passing away last male nohern white female nohern white alive ,1540659566056091649,1282156446533054464,en,2022-06-25 11:33:59+00:00
2135,2357, zookeepers cuba national zoo especially proud ale pudgy graybrown baby white cero born earlier month outskis capital havana,1540654797606494210,15110431,en,2022-06-25 11:15:02+00:00
2136,2358,jmstone young boris actually probably shoot endanger something,1540650377724547073,735399859977621504,en,2022-06-25 10:57:28+00:00
2137,2359,xleague xexe premier japan kanto conf roundgame group ainzai sexe saitama wild bearsexe,1540650212330332160,1508633904059539457,en,2022-06-25 10:56:49+00:00
2138,2360,video ale new baby white cuba national zoo,1540649758653644803,14557210,en,2022-06-25 10:55:01+00:00
2139,2361,cincinnatizoo fiona already superstar love meet rome,1540645935042240515,1477279599507685383,en,2022-06-25 10:39:49+00:00
2140,2362,simonbloch vietnamese man arrest trading horn ivory shell company police say big,1540640139512229888,468089425,en,2022-06-25 10:16:47+00:00
2141,2363,dogswildlife poach south africa kwazulunatal province far yearthis stagger toll,1540638112677859329,1268509805158817792,en,2022-06-25 10:08:44+00:00
2142,2364, late rare studio conservation travel,1540634305138987008,973866358705475584,en,2022-06-25 09:53:36+00:00
2143,2365,rcreedbalboa bruled themonkees themickydolenz davytweets record billboardchas yep mickey watch episode til death england enamour phrase told record company alternate title market,1540634296649654273,822175086,en,2022-06-25 09:53:34+00:00
2144,2366,manikipi remember chinese guy disclose involvement mahlobos wife poach simply vanished hope he still alive he okay,1540630959489433600,350629430,en,2022-06-25 09:40:18+00:00
2145,2368,help save elephant lion nairobi national park kenya care,1540627599826763776,941721060143190016,en,2022-06-25 09:26:57+00:00
2146,2369, learn south african animal ,1540624624978989056,826481394993995777,en,2022-06-25 09:15:08+00:00
2147,2370,rare bih sumatran brings hope endanger specie protectwldlife wonderful story share worldwide thanks ,1540620570588549120,3387584170,en,2022-06-25 08:59:02+00:00
2148,2371, africa old protect reserve home endanger white threat coal miningsaveimfolozigreenpeaceafricsaveimfoloziallriselegalelisetempelhoffpeoplepower,1540619023204892673,772072890334384129,en,2022-06-25 08:52:53+00:00
2149,2372, africa old protect reserve home endanger white threat coal miningsaveimfolozigreenpeaceafricsaveimfoloziallriselegalelisetempelhoff,1540618447582806017,2314937901,en,2022-06-25 08:50:35+00:00
2150,2373,interview cara mael zoological supervisor buschgardens florida help look world endanger black ,1540617575985561602,41572208,en,2022-06-25 08:47:08+00:00
2151,2374,video footage ale southern white calf born national zoo havana cuba,1540616991081463809,41572208,en,2022-06-25 08:44:48+00:00
2152,2375, late south african comic daily thanks dwuff ricoschacherl ryanotto,1540612900120891392,10174262,en,2022-06-25 08:28:33+00:00
2153,2376,white square lip big forehead long ear eat grassaskariwildlife,1540608197689757696,1358086113202737153,en,2022-06-25 08:09:52+00:00
2154,2377,marionmithamo safaricomplc lewasafmarathon lewawildlife tuskorg white ,1540607841471500288,255407495,en,2022-06-25 08:08:27+00:00
2155,2378,ale whiteceros born earlier month havana earn pride zookeepers cubanationalzoo specimen represent specie include elephant etc zoo favour destination localstrending animal,1540607675385659392,1395765333684674560,en,2022-06-25 08:07:47+00:00
2156,2380,dougryd thanks phil incredible unwavering suppo south africa african cycling qhubeka teamqhubeka,1540596524023009280,1489792909851471874,en,2022-06-25 07:23:28+00:00
2157,2381,thanks phil incredible unwavering suppo south africa african cycling qhubeka teamqhubeka nature purpose bicycleschangelives,1540596439461597184,21417049,en,2022-06-25 07:23:08+00:00
2158,2382,bskillls way woman ever worry get aboion happens africa mating season,1540593856458145792,954367616692482048,en,2022-06-25 07:12:52+00:00
2159,2383, cmpatowarythe curious case census day kaziranga favourite wild life conservation project expense spent fooding,1540591514710974464,1151692699260448769,en,2022-06-25 07:03:34+00:00
2160,2384,kayomuriungi wildaid louisa take responsibility seriously conserve protect ,1540590890820960258,1390372975883526144,en,2022-06-25 07:01:05+00:00
2161,2385,cuba zookeepers celebrate bih rare baby white sarahrudolp jboogiebrown elvislver mnewsince theoralbuffet speaktruth phillynj carolynailg,1540586098887430144,1324584614602616832,en,2022-06-25 06:42:03+00:00
2162,2386,wildaid louisa take responsibility seriously conserve protect ,1540584333156704256,1207222553946791936,en,2022-06-25 06:35:02+00:00
2163,2388,kestrelia saw picture noodle horn want ,1540580566336098305,1424810248225714176,en,2022-06-25 06:20:04+00:00
2164,2390,south africa home world population recent year subspecies white seriously threaten intensive poach save specie john hume owner private farm decide release hundred individual year,1540575720740618241,2815289923,en,2022-06-25 06:00:48+00:00
2165,2391,elephantsfuture vietnam ongoing trade ivory dont promote ivory horn product tourism industry urge,1540575196750413824,1274599584,en,2022-06-25 05:58:44+00:00
2166,2392,vietnam ongoing trade ivory dont promote ivory horn product tourism industry urge,1540574296229249026,903968306683633666,en,2022-06-25 05:55:09+00:00
2167,2393,timeslive get year kill ,1540570845864681472,778315159471259648,en,2022-06-25 05:41:26+00:00
2168,2394, india pilibit reserve work encourage transitory nearby nepal spend time reserve effos extend greateronehorned range conservation,1540568973070086144,519683539,en,2022-06-25 05:34:00+00:00
2169,2395,join rob bank stop poacher track data detox ,1540568055507468288,4120857298,en,2022-06-25 05:30:21+00:00
2170,2396, crash move slowly thicket decide wait nearby midden reward incredible close encounter endangeredspecies big,1540564363605692417,102742942,en,2022-06-25 05:15:41+00:00
2171,2398,great news cuba zookeepers celebrate bih rare baby white,1540554560623607808,41092431,en,2022-06-25 04:36:44+00:00
2172,2400,drilbotposter wife best nickname frogger busta good mother fucker dick thief pica,1540550159318360064,1284246530300489730,en,2022-06-25 04:19:14+00:00
2173,2401,deccanherald zookeepers cuba national zoo especially proud ale pudgy graybrown baby white cero born earlie,1540546618121850880,1338630748895543298,en,2022-06-25 04:05:10+00:00
2174,2402,hodilu namibiathe ministry environment forestry tourism suspect job kill black invest,1540546157012975616,1477465379471388672,en,2022-06-25 04:03:20+00:00
2175,2403,vetpaw holiday bad time poach need extra vigilant protect beauty elephant,1540545774697709568,796774749405925377,en,2022-06-25 04:01:49+00:00
2176,2405,assam gateway noh east land horn mighty brahmaputra world famous assam tea assam tea know strong bright rich full body liquor assamtea indiatea indiantealove indiateaandme,1540541197923790848,2700580021,en,2022-06-25 03:43:38+00:00
2177,2406,talkingkoala moyolloydk gteasts mofavietnam pressdeptmofa thank vietnam much take wildlife traffic seriously,1540537208238907392,3576597853,en,2022-06-25 03:27:46+00:00
2178,2407,ahurschwaz cernovich paul ryans protesterswhy fox board kill itryan weasel,1540533370765148178,1113040141,en,2022-06-25 03:12:31+00:00
2179,2408,therrepo lisamurkowski well quick way poll alaska go soon war monger cheney alaskan arent gon forgive give biden green deal lobby kill alaska oil production,1540527868219891743,1520790405998071810,en,2022-06-25 02:50:40+00:00
2180,2410, black market crime ordinary criminal house break rape etc professional doctor military personnelfor instance poach convince farm murder ,1540520198373089281,936635974905409538,en,2022-06-25 02:20:11+00:00
2181,2411,xexe premier japan kanto conf roundgame group ainzai sexe saitama wild bearsexeflathachinohe liveschedulexexe fibax,1540519981011460097,850873068,en,2022-06-25 02:19:19+00:00
2182,2412,dewhirstadam lovely gold collar horn dino gon evolve son rover get golden ,1540518538791849985,1307791479394402306,en,2022-06-25 02:13:35+00:00
2183,2414,tberrios drscarecrow dodym patriothammer adamtay republicnewyork robcarlson laughtrackitst trippy staceytheghost rolietom cheffijay marilynlavala angryrockbird kcinor eevildebs michaelmm deenakeys mmstuff newzhq papajojotv dbafc krissyb windsandstrings harrymi joehillmusic smrose lauria deplorabletcher kkmoriconi ota beach wildangel westandtheflag xeileen fly carrielea scarlettdear bdonesem falerojr icanplainlysee ralphs rosemar quintrump tannermaze michel wahboom patriotinsf bigdaddyfoy animal rino dimpublican,1540509639779008514,1335344997042950144,en,2022-06-25 01:38:14+00:00
2184,2415,jdgunderson white greenhouselinda lyzl yup self defense try kill ,1540508858694520832,922868437097082880,en,2022-06-25 01:35:07+00:00
2185,2416,cuba zookeepers celebrate bih rare baby white ale pudgy graybrown baby stub place horn see adult,1540507316730048512,20578408,en,2022-06-25 01:29:00+00:00
2186,2417, drscarecrow dodym lorabethann patriothammer adamtay republicnewyork robcarlson laughtrackitst trippy staceytheghost rolietom cheffijay marilynlavala angryrockbird kcinor eevildebs michaelmm deenakeys mmstuff newzhq papajojotv dbafc krissyb windsandstrings harrymi joehillmusic smrose lauria deplorabletcher kkmoriconi ota beach wildangel westandtheflag xeileen fly carrielea scarlettdear bdonesem falerojr icanplainlysee ralphs rosemar quintrump tannermaze michel wahboom patriotinsf bigdaddyfoy democrat arrest crime nation,1540506434856751104,1362786161886953478,en,2022-06-25 01:25:29+00:00
2187,2418,zookeepers cuba celebrate bih rare baby white,1540505768176353282,1534545062822019074,en,2022-06-25 01:22:51+00:00
2188,2419, late rare studio wildlife news thanks layoutdokter abysene fighting wildlife conservation,1540505150401515520,973866358705475584,en,2022-06-25 01:20:23+00:00
2189,2420,andyvermaut andy vermaut sharescuba zookeepers celebrate bih rare baby white thank ,1540504612268085249,86378821,en,2022-06-25 01:18:15+00:00
2190,2421,andy vermaut sharescuba zookeepers celebrate bih rare baby white thank ,1540504017532440582,283604227,en,2022-06-25 01:15:53+00:00
2191,2422,white jdgunderson greenhouselinda lyzl sound cop shoot kill civilian felt danger excuse exe murder fetish,1540503410515947521,1203410749143470081,en,2022-06-25 01:13:28+00:00
2192,2423,savethe kenyan fugitive badru abdul aziz saleh extradite united state face charge traffic narcoti,1540500265354334208,22230837,en,2022-06-25 01:00:59+00:00
2193,2424,sirf villager help maintain zero poach pobitora wls forest official,1540500211168067584,22230837,en,2022-06-25 01:00:46+00:00
2194,2425,savethe world first bond blueprint conservation finance say credit suisse,1540499881416073222,22230837,en,2022-06-25 00:59:27+00:00
2195,2426,nigerianbrother nope idea knew lot lion leopard elephant mistaken antiquity always thought giraffe eastern africa,1540498286779551750,156093974,en,2022-06-25 00:53:07+00:00
2196,2427,indianapoliszoo try new encounter whats ,1540496889795190785,2406859688,en,2022-06-25 00:47:34+00:00
2197,2428,officeninja drbevisaghast spiritgateoz yes year ago guy pet south africa use swim everything little use put head mouth fun anymore,1540495524951781376,1027715215402528768,en,2022-06-25 00:42:08+00:00
2198,2429,afp video cuba national zoo show new baby white ale baby white born june havana stroll ,1540490820540944384,167999129,en,2022-06-25 00:23:27+00:00
2199,2430,akayne noahboat thats wild bro congrats,1540490256658714626,1322346535556911110,en,2022-06-25 00:21:12+00:00
2200,2431,wwf call vietnam tourism industry enforce strong measure prevent foreign tourist buying ivory product endanger wild animal major tourist hotspot read,1540488732847271936,1310607251506249729,en,2022-06-25 00:15:09+00:00
2201,2433,jbctrader jmschattke lpatl say aboions onsaya black nothing parasite,1540488301047476224,17056724,en,2022-06-25 00:13:26+00:00
2202,2434,elitesareevil wsf oldfatweets gerhard stilllooking jamesmelville argument purely emotionalive personally see hunt transform area wildlife haven point zimbabwe gov force black hunt conservancy theyre much safer national park,1540485443510145025,1457493458176778243,en,2022-06-25 00:02:05+00:00
2203,2437, people use amount energy get rid politics instead use fight right able kill baby,1540475070468001795,1524670825135226881,en,2022-06-24 23:20:52+00:00
2204,2438, look jody busch garden endanger black,1540474646587473920,160640883,en,2022-06-24 23:19:11+00:00
2205,2439,mgan kateg kdnerak kellda sweethea need research green plan insurrection policy schumer mccahur dumbs refuse national guard dont remember dont see dont hear get fact straight plz,1540471739657977856,1518032765488357379,en,2022-06-24 23:07:37+00:00
2206,2440,snake weld gloveswildebeest sweep legschimpanzee cute fightlion run forrest runwild boar bacon yes chupacabra find onearmadillo armor as yesgiraffe cant reach head tacklin fuel,1540471518609788928,1075175395845115904,en,2022-06-24 23:06:45+00:00
2207,2441,zoological professional always work save animal wild visit zoo aquarium entrance fee towards conservation effos charlie hoessle former dir stlzoo member global captive action plan,1540469942306217986,1522643960468025347,en,2022-06-24 23:00:29+00:00
2208,2442,nickfondacaro kill yea forgot ,1540466874223304710,968471182809935872,en,2022-06-24 22:48:17+00:00
2209,2444, think gon cryim go zoo tomorrow definitely go take picture,1540459159799357440,1521672073827041280,en,2022-06-24 22:17:38+00:00
2210,2445,ale new baby white cuba national zoo,1540457892200849408,100201871,en,2022-06-24 22:12:36+00:00
2211,2446, surprised horn upside ,1540457640446365696,1462203411345117194,en,2022-06-24 22:11:36+00:00
2212,2447,moyolloydk gteasts mofavietnam pressdeptmofa thank vietnam much take wildlife traffic seriously world leader help stop demand stop trafficker save animal many lion elephant panel,1540455904566321153,1113014239529070593,en,2022-06-24 22:04:42+00:00
2213,2448,late night solo safari show love favorite marine corp veteran overall kill ,1540454831592284166,1444108725510414340,en,2022-06-24 22:00:26+00:00
2214,2449,video ale new baby white cuba national zoo madras tribune madrastribune news breakingnews,1540450876065665024,1379367732383154177,en,2022-06-24 21:44:43+00:00
2215,2450,go zoo get bed night google,1540450631516815360,15958987,en,2022-06-24 21:43:45+00:00
2216,2451,airngblu whats interest there evidence trophy hunt cause extinctionin fact south africa trophy hunt credit save southern white extinctioncan answer simple question kenyan ban,1540447227184906240,701561603267960832,en,2022-06-24 21:30:13+00:00
2217,2452,jblair apompliano characterize destructive power ultimately extinction,1540442555300515841,1399080948210221057,en,2022-06-24 21:11:39+00:00
2218,2453,tsasrolfes conletters societyconbio tcafrica africaresource oppgenrc wildlifeeconomy thanks share hunt tie povey illegal market paramaount reality face,1540441573258698752,107090624,en,2022-06-24 21:07:45+00:00
2219,2454, take care endanger black goody busch garden,1540436093111341058,1522850090905489415,en,2022-06-24 20:45:59+00:00
2220,2455,wild way work,1540432296737734657,841358057703641088,en,2022-06-24 20:30:54+00:00
2221,2456, time old person asks shi mean africa dy,1540431714576637953,1509674929519800339,en,2022-06-24 20:28:35+00:00
2222,2457,newsmax please away stay news sick zoo democrat arent go elect ,1540429846672703488,1512421018677264387,en,2022-06-24 20:21:09+00:00
2223,2459,blackmambasapu horni thank much team highlight work,1540426007630565379,454092288,en,2022-06-24 20:05:54+00:00
2224,2460,horni thank much team highlight work,1540425819583127554,3431180051,en,2022-06-24 20:05:09+00:00
2225,2461,lindseygrahamsc leadermcconnell mcconnell heck voting gun reform pass congress trader ,1540422782927773697,4350033434,en,2022-06-24 19:53:05+00:00
2226,2462,emergency orphan appeal zululand recently receive orphan month old victim poach onslaught thats ripped kwazulunatal suppo emergencyorphanappeal give luckygirl best chance possible,1540422256576196609,519683539,en,2022-06-24 19:51:00+00:00
2227,2465,droz kill baby medical issue doctorpatient include rape baby right live statement get elect run,1540418596911755264,172052751,en,2022-06-24 19:36:27+00:00
2228,2466, world prodmgmt wild find influence authority manage wolf work late fire really highvalue new oppounity hippo high paid person opinion stakeholder ebook,1540418580176547840,1408514406028234754,en,2022-06-24 19:36:23+00:00
2229,2467,conservationna great thread explain link conservation regulate hunt namibia south africa,1540417731907960834,630133224,en,2022-06-24 19:33:01+00:00
2230,2469, mean shes right whole wildlife go extinct thing thats people american basically vote dont stop china impoing horn dust,1540417374603644929,711667461414916098,en,2022-06-24 19:31:36+00:00
2231,2470,replizcheney hey liz dont boy toy investigate riot billion dollar damage people kill police station burn car single word thank god office midterm,1540415232916570112,1505585591227932672,en,2022-06-24 19:23:05+00:00
