,Unnamed: 0,tweet,tweet_id,author_id,lang,created_at
1057,1078,npa want horn trafficker eightyear sentence increase ,1605882741958000640,540270526,en,2022-12-22 11:07:36+00:00
1058,1079,kill profit expose illegal horn trade umcdpau,1605880994061438976,1584776662159446018,en,2022-12-22 11:00:39+00:00
1059,1080, national tiger conservation action plan place peninsula danger tiger malaysia go extinct unlikely extinction cero sabah wwfs christopher wong,1605880840981950465,838397845329719297,en,2022-12-22 11:00:02+00:00
1060,1081,paulgallen last male nohern white die reminder act avoid tragic loss,1605880400055742464,1480612190705143816,en,2022-12-22 10:58:17+00:00
1061,1082,careforwild year old rehabilitate release orphan timbi give bih bull calf thursday december ,1605875497665167360,22230837,en,2022-12-22 10:38:49+00:00
1062,1083,ive already ruffle meka night market wait enter ive day mekas save ,1605874445255512064,446620257,en,2022-12-22 10:34:38+00:00
1063,1084, horn santa gig holiday force incredible hulk step trim tree stuff stock ring sleigh bellhulk marvelcomics comic comicbooks marvelread ,1605874137276112898,1094563764148600832,en,2022-12-22 10:33:24+00:00
1064,1086, giant africa beast happen next wild animal documentary new documentary,1605866860465065989,1590296827731009537,en,2022-12-22 10:04:29+00:00
1065,1087,productsuk kammbar fleetthe hightensile allow steel construction kammbar fleet make strong roof bar system marketcall email today free quote salesvehicleaccessoriesnetvehicleaccessories product,1605865742275969025,106090439,en,2022-12-22 10:00:03+00:00
1066,1088, awesome rplanet mekas night marketafter project come life new team full force finally pay meka ,1605864330637070338,1496812716115304448,en,2022-12-22 09:54:26+00:00
1067,1089, happy soulnatgeotravel conservation white amivitale,1605859525994680322,2583909589,en,2022-12-22 09:35:21+00:00
1068,1090, alive sta century today remain classify critically endanger take action want save wildlife rescue bantrophyhunting,1605856971248308226,84432492,en,2022-12-22 09:25:11+00:00
1069,1091, plight dire study cambridgeuni scientist show horn shrunk size due excessive hunt past century act future generation face devastate loss bantrophyhunting,1605856965950951426,84432492,en,2022-12-22 09:25:10+00:00
1070,1092,sudharamenifs life begets life brilliant capture thanks share madam child give bih mother,1605856145033216005,777279266,en,2022-12-22 09:21:54+00:00
1071,1093,ark ark researcher donna sheppard walk deep aberdare forest ark calgaryzoo mountain forest con,1605851806864576512,1567985359329320962,en,2022-12-22 09:04:40+00:00
1072,1094,memerath miharbi tragicbirdapp lot legend unicorn horn definitely show lol classical myth often use gut meni wonder unicorn possible horse go extinct pretty difficult tell horn skull,1605849247856746496,921732185027108864,en,2022-12-22 08:54:30+00:00
1073,1095,vkjha rare get sight precious moment new life month gestation mother multiple thr,1605849053312339968,1605050654094827521,en,2022-12-22 08:53:44+00:00
1074,1096,ravinwildlife horn mammal specie left world naturephotography kaziranga ,1605846978562125829,1598958579041521664,en,2022-12-22 08:45:29+00:00
1075,1097,sabisabireserve white calf approach interest ran back safety mother grazing calf,1605846510771372032,3299845261,en,2022-12-22 08:43:38+00:00
1076,1099,sabisabireserve curious ever unaware peril lie ahead white calf sign hope specie ,1605842877463924736,3299845261,en,2022-12-22 08:29:11+00:00
1077,1100, pejeta conservancy wildlife sanctuary home world last remain nohern white conservancy work protect conserve wildlifefor booking infotwendekenyacomolpejeta conservation wildlife safari,1605839692632428544,1565324320188121093,en,2022-12-22 08:16:32+00:00
1078,1101,grngvmlin madfights mess get horn,1605839513510547456,1575161023518150656,en,2022-12-22 08:15:49+00:00
1079,1102, big animal south africa verge extinction cero large forebode animaldrawingtutorial drawingtips cero aincontext,1605836502453440514,1394579873520304130,en,2022-12-22 08:03:51+00:00
1080,1103,ryansarai cero elephant glad calf okig thecolossuselephants,1605835761437343744,1427341019897647104,en,2022-12-22 08:00:55+00:00
1081,1104,gokenyaholiday lake nakuru national park best know huge flock flamingo also home substantial population ,1605833563235971072,1581952473710923776,en,2022-12-22 07:52:11+00:00
1082,1105,thehill gettem mikey boy see mitt game played back car salesperson temperament proper smarminess take colins merkowski call car lot get horn great deal,1605833088667242496,1571890664618749953,en,2022-12-22 07:50:17+00:00
1083,1106,lake nakuru national park best know huge flock flamingo also home substantial population lion well many specie animal birdsfor booking infogokenyacomlake nakuru wildlife safari,1605832394505785344,1229398604965699590,en,2022-12-22 07:47:32+00:00
1084,1107,jessops mighty run point new road conservation,1605827493297999873,1034104442386345985,en,2022-12-22 07:28:03+00:00
1085,1108,rhisotope know white calf tend run front mother black calf run mother,1605823941423288321,339036834,en,2022-12-22 07:13:57+00:00
1086,1109,globalelephants enthral project save nohern white raise challenge question scientist debate ethi,1605819488821198848,130759253,en,2022-12-22 06:56:15+00:00
1087,1110, smuggle route south african horn,1605810762995208192,1605274569417412611,en,2022-12-22 06:21:35+00:00
1088,1111,poach convict poacher hand longer sentence south africa national prosecute authority take decision appeal call lenient sentence,1605808855237201920,519683539,en,2022-12-22 06:14:00+00:00
1089,1112,mekas meka night market buzzing,1605808824455151617,1484831153245028355,en,2022-12-22 06:13:52+00:00
1090,1113, friend safari africa omg baby,1605802228547289088,156535267,en,2022-12-22 05:47:40+00:00
1091,1114,metcis brwalsh mzhemingway proven lie killary paid fake dossier paid money clinton,1605800310781403136,932056278708387841,en,2022-12-22 05:40:03+00:00
1092,1115,brwalsh mzhemingway proven lie killary paid fake dossier paid money clinton foundation hater,1605799767279370240,1585920991137497088,en,2022-12-22 05:37:53+00:00
1093,1116,rickyricksmusic jimmy john liautaud own jimmy john murder wild animal lion leopard elephant buy jimmy john sub,1605797024653344769,30691616,en,2022-12-22 05:26:59+00:00
1094,1117,bowsy rickyricksmusic jimmyjohns owner jimmy john murder wild animal lion elephant find somewhere else spend money,1605795230883745792,30691616,en,2022-12-22 05:19:51+00:00
1095,1118,lindseygrahamsc senmikelee lindsay make clear let left step still form demand remember hand shake dont mcconnell didnt receive dont give take bill floor structure ,1605794874191740928,1593790918515195904,en,2022-12-22 05:18:26+00:00
1096,1119,tony park guest blogger murder everywhere today he work thriller set africa also nonfiction book poach war take look view poach warssunshinenoir,1605794759418597376,59830108,en,2022-12-22 05:17:59+00:00
1097,1120,floralbeauty rickyricksmusic owner jimmy john murder wild animal lion elephant find somewhere else spend money,1605794481760075776,30691616,en,2022-12-22 05:16:53+00:00
1098,1121, actually weird human specie drink milk animal dont drink milk zebra,1605791039867985920,1479038632371671040,en,2022-12-22 05:03:12+00:00
1099,1122, mix concern political tweet fed look purple demon as get ream orcs dick enhancement drug make toad poison horn extract,1605789571693830145,939653638045048834,en,2022-12-22 04:57:22+00:00
1100,1123,hidden camera footage show baby javan calf born family world endanger specie indonesialse ujung kulon national park,1605782742947336192,1509736004886069248,en,2022-12-22 04:30:14+00:00
1101,1124, beautiful people many specie push living edge human greed take consciousnessa special frame tricky shot get angle,1605780763697303552,2197386030,en,2022-12-22 04:22:22+00:00
1102,1125,onlyforavatrice horn also hunt horn make keratin still protein make ,1605780104474685440,1604123299973591040,en,2022-12-22 04:19:45+00:00
1103,1126, horn also hunt horn make keratin still protein make fingernail hair savewarriornun,1605778907818594306,1604603229051944961,en,2022-12-22 04:15:00+00:00
1104,1127,watch hidden camera footage show baby javan calf born family world endanger specie indonesia ujung kulon national park,1605778907789148160,15954704,en,2022-12-22 04:15:00+00:00
1105,1128,cero elephant glad calf okig thecolossuselephants,1605774015787929605,1168957317355888645,en,2022-12-22 03:55:33+00:00
1106,1129,hidden camera footage show baby javan calf born family world endanger specie indonesia ujung kulon national park,1605772616467447810,1652541,en,2022-12-22 03:50:00+00:00
1107,1130,walshfreedom monster joe walsh zelenskyy child traffic money laundering backandfoh year democrat clinton obamabidens etc etc etc pedojoeobama biden cant even put sentence together joe heavenly medicate terribly impaired,1605772268532965376,3737291534,en,2022-12-22 03:48:37+00:00
1108,1131,enationwide meet jai first ever baby indian born ireland fota wildlife park enationwide tonight wednesday ,1605771712770887680,1079817917384904704,en,2022-12-22 03:46:24+00:00
1109,1132, remember play piano sing dance sometimes wed jump fence zoo middle night look baby ,1605771044836343808,2828274584,en,2022-12-22 03:43:45+00:00
1110,1133,austinwilde always say get eat breed itand share hole care xxx oneqtpie new vid,1605770100732198912,963267464200044544,en,2022-12-22 03:40:00+00:00
1111,1134,reuters hidden camera footage release indonesia environment ministry show small endanger javan trudge alongside ,1605768745120571393,251574564,en,2022-12-22 03:34:37+00:00
1112,1135,rhisotope wonderful experience see mother baby baby carry hope future tracey,1605766638355513344,1550316429521457152,en,2022-12-22 03:26:14+00:00
1113,1136,raveena tandon bat secure future visit kaziranga national park,1605766313749741570,1010717836556238848,en,2022-12-22 03:24:57+00:00
1114,1137,trump orange buffoon sleep night trump family organize criminal group include kushner son enjoy go africa kill elephant hippo name picture ridiculous grin face getlosttrumps,1605765369741709313,1602078141065105408,en,2022-12-22 03:21:12+00:00
1115,1138,afamcdk trade horn strictly regulate international law identify major threat survi,1605763951551123457,314528206,en,2022-12-22 03:15:34+00:00
1116,1139,clarkconnors get high hope everything get wild,1605762530890158083,334469316,en,2022-12-22 03:09:55+00:00
1117,1140,endanger white cell turn sperm egg stem cell stemcells,1605761337262592002,14461362,en,2022-12-22 03:05:11+00:00
1118,1141,bad market witch caught turn bird human ,1605758328772386818,1564289180926377988,en,2022-12-22 02:53:13+00:00
1119,1142,timrunshismouth pocket line tax money democrat want send much money often get piece pie dont know pay lot tax year kill ,1605757970192642048,1600135953527590912,en,2022-12-22 02:51:48+00:00
1120,1143,derpathesherpa jacobwazoo get cross elephant hell know,1605756839714381824,629452066,en,2022-12-22 02:47:18+00:00
1121,1144,zukosmama mother cat go look gravity friend double triple chin as lizzo rid epic michael jackson level botch bbl,1605754664577748992,790551524,en,2022-12-22 02:38:40+00:00
1122,1146,lindseygrahamsc zelenskyyua graham way bad democrathe trader,1605751501510639616,884431685542174720,en,2022-12-22 02:26:06+00:00
1123,1147,lumarkyt field trip zoo grademom volunteer get exhibit dont worry theyll attack see purplemy friend wear purplei still laugh hysterically day,1605749776364060673,1296895848551534596,en,2022-12-22 02:19:14+00:00
1124,1148,congratulation bishop alemanys national intent signees today tapaatoutai arizona olivia carson elmhurst happy student coach family,1605746646595223552,455530550,en,2022-12-22 02:06:48+00:00
1125,1149,reutersasia watch hidden camera footage release indonesia environment ministry show small endanger javan trudge ,1605744377870946304,310942721,en,2022-12-22 01:57:47+00:00
1126,1150,hubbell ldrsen suppo demo bill schumer pelosi instead demand wait repubs take ,1605743378058170368,1521590621462482944,en,2022-12-22 01:53:49+00:00
1127,1151,yr zoo business know talk never stand male,1605741313642532864,4026294013,en,2022-12-22 01:45:37+00:00
1128,1152,behoodabanana yonatansorry west many dont bath regularly believe witch doctor nonsense horn pangolin scale medically beneficialthey literally fingernail accept behavior,1605735453918912512,1522593795296145409,en,2022-12-22 01:22:19+00:00
1129,1153,marionawfal hate division country easy manipulate population take absolute power democrat several people wake america cease exist,1605734377467551744,1514703776791339013,en,2022-12-22 01:18:03+00:00
1130,1154,sirf monitoring crucial component protection orphan pumpkin thrive today thanks mon,1605733555060948997,22230837,en,2022-12-22 01:14:47+00:00
1131,1155,sirf indian police arrest want poacher,1605733336462376962,22230837,en,2022-12-22 01:13:55+00:00
1132,1156, bird horn head super coolthe ring tail lemur cute lemur chill island couldnt hop tree escape,1605732914381086722,1192891309780078593,en,2022-12-22 01:12:14+00:00
1133,1157,enjoy unlimited entry australia zoo stay dont forget say gday mighty african savannah youre lucky catch glimpse cool mud wallow arent majestic,1605732012848971778,1506035463949529095,en,2022-12-22 01:08:39+00:00
1134,1158,extoions corrupt agenda ignore need help country specifically hate american fuck biden admin fuck ukraine zelenski fuck thr gop maga hope kill ,1605731262513061889,1534374885392363521,en,2022-12-22 01:05:40+00:00
1135,1159, main ukraine thug give speech nutty nancy blow kiss commie congress applaud wont secure border worry ukraineshell demand store offshore well print insanity,1605726799660404736,1492301793077780482,en,2022-12-22 00:47:56+00:00
1136,1160,cool hornbill head look horn cause bird call cero hornbill,1605724297363742720,2406859688,en,2022-12-22 00:38:00+00:00
1137,1161,sorryall piss offand omnibus bill mcconnell croonies voting also elect work behalf kill financially destory country,1605722358290923520,1591871410129043458,en,2022-12-22 00:30:17+00:00
1138,1162, get peep game bet as money go ukraine money go democratic pocket president pocket trader pocket still money ukraine big high fist bum ukraine ,1605720912220889091,1527786824546017280,en,2022-12-22 00:24:32+00:00
1139,1164, baby endanger javan caught camera almost time size ujung kulon national park indonesialse,1605719424442322944,1509736004886069248,en,2022-12-22 00:18:38+00:00
1140,1165,reutersasia watch baby endanger javan caught camera almost time size ujung kulon ,1605718751189483520,225618759,en,2022-12-22 00:15:57+00:00
1141,1166,watch baby endanger javan caught camera almost time size ujung kulon national park indonesia,1605718510021263360,15954704,en,2022-12-22 00:15:00+00:00
1142,1167,dont let misunderstood international hit international hit nowplaying,1605716204995235840,108455155,en,2022-12-22 00:05:50+00:00
1143,1168,centleonie sheldricktrust probably elderly victim poacher sheldrick trust rehabilitates elephant many baby left next dead mother,1605714601177485312,785956161870848000,en,2022-12-21 23:59:28+00:00
1144,1169,day spiky grey triceratops least think triceratops brow horn amissingmouse say try ,1605714504855207937,1137068444275412992,en,2022-12-21 23:59:05+00:00
1145,1170,moz thats name thats fursona speciesreal name know surelate dinner know food,1605713973604716544,1194450013881020422,en,2022-12-21 23:56:58+00:00
1146,1171,mzhemingway wildbillnc democrat war monger want war never end,1605713021627559936,1303838277305212928,en,2022-12-21 23:53:11+00:00
1147,1172, baby endanger javan caught camera almost time size ujung kulon national park indonesia,1605712218682687489,1652541,en,2022-12-21 23:50:00+00:00
1148,1173,exprofundis look dont put iconography manufactorum get strip reassemble heavy bolter second kill ork big chainsword cut slack able draw perfect raven close enough,1605706858643087361,1216622573620015109,en,2022-12-21 23:28:42+00:00
1149,1174,reuters indonesia environment forestry ministry release rare video show javan cero calf walk next offic,1605705998311706625,977993590201729024,en,2022-12-21 23:25:17+00:00
1150,1175, go zoo today get bricked ,1605700136490848258,18206880,en,2022-12-21 23:01:59+00:00
1151,1177,breitbanews screw border let fentanyl china kill kid way bidens butt kisser,1605697197487652864,1066697503045820416,en,2022-12-21 22:50:18+00:00
1152,1178,cnn black critically endanger southern white threaten photographer decide take beautiful,1605696617801097216,194190424,en,2022-12-21 22:48:00+00:00
1153,1179,take enough ambien kill male mating season last night feel brand new fellow insomniac,1605695749521412097,468762226,en,2022-12-21 22:44:33+00:00
1154,1180, first step make nohern white gamete process know vitro gametogenesis derive nohern white egg sperm labjanstejskalcom verazywitza,1605693940211933184,840469669551124480,en,2022-12-21 22:37:22+00:00
1155,1181,hope exists however use assist reproductive technology create nohern white embryo laboratory help southern white cero surrogate mother closely related sister specie give bih new calf,1605693937305649153,840469669551124480,en,2022-12-21 22:37:21+00:00
1156,1182,save nohern white cerosso instead white elephant christmas year white researcher osakaunive mdcberlin take impoant step possibly save mighty beast brink,1605693933664641029,840469669551124480,en,2022-12-21 22:37:20+00:00
1157,1183,lavernspicer home piece take rest democrat mother keep take money sack ,1605693185094664192,1577813856595877894,en,2022-12-21 22:34:22+00:00
1158,1184,yet evidence need domestic ban ivory horn trade need close loophole allow illegal horn continue circulate,1605691474854969344,1582961573143846913,en,2022-12-21 22:27:34+00:00
1159,1185,clarkconnors youre wild,1605688493878808577,266250217,en,2022-12-21 22:15:43+00:00
1160,1186,marshablackburn right democrat spending people money try president trump instead represent people concers hunter laptop proof biden family crime national security issue doj illegal act,1605677573270298639,1586594878208806912,en,2022-12-21 21:32:20+00:00
1161,1187, national committee,1605674381023141888,1518982088950747136,en,2022-12-21 21:19:39+00:00
1162,1188,marlyce say maybe lose horn finally see,1605672620959186945,1586012430941192195,en,2022-12-21 21:12:39+00:00
1163,1189,ddyer rage quit game trade couldnt get past bos battle week anger,1605671779418005504,1050788959469690880,en,2022-12-21 21:09:18+00:00
1164,1190,kinjeketile kenya fascinate isnt try kill youre normal thing go majestic ,1605670311956881409,3001784793,en,2022-12-21 21:03:28+00:00
1165,1191,ksafricahack cbthunting peteregan henrysmithuk conservativeawf defragovuk sirrogergale edgoncalvescbth need flash endanger get fact straight even comment back echo chamber animal hater,1605669345840996354,1539846883,en,2022-12-21 20:59:38+00:00
1166,1192,immigrant song lead zeppelin mothership remastered atlantic nowplaying,1605669023886168065,108455155,en,2022-12-21 20:58:21+00:00
1167,1193,cite run africageo decision take recent cite convention regard number iconic specie include,1605668178499100680,519683539,en,2022-12-21 20:55:00+00:00
1168,1194,return bring nohern white back extinction socialimpact guardian,1605664895256649731,1155442659521105920,en,2022-12-21 20:41:57+00:00
1169,1195,monicacrowley marionette financial caelsusa world deep state wef ccp disaster american world population understand lot constituent still suppoing dinosaur maybe suppoers brainwash,1605661868714074112,1520072792221401089,en,2022-12-21 20:29:55+00:00
1170,1196, sure mbalimcdusts proposal poach adopt congress amendment floor contact additional research,1605660143751860225,24548187,en,2022-12-21 20:23:04+00:00
1171,1197,watch hidden camera footage release indonesia environment ministry show small endanger javan trudge alongside almost time size muddy terrain protect ujung kulon national park java island,1605658112186322959,15954704,en,2022-12-21 20:15:00+00:00
1172,1198,iusedtobeaduck go saw zoo,1605655670346420225,1504938534892974083,en,2022-12-21 20:05:18+00:00
1173,1199,kcreospeedwagon santa trade sleigh speedwagon listen reos rockin take holiday classic ill home ,1605655352204087296,2739379628,en,2022-12-21 20:04:02+00:00
1174,1200, mellowshade mammoth sabretooth tiger ankylosaur far ive see deer think stock forever,1605654686538862604,1419526694566866947,en,2022-12-21 20:01:23+00:00
1175,1201,hidden camera footage release indonesia environment ministry show small endanger javan trudge alongside almost time size muddy terrain protect ujung kulon national park java island,1605651820549967876,1652541,en,2022-12-21 19:50:00+00:00
1176,1202, common refrain cite summit country pay conservationespecially elephant require significant funding protection poachersthe discussion paicularly fraught yearcitescop,1605647573376802817,535966577,en,2022-12-21 19:33:07+00:00
1177,1203, meeting attend country november reaffirm international commitment ban crossborder sale almost elephant ivory horn strengthen protection many animal popular exotic pet tradecitescop,1605647565315198976,535966577,en,2022-12-21 19:33:05+00:00
1178,1204, endanger nohern white bring back brin,1605647559208632321,4116801917,en,2022-12-21 19:33:04+00:00
1179,1205,marklevinshow true devil horn ,1605644948606312448,1587490352545419264,en,2022-12-21 19:22:41+00:00
1180,1206,lbattle happy holiday youve kill whole year real,1605640398650544128,1489986980079407110,en,2022-12-21 19:04:37+00:00
1181,1207,gelloh jamesrodriguez madonna record recordsuk mikekillmon first time heard vogue actually video,1605640152893648896,16263931,en,2022-12-21 19:03:38+00:00
1182,1208,ciconn jamesrodriguez madonna record recordsuk mikekillmon let say need single stream dub,1605640094341160960,16263931,en,2022-12-21 19:03:24+00:00
1183,1209,jimjordan dam kill shame mcconnell graham ,1605638624346718209,1599500278486671361,en,2022-12-21 18:57:34+00:00
1184,1210,dear graduate generation believe seek employment government probably invest real estate today government job scarce white therefore urge utilise skill competency youve acquire uplift ,1605638526023786497,199622255,en,2022-12-21 18:57:10+00:00
1185,1211, know horn attach skull actually compact mass hair continue grow animal lifetime hair nail protectnature naturephotographer bbceah wildlifeconservation mountaingorillas,1605638471820800000,524381778,en,2022-12-21 18:56:57+00:00
1186,1213,jamesrodriguez madonna record recordsuk mikekillmon let say need single stream dub edits mix remix single felt still age stone half remixes bravo vogue fan,1605637159679033369,1505438117381259267,en,2022-12-21 18:51:44+00:00
1187,1214,conservation effos protect cero population include effos reduce demand horn enforce law poach illegal trade educate public impoance conserve specieshelpings,1605636755532677133,973910373136064512,en,2022-12-21 18:50:08+00:00
1188,1215, demand horn driven largely consumer asia use traditional medicine status symbol,1605636729934848000,973910373136064512,en,2022-12-21 18:50:02+00:00
1189,1216, trade horn strictly regulate international law identify major threat survival cero population regulation illegal poach horn remains major problem paicularly africa olpejetaescapes,1605636706991869952,973910373136064512,en,2022-12-21 18:49:56+00:00
1190,1217,dineshdsouza guy treason office trader need remove immediately position screw america long time others,1605636201351852032,1453509351411310593,en,2022-12-21 18:47:56+00:00
1191,1218, eone enationwide watch abcassin visit fota wildlife park meet director sean mckeown ranger main hear ireland first ever baby indian call jai run first christmas park,1605632327505235968,48388480,en,2022-12-21 18:32:32+00:00
1192,1219,wtfbobknows pattymurray state allow money raise side state use election stop con demand state stop dark money come state super liz ran lose account people ,1605629350396985344,1586012430941192195,en,2022-12-21 18:20:42+00:00
1193,1220,list traitor photo cindyhydesmith chuckgrassley rogerwicker tomcottonar marcorubio exactly inflation high protection southern border dump money ukraine pork spending,1605624366951043072,1602414124989878288,en,2022-12-21 18:00:54+00:00
1194,1222,saleimage garry holmesdate address farwell stmarket newton asset type multifamilybuyer capital advisorsseller albemarle realty corpbroker garry holmes rview post instagram,1605620863860080641,1313221084452323328,en,2022-12-21 17:46:59+00:00
1195,1223,savethe hluhluweimfolozi park know place conservation success due impoance southern white ,1605618488109780992,1019944680748978178,en,2022-12-21 17:37:33+00:00
1196,1224,planet poach africa saw significant decrease strict covid lockdown restriction loosen,1605618207825412098,1019944680748978178,en,2022-12-21 17:36:26+00:00
1197,1225, corruption manifest illegal horn supply chaintake look new visual guide produce tnrcproject understand vulnerability exist measure take mitigate risksusaidenviro wwfus usaid,1605616708940488704,285049799,en,2022-12-21 17:30:28+00:00
1198,1226,catherine black cow give mock charge chango bull calf follow close calf month old look strong healthy special sight see black calf sign hope future specie,1605614584651456512,1381013077424893953,en,2022-12-21 17:22:02+00:00
1199,1227,thutch arizona land big offensive lineman tapaatoutai make wildcat,1605613118926688256,29522528,en,2022-12-21 17:16:13+00:00
1200,1228,arizona land big offensive lineman tapaatoutai make wildcat,1605613070939590663,719551104766205952,en,2022-12-21 17:16:01+00:00
1201,1229,mangle miharbi tragicbirdapp arent focus run fast theyre beefy apex predator therefore horn work weapon kill prey horse turn mid run defeat purpose whole run thing likely result death,1605609533790773248,1440311044010741763,en,2022-12-21 17:01:58+00:00
