,Unnamed: 0,tweet,tweet_id,author_id,lang,created_at
2960,3227,mantatequeeneth dont want use dont benefitlook even elephant hornsits utter nonsenseafrica wake ,1539180253955997696,1285666318474240011,en,2022-06-21 09:35:43+00:00
2961,3228, ever heard disposable vapethis kind vape pretty popular marketlets see specificationspuffs puffsbattery mahejuice capacity mlcharging typeccontents quick link,1539174591469260800,1135480579611275264,en,2022-06-21 09:13:13+00:00
2962,3229,fighting arrest come week ezemvelo kzn wildlife repoed wouldbe poacher arrest different ,1539173885693808642,4016131451,en,2022-06-21 09:10:25+00:00
2963,3230, sensitization programme local villager organise aaranyak collaboration pobitora wls authoritythe relevance fringe villager suppo highlight maintain zero poach trend pobitora,1539172706159140864,44861089,en,2022-06-21 09:05:44+00:00
2964,3231,nytimes abeg wot rihno plso live human house abii jst wish black brother try retrace step back africa lot ungoverned space house lot come back home clear want ,1539171501093568512,495375516,en,2022-06-21 09:00:56+00:00
2965,3232,impact unitedwildlife taskforces suppoed law investigation contribute trafficker arrest played key role disrupt major international ivory horn heroin syndicate east africa princewilliamat,1539170938586927106,1385932781755240448,en,2022-06-21 08:58:42+00:00
2966,3233,spot stupiditytimestwo least sentence health benefit believe similar product derive horn work blood thinner act aphrodisiac ease pressure endanger ,1539167415946321920,1302320555861905412,en,2022-06-21 08:44:42+00:00
2967,3234,swindonqueso wonderful day cotswildtweets many amaze thing love calf,1539166340686270469,173587934,en,2022-06-21 08:40:26+00:00
2968,3235,chinese demand traditional medicine sent poacher hunt african animal pangolin humbler creature threaten donkey gelatin make donkey skin increasingly sought china middle class,1539166233207132160,1391727064810590225,en,2022-06-21 08:40:00+00:00
2969,3236, national park see increase poach incident recent week include discovery carcass shifeta say kashihakumwa currently head antipoaching unit base windhoek deployed immediate effect security measure,1539163503914848258,1452923911126110214,en,2022-06-21 08:29:10+00:00
2970,3237,conservation botswana serviceisuniversal princeharry,1539163061713522690,3406586002,en,2022-06-21 08:27:24+00:00
2971,3238,talkingafrica nodealfornature staers,1539162408865996803,1208850988943183873,en,2022-06-21 08:24:49+00:00
2972,3239,therealpro nodealfornature talkingafrica iucn obctanzania suluhusamia paulkagame isnt interest africanparks ,1539162051679072256,1053160416023588864,en,2022-06-21 08:23:24+00:00
2973,3240,wupengmfachina ambmulamula mfatanzania long china offer lend money extoionate interest rate encourage poacher murder elephant ivory horn send prisoner sta small business marry beautiful woman create new chinese race welcome xhnews,1539159819222933505,503742130,en,2022-06-21 08:14:31+00:00
2974,3241,chinese demand traditional medicine sent poacher hunt african animal pangolin humbler creature threaten donkeysjacadrive,1539158734945112064,889755141133524992,en,2022-06-21 08:10:13+00:00
2975,3242,nodealfornature talkingafrica iucn obctanzania suluhusamia paulkagame isnt interest africanparks president prince harry jointly manages akagerapark rdbrwanda last year together south african authority smuggle white akagera national parkthis park create belgian gvt ,1539157450338754560,1696780987,en,2022-06-21 08:05:06+00:00
2976,3243, help lilly please consider make donation keep warm baby orphan orphan conservation wildlife animal lilly lilibet donate,1539153201341030400,1049906836567146496,en,2022-06-21 07:48:13+00:00
2977,3244,bohemiaafair gringograss bitchen predator mouth see horn devil unicorn majestic antler spider web mouth classic zombie fabulosa cosmic light eyescaterpillar eyebrow dragonfly wing eyelash,1539152582022938624,1465211974770249731,en,2022-06-21 07:45:46+00:00
2978,3245,vietnamese longnose snake rat snake even look venomous theyre nonvenomous colubrid different rat snake apa oddlooking unicorn nose purpose horn unknown,1539151601490808832,1174222645082165249,en,2022-06-21 07:41:52+00:00
2979,3246,juliedutto breeder release back wild year,1539149530679083009,1372426416,en,2022-06-21 07:33:38+00:00
2980,3247,levimor trippwho spider man dick whilst run people kill people sta film,1539147731717050370,1409550127644217352,en,2022-06-21 07:26:29+00:00
2981,3249,eianews namibia allege poacher arrest connection poach etosha national park,1539146902238810114,1485525538265575428,en,2022-06-21 07:23:12+00:00
2982,3250,euinsouthsudan radiomiraya eyeradiojuba suppo south sudan wildlife paint ,1539145730538995719,1473250171643437057,en,2022-06-21 07:18:32+00:00
2983,3251,stellenbosch university pioneer study aid kruger park conservation effos,1539137182182649857,73707872,en,2022-06-21 06:44:34+00:00
2984,3252,climateben specie risk extinction include world iconic animal gorilla big cat ,1539135454435586048,2409414559,en,2022-06-21 06:37:42+00:00
2985,3253,adamkinzinger countryfrst gopleader dont agree anyone threaten family fair game need democrat destroy great nation lock step aint america first america last say need know trader,1539135089321328645,1516190394576515080,en,2022-06-21 06:36:15+00:00
2986,3254,kruise leeming sho motivation confidence chase goal club international level he prim big finish season,1539132091178397696,188340432,en,2022-06-21 06:24:20+00:00
2987,3255,next year marvel legend put endanger specie list sony picture paul giamatti say hello aleksei systevich,1539130274822467585,1020516507594391557,en,2022-06-21 06:17:07+00:00
2988,3257,suespurgin make well tomorrowthe wild table love world endanger wildlife include koala ,1539125500991373317,1293510025680478208,en,2022-06-21 05:58:09+00:00
2989,3258,conservationist kenya pejeta conservancy try save nohern white extinction use ivf theyre work world last female specie nohernwhite,1539125209696854016,869959916,en,2022-06-21 05:57:00+00:00
2990,3259,aiim juliussmalema eff reacts everything eff reacts cat go meow eff reacts athi scratch back yeah well justified reaction hornless poach name zondo seem something suspicious late release repo,1539125040142290944,1445418799591796738,en,2022-06-21 05:56:19+00:00
2991,3260,nohern white look incredible effos make save nohernwhite extinction head paners olpejeta,1539124706497937408,519683539,en,2022-06-21 05:55:00+00:00
2992,3261,mandy also mother child ocean charity swim raise fund project assist wildlife personnelconservation ,1539123196452028416,905818825328926720,en,2022-06-21 05:49:00+00:00
2993,3262,yall upset musk money yall also people demand wouldnt share form appreciation help theoretical scenerio yall say enough ,1539122745363021825,1449414251886649352,en,2022-06-21 05:47:12+00:00
2994,3263,myclipastore safari animal clipa lion giraffe hippo zebra elephant antelope wild life jungle commercial use subl,1539117040484683776,1475469966,en,2022-06-21 05:24:32+00:00
2995,3264,calebsgay philipj onestrangedaisy thekevingeiger really retard dont even know enact mean zoom circle want show ignore texas federal vaccine mandate yeah do say deny deny deny typical liberal tbh cant wait open season ,1539113542955290624,855490665626705921,en,2022-06-21 05:10:38+00:00
2996,3265,well last southern white somebody send baby back kenya build population,1539112283284152321,163979366,en,2022-06-21 05:05:38+00:00
2997,3266,bonnedebod horn seize great work do involve,1539111847240126464,185034334,en,2022-06-21 05:03:54+00:00
2998,3267,hell news day kraven hunter longer want kill craven hunter want kill rinos,1539107047010144257,3872004219,en,2022-06-21 04:44:49+00:00
2999,3268,sandiegozoo visit zoo today ask told move safari park found girlfriend mate happy savethes,1539107029830225920,31626156,en,2022-06-21 04:44:45+00:00
3000,3269,sharrond lunacy use horn,1539106914407161856,974701149667414016,en,2022-06-21 04:44:18+00:00
3001,3270,lancereddick thought talk hunt animal really weird he stand people bursting house hunt peoplewith gun whole thing weird wait even endanger wordplay wrong ,1539105260471521280,2491882626,en,2022-06-21 04:37:43+00:00
3002,3271,author note make joke endanger specie see greitens decide democratics name dinos get similar treatment,1539104883462250496,1054860611828490240,en,2022-06-21 04:36:14+00:00
3003,3272,flicc yes wide thickbodied snake theyre surprisingly good swimmer poor climber tree habitat gaboon viper viper ground snake pattern help blend rainforest floor,1539097883718275072,1174222645082165249,en,2022-06-21 04:08:25+00:00
3004,3273,namibia eleven carcass discover etosha national park savethes namibia etosha,1539097543589744642,19973494,en,2022-06-21 04:07:04+00:00
3005,3274, kill game show there specific reason knew horn make keratin,1539097263544455171,99807274,en,2022-06-21 04:05:57+00:00
3006,3275,smetransam brand bulk package ginseng macayellow mulberry concentrate goji red datebeing adveised male vitality booster tea basically horn dust tier ,1539095917629952001,2739591097,en,2022-06-21 04:00:36+00:00
3007,3276, rescue last year probably fate kill shelter avi didnt step baby desperate need surgery vet bill enormous need lifesaving surgery please donate help boy abkc,1539095277545603072,421780681,en,2022-06-21 03:58:03+00:00
3008,3277,gtconwayd maybe get horn as,1539092229083435009,314200528,en,2022-06-21 03:45:57+00:00
3009,3278,jcesq twesq poacher also played paul giamatti,1539091184555114497,29643695,en,2022-06-21 03:41:47+00:00
3010,3279,franklinaire twesq kill poacher hmmm okay back ,1539090748443795456,259890208,en,2022-06-21 03:40:04+00:00
3011,3280, accidentally watch become unendangered ,1539084885847117825,135701773,en,2022-06-21 03:16:46+00:00
3012,3281,yutytyrant truth give realistic view behavior animal modern day herbivore hipposelephantss even water buffalo hesitate attack even kill feel threaten,1539084466127257601,1460812570051457024,en,2022-06-21 03:15:06+00:00
3013,3282,disgust man arrest terrorism threaten shoot endanger specie threaten shoot people consider bad ,1539084040447283206,2944504058,en,2022-06-21 03:13:24+00:00
3014,3283, hid cave visit today cincinnati zoo wonder teamkentucky americafirst,1539082638484553730,1353165646750748672,en,2022-06-21 03:07:50+00:00
3015,3284, stream kill shark stress sweat tear woh ,1539077818524389376,1245627342677929984,en,2022-06-21 02:48:41+00:00
3016,3285,shannonrwatts endanger specie poach illegalon par message suppose,1539076192069947393,459489614,en,2022-06-21 02:42:13+00:00
3017,3286, texas gop lose mind extreme look religious cult staing feel unsafe say hunt say kill people scar doesnt feel american,1539075717337468933,1365413374033494016,en,2022-06-21 02:40:20+00:00
3018,3287,fromthevault continue sho new series highlight ivory crisis cause elephant poach trophy huntingthis broken horn woh foune poacher circa moamin legend elephant ivory poach kenya africa trophy hunter kill,1539075193263595521,323101604,en,2022-06-21 02:38:15+00:00
3019,3288,mattyglesias commodity pricing crude oil determines pricing petrol diesel even thoughthey different demand different supply cant molecularly crack otherdoes blue run change pricing gasify petroleum day,1539074634812903425,1318588338794827778,en,2022-06-21 02:36:02+00:00
3020,3289,roxieiswildx gore,1539069932700217345,701251401381326848,en,2022-06-21 02:17:21+00:00
3021,3290, breeder release back wild year wildlifefocus southafrica wildlife conservation poach,1539068361446924293,54182296,en,2022-06-21 02:11:06+00:00
3022,3291,great communication final repo say andrew google summitwebmarketing,1539067556106866689,2255165954,en,2022-06-21 02:07:54+00:00
3023,3292,matt incredibly friendly thorough say mallory google summitwebmarketing,1539067550721445888,2255165954,en,2022-06-21 02:07:53+00:00
3024,3294,roxieiswildx gore count,1539061836062007296,37749927,en,2022-06-21 01:45:10+00:00
3025,3295,lanyematthew ohh youre gon crush crawfish gon blast hornet tunnel neon tiger even,1539061526430044160,1180993717047566337,en,2022-06-21 01:43:56+00:00
3026,3296,bennyjohnson reminder cop enforce law dont serve protect protection vote antigun ,1539058098152919040,118766836,en,2022-06-21 01:30:19+00:00
3027,3297,nprpolitics know reference he meaning african lot roam state,1539056890709172224,756192261755375616,en,2022-06-21 01:25:31+00:00
3028,3298, late rare studio wildlife news thanks hernangraffe wildlife conservation,1539055597819133952,973866358705475584,en,2022-06-21 01:20:23+00:00
3029,3299,wild baby,1539055014546575361,31690464,en,2022-06-21 01:18:04+00:00
3030,3300,hey stupid gop extinction list murder trump boy father told manly,1539052230594002944,1450321562620424194,en,2022-06-21 01:07:00+00:00
3031,3301,walshfreedom appreciate comment penny lie lie nut case encourage kill animal,1539049967087669248,2189295492,en,2022-06-21 00:58:00+00:00
3032,3302,kattykay hey stupid gop extinction list murder trump boy father told manly,1539048522133016576,1450321562620424194,en,2022-06-21 00:52:16+00:00
3033,3303,kattykay wonder mother told never open mouth know stupid dude come thats clue trump son murder animal africa,1539048427014672385,1450321562620424194,en,2022-06-21 00:51:53+00:00
3034,3304,attention trump suppoersa rino thing please take closest zoo,1539047678356533248,1397183038312747008,en,2022-06-21 00:48:55+00:00
3035,3305,werailurophiles runtentaind twitter asshole go show zoo somewhere prewritten manifesto told shoot ,1539047111685046273,1397183038312747008,en,2022-06-21 00:46:40+00:00
3036,3306,suppress pb nature episode reveal ground horn wonder one health,1539046975642951680,1111737761713799168,en,2022-06-21 00:46:07+00:00
3037,3307, yeah agree logo horn fantastic design,1539044288906018816,388591218,en,2022-06-21 00:35:27+00:00
3038,3308,butterfly know also rape kill grown ,1539044259143331841,2757125954,en,2022-06-21 00:35:20+00:00
3039,3309,svayken ive work game park africa see charge pierce oveurn vehicle see elephant step crush scary stuff,1539044256509177856,391300402,en,2022-06-21 00:35:19+00:00
3040,3310,ericgreitens btw numbnuts actually endanger specie list,1539040152219172864,1140684856034320386,en,2022-06-21 00:19:00+00:00
3041,3311,twitter say violates rule public still see say guy get actual horn straight as take ,1539038962165157896,2993700860,en,2022-06-21 00:14:17+00:00
3042,3312,travlingoutlook chitwannationalpark nationalpark graze Nepal land hundred diverse flora fauna includ,1539032612781494272,324221690,en,2022-06-20 23:49:03+00:00
3043,3313,namibia tightens security etoshanationalpark poacher continue prey ,1539032353263214595,1374862837,en,2022-06-20 23:48:01+00:00
3044,3314,foxnews want actually speak people first open mouth friend nationality say time voter id democrat election home clueless,1539031335922188288,1520371925595348995,en,2022-06-20 23:43:58+00:00
3045,3315, end najin yearold mother finally retire breeding leave daughter fatu keep good fight alone save specie genebut know nohern white nohern squarelipped left ,1539030691345735683,2545576855,en,2022-06-20 23:41:25+00:00
3046,3316,njpwglobal wild stone pitbullafter pair war korakuen tonight clark connors tomohiro ishii meet tomorrow,1539027735804366848,1498099606013501441,en,2022-06-20 23:29:40+00:00
3047,3317,fivefoweeting husky unicorn horn ivesuddenlyrealized,1539026536262782977,2979171304,en,2022-06-20 23:24:54+00:00
3048,3318,horni awesome drwillfowlds action teach vetsgowild student buffalo relocation wildlifevets conservation,1539025934740819969,3002678038,en,2022-06-20 23:22:31+00:00
3049,3319,duo safari biscuit dog come show love overall kill win,1539025273567514624,1444108725510414340,en,2022-06-20 23:19:53+00:00
3050,3320,gop dnc dojph shame moral left gop candidate greitens want dont agree trump hunt shot scum criminal arent law incite violence get kill arrest,1539023730252316672,781539551517011968,en,2022-06-20 23:13:45+00:00
3051,3321,pattir realtuckfrumper careful mike there candidate eric greitens sell hunt card kill people,1539019034535944192,1177652811800051712,en,2022-06-20 22:55:06+00:00
3052,3322,realtuckfrumper careful mike there candidate eric greitens sell hunt card kill people ,1539017196508262402,993617651388776448,en,2022-06-20 22:47:47+00:00
3053,3323,planetzoogame zoo dvur kralove czech republic save lot african animal,1539016733369016320,3166724614,en,2022-06-20 22:45:57+00:00
3054,3324,cero decal animal decal sticker kid wall decal gift cero sticker africa animal print safari animal decal nursery etsy,1539015739088130048,1428618113839517696,en,2022-06-20 22:42:00+00:00
3055,3325,adharc smother tiddies best way uwu,1539014725408698369,3183362312,en,2022-06-20 22:37:58+00:00
3056,3326, husky unicorn horn ivesuddenlyrealized,1539013016062087168,258873832,en,2022-06-20 22:31:11+00:00
3057,3327, smaer chimp tiger giant panda black list endanger many specie critically endanger today,1539010961067081733,1446957236694175750,en,2022-06-20 22:23:01+00:00
3058,3328,ericgreitens washingtonpost wow nothing get kill child didnt get enough attention guessso let kill ,1539010121140797440,19504675,en,2022-06-20 22:19:40+00:00
3059,3329,orphan baby snuggle keeper wont sleep alone witness mother brutal kill,1539003910647689216,145316698,en,2022-06-20 21:55:00+00:00
3060,3330,darealmattoates figure group ppl reach africa ,1539003426541129737,364826105,en,2022-06-20 21:53:04+00:00
3061,3331,hey greitans want hunt kill beautiful animal,1539002895932313608,1530304883190112256,en,2022-06-20 21:50:58+00:00
3062,3332,savannahcavett furgeson andreeluetrecht chungywungy breaf knwldge notdojaaa hippo predator elephant even chance kill draw tie hippo put pplyear tshis btw,1539002708040065024,447553562,en,2022-06-20 21:50:13+00:00
3063,3333,ericgreitens washingtonpost come house motherfucker hunt permt ill show ,1539001915010187266,1478285913012637696,en,2022-06-20 21:47:04+00:00
3064,3334,happybcast government assam province india home world great onehorned population ,1538999589067403264,1347836124,en,2022-06-20 21:37:49+00:00
3065,3335,lachevron ronfilipkowski crazy end wound kill guy prosecute accessory crime case wed whole lot few ugly threat violence,1538998597278404608,1421724296229965825,en,2022-06-20 21:33:53+00:00
3066,3336,fessdoc best job title didnt even know people nose told job thought operate lush mammal kinda wild rag life edge kinda dude dice death,1538996955933822978,1049638669441802240,en,2022-06-20 21:27:22+00:00
3067,3337,joewelker trophy hunt killer kill brag kill endanger specie way cant shoot back wonder baby home rely wish put junior forest gun know rest,1538992476832182273,1226285268598046722,en,2022-06-20 21:09:34+00:00
3068,3338, dad claim unicorn real make shove horn horse,1538991685123944448,1128333033784868864,en,2022-06-20 21:06:25+00:00
3069,3339,freedomalltime dineshdsouza omgyou advocate shoot twitterthis censorship endif advocate kill political opponent libs winningthe gqp minion people fight right promote violence political enemy,1538990836955881475,1156974743934984192,en,2022-06-20 21:03:03+00:00
3070,3340,wonderful day cotswildtweets many amaze thing love calf,1538989888548261890,139006384,en,2022-06-20 20:59:17+00:00
3071,3341,azbrittney sooner trump call civil war whack job threating kill gop sooner later,1538989018599276545,2594130530,en,2022-06-20 20:55:49+00:00
3072,3342,farvaprice last deployment prior leave eabs number hornet lose probe maiden run gag flight ops caoon grumman iron work always hard beoing product need help vaqrons dont need safe word,1538988861136678912,948696353093439489,en,2022-06-20 20:55:12+00:00
3073,3343,tunesmithcoffey population panda great white shark snow leopard cheetah tiger manatee,1538988713039958016,2609500814,en,2022-06-20 20:54:36+00:00
3074,3344,bebop white recently celebrate bihday dyk group call crash brings whole new meaning term crash pay gpzoo bihdaypay,1538986467317493762,24765758,en,2022-06-20 20:45:41+00:00
3075,3345, maga psycho ultramaga psycho want kill eachother maganonesense magapopcorn,1538986153021526017,1120893635241893888,en,2022-06-20 20:44:26+00:00
3076,3346, conservation black animalrescue savethefuture,1538982022143791107,1497976718904238081,en,2022-06-20 20:28:01+00:00
3077,3347, arrest connection poach nohwest etosha believe arrest namibia poach,1538977486255443968,905818825328926720,en,2022-06-20 20:10:00+00:00
3078,3348,kadeskya jeffmiles even left fyi dont eat kill child rapist say,1538976049500921857,472581097,en,2022-06-20 20:04:17+00:00
3079,3349,finally twoyear delay provincial mec environmental affair ravi pillay announce appointment new member board junekzn poach,1538972704916656128,869959916,en,2022-06-20 19:51:00+00:00
3080,3350,kellieadennis kevinsixx sick bastard extreme right go take kill defense arrest,1538971852013334528,1278504980912025600,en,2022-06-20 19:47:36+00:00
3081,3351,rudy critically endanger black shape horn rub back foh different surface habitat rudys horn make keratin need properly maintain hair fingernail keeper christalove,1538970283079499778,20440823,en,2022-06-20 19:41:22+00:00
3082,3352,morninglivesabc theankolesavethes look president ankole cattle horn appendage make look puny tell chinese ankole horn much strong aphrodisiac look animal safe president make real foune,1538969336702029824,748883984,en,2022-06-20 19:37:37+00:00
3083,3353,danhansen saw many different animal today twycrosszoo year child animal expes giraffe ,1538969214366715909,1368698429023662082,en,2022-06-20 19:37:08+00:00
3084,3354, saw many different animal today twycrosszoo year child animal expes giraffe penguin monkey tiger tooises snow leopard missmeliahcps,1538969080446730240,1377740507800035330,en,2022-06-20 19:36:36+00:00
3085,3355,africansoil hunt business,1538969041993449473,1534640358553968640,en,2022-06-20 19:36:26+00:00
3086,3356,jackhunt yupnever forget ashliand remember kill herand democrat pay allow itrememberin novembervo,1538968977178775560,1471881367885651968,en,2022-06-20 19:36:11+00:00
3087,3357, sho film wildlifefilmmakerwlc member agoetzfilm produce wildlifeleaders sirf sumatran conservation indonesia,1538967573689249796,301796449,en,2022-06-20 19:30:36+00:00
3088,3358,ronfilipkowski ambiguity locker room talk joking hunt hold gun clear threat get someone kill,1538966055875379200,824330840373075968,en,2022-06-20 19:24:34+00:00
3089,3359,cause thats isjoe biden print moneyinflation go upevery lib hmm seem due butterfly land hit telephone pole thus cause power outage south africa simultaneously coincide tsunami,1538963931670126594,1003069321,en,2022-06-20 19:16:08+00:00
3090,3360,guptalesiba someone push narrative chinese ankole horn soup make virile attractive gend,1538962549525331970,1185863356965625856,en,2022-06-20 19:10:39+00:00
3091,3361,check black duty work glove best trade size large ebay ebay,1538961897323696132,871932820276600832,en,2022-06-20 19:08:03+00:00
3092,3362,annefitzpatrick thanks please follow crisis need suppo get help save extinction,1538961774929747974,973866358705475584,en,2022-06-20 19:07:34+00:00
3093,3363,okaukuejo reso wildlife waterhole live camera stream etosha youtube rumble,1538959603852906497,16834156,en,2022-06-20 18:58:56+00:00
3094,3364, enjoy research different kenyan animal national geographic kid website earlier learnt great fact lion elephant leopard,1538959004281581569,3238870679,en,2022-06-20 18:56:33+00:00
3095,3365,helping poach india found horn remove still alive leave authority concerned ,1538958064392470528,1303157979068293120,en,2022-06-20 18:52:49+00:00
3096,3366,wildlifefocus arm suspect poacher shot dead kruger national park superooper read htt,1538954303821467652,566228059,en,2022-06-20 18:37:53+00:00
3097,3367,mollyploofkins today gqp candidate told suppoers kill ,1538953093865414660,1462393143786184711,en,2022-06-20 18:33:04+00:00
3098,3368,population panda great white shark snow leopard cheetah tiger manatee blue whale lion polar bear elephant giraffe hippopotamus gorilla human,1538952610308292609,380586269,en,2022-06-20 18:31:09+00:00
3099,3369,caxdj mrmokelly right add come today show gear strike team mission kill ,1538951936493248513,131185749,en,2022-06-20 18:28:28+00:00
3100,3370, someone push narrative chinese ankole horn soup make virile attractive gender horn wan see something,1538950681373065222,1444291456441667584,en,2022-06-20 18:23:29+00:00
3101,3371,onlycrownking wild folk do work together even end work together suppo cheer use lead great work king research thanks,1538950020938047488,1269369372746878982,en,2022-06-20 18:20:51+00:00
3102,3372,gtconwayd corrupt nah there lot corrupt people there lot corrupt people call good people corrupt really want live day rule kill take look tuff ,1538948744447524864,1346119649218473986,en,2022-06-20 18:15:47+00:00
3103,3373,candacnll msnbc maddowblog problem american believe donald trump prosecute january thats lose argument guess horn gourd ,1538948723228790785,1420765379975127045,en,2022-06-20 18:15:42+00:00
3104,3374,awoaca thegoodliars try say twitter protects ceain category age nationality etc ,1538945249111851012,956955048185131008,en,2022-06-20 18:01:54+00:00
3105,3375,planetzoogame always enjoy visit veszprem zoo hungary especially see pablo ,1538943154640101376,2453287945,en,2022-06-20 17:53:34+00:00
3106,3377, come narwhal baby goat horn despicable movie horse horn go need look ,1538942379712970753,1341015503188455426,en,2022-06-20 17:50:30+00:00
3107,3379,kokid come check themunchiemafia passionate people care donation rainforest trust international foundation sale,1538940460986560513,1506406725032681473,en,2022-06-20 17:42:52+00:00
3108,3380,donie sirdukedevin take greitens suggestion kill someone consider gop ma say nothing ,1538939375010164739,933384230553387008,en,2022-06-20 17:38:33+00:00
