,Unnamed: 0,tweet,tweet_id,author_id,lang,created_at
2492,2612,elonmusk charge kill ,1612152421597466626,1556005478722703360,en,2023-01-08 18:21:04+00:00
2493,2613,mind bengal demand league grant forfeit leave stadium,1612148148570292227,16704303,en,2023-01-08 18:04:05+00:00
2494,2614,spaceca south africa best defender murder front family justice anton mzimba,1612146882515435523,3426754587,en,2023-01-08 17:59:03+00:00
2495,2615,famousjanice year praise onmywall painting horn acrylic canvas aist wadda ,1612146705423548416,3426754587,en,2023-01-08 17:58:21+00:00
2496,2617,hodilu decease woman leaf cologne zoo koelnerzoogermany inheritance less usd payment installmen,1612145639973855236,2396489030,en,2023-01-08 17:54:07+00:00
2497,2618, year praise onmywall painting horn acrylic canvas aist wadda isaacorder todaynewprofilepic,1612144417925730305,1305977744417849346,en,2023-01-08 17:49:16+00:00
2498,2620,anisisa new lady experiment different body shape try exotic animal speciesfurryawork elephant hipp,1612143703627530240,778297217903759360,en,2023-01-08 17:46:25+00:00
2499,2621,jamesahur havin cobalt use steel make population redcar right date inception height right clutch chest sing bob dont care say mate ,1612139353035374593,295861784,en,2023-01-08 17:29:08+00:00
2500,2622, amrakunj depends perception bad mean uk economic model yes think thats good thing bad dont hold neo liberal free trade globalise economics thats world knackered,1612135386892931073,1548317332140765186,en,2023-01-08 17:13:22+00:00
2501,2623, friend annie fundraise care wild sanctuary check justgiving page please donate thank justgiving,1612135282203140096,18513438,en,2023-01-08 17:12:57+00:00
2502,2624,stun zero poach indian state assam nearly year download wion news app share wion,1612133407768866817,54516759,en,2023-01-08 17:05:31+00:00
2503,2625, year praise onmywall painting horn acrylic canvas aist wadda isaacorder today,1612132902799564801,1305977744417849346,en,2023-01-08 17:03:30+00:00
2504,2626, leuser ecosystem sumatra indonesia place wild orangutan tiger elephant still coexist intact forest suppos tremendous biodiversity different plant specie learn leuser,1612132092262875138,89566513,en,2023-01-08 17:00:17+00:00
2505,2627,elonmusk hope pray jerk killer pay awful karma,1612131169679835137,1542496621144981506,en,2023-01-08 16:56:37+00:00
2506,2628,weareafca fam hit market deli block convention center great sandwich,1612130815390932993,3043967680,en,2023-01-08 16:55:12+00:00
2507,2629,helping wildlife roundup fascinate wildlife related story nature,1612130743395696640,2234738348,en,2023-01-08 16:54:55+00:00
2508,2630,kiss marketwatch good luck ,1612129673869156352,189181002,en,2023-01-08 16:50:40+00:00
2509,2631,ejp oooh love asm there something funny horn always grabbed,1612121034379104259,1240750027296763905,en,2023-01-08 16:16:21+00:00
2510,2632,zero shot result successful conservation wildlifecrime mitigation measure assam aaranyakassamforestmkyadavacmofficeassam,1612120572015833091,1207685455191240705,en,2023-01-08 16:14:30+00:00
2511,2633,dilflover market,1612119701500616705,1453162375759138820,en,2023-01-08 16:11:03+00:00
2512,2634,jessicaraeburch laurendagley second kong peanut butter freeze make last longer also horn dog bone last forever good luck,1612116256500613127,365276791,en,2023-01-08 15:57:21+00:00
2513,2636, peta finally want useful get suppoers wildlife protection service protect endanger wildlife panda tiger instead kill dog cat,1612113809426239488,1578410926629392385,en,2023-01-08 15:47:38+00:00
2514,2637, saw video say kid probably wont see panda african lion lot endanger animal weve live seenand thats probably saddest thing saw today,1612112545208492036,563590285,en,2023-01-08 15:42:37+00:00
2515,2638,respect worldprotecting wildlife daing closemonitoring preservation kevin robeson,1612111425400446976,2837061833,en,2023-01-08 15:38:10+00:00
2516,2639, strange wonderful last survive megafauna eah offer impoant life lesson human look fierce gentle wildindiapc aarzookhurana,1612109536155795457,16093478,en,2023-01-08 15:30:39+00:00
2517,2640,massive chase stale tourist national park india manasnationalpark assam baksa,1612108356025749504,1443314368901488640,en,2023-01-08 15:25:58+00:00
2518,2641,indian region home world large population onehorned record zero poach manaswildlifesanctuary pobitorawildlifesanctuary manas pobitora assam orang kaziranga indian gpsingh mkyadava hindustantimes himantabiswasarma,1612108354775822337,1443314368901488640,en,2023-01-08 15:25:57+00:00
2519,2642, poach assam first year kohora assam majuli kaziranganationalpark chirang baksa hilakunda karbianglong golaghat darrang sonitpur morigaon biswanath barpeta nagaon gpsingh himantabiswasarma,1612108353458827266,1443314368901488640,en,2023-01-08 15:25:57+00:00
2520,2643,dandinohill people spokenagain let see even matter shove ole kev throat thank hold out gaetz micro victory voter protection,1612106568170106881,1593985094267674627,en,2023-01-08 15:18:52+00:00
2521,2644,khodatii coachfelecia european human woolly mammoth big cat canine antelope woolly rodent speciespopulati,1612106250082476032,1566080743276781569,en,2023-01-08 15:17:36+00:00
2522,2645,otolaryngologist know ent surgeon specialist doctor claim treat human animal even limit nonhuman specie,1612104982840610817,54182995,en,2023-01-08 15:12:34+00:00
2523,2646, tour yet put bucket list come see centre yourselfplease book directly office email officehesccoza call booking make hr advancetour wildlife,1612101956587192322,202622656,en,2023-01-08 15:00:32+00:00
2524,2647,cawthornfornc mattgaetz wonder trust anyone anymore,1612101651040538625,1365655619634688000,en,2023-01-08 14:59:19+00:00
2525,2648,btfspirit puredemocracynz seenandforeseen domcowan search small generic piece dna fit computer model virus voila found virus way unicorn proven exist hair horse piece horn,1612099381972312068,14986598,en,2023-01-08 14:50:18+00:00
2526,2649,odilosaba marksinthesouth helenzille myanc eish brahad sit wouldve allow let marky boy bedont hoya keep remind madam boy almost kill,1612099302599319553,1370476444485312512,en,2023-01-08 14:49:59+00:00
2527,2650,team edward defeat team young hardtokill bomb factory dallas texastna impactwrestling totalnonstopaction crosstheline eddieedwards richswann williemack heathslater ericyoung lukegallows karlanderson joedoering wwe wwehistory,1612092112811565056,999656112365490176,en,2023-01-08 14:21:25+00:00
2528,2651,ksafricahack unikentsac anyone look humanwildlife conflict lion hyena jackalshoney badger african ,1612087527061557249,2351800310,en,2023-01-08 14:03:12+00:00
2529,2654,repkatcammack national reaction friday frat pay celebration,1612085435961851905,1518900794061430785,en,2023-01-08 13:54:53+00:00
2530,2655,coachfelecia european human woolly mammoth big cat canine antelope woolly rodent speciespopulations evolve nohern hemisphere hairier stockier large built slow metabolism store fat equatorial counterpas,1612077466037649408,1258760213777260546,en,2023-01-08 13:23:13+00:00
2531,2656, organization feel threaten breakthrough openai potentially disrupt business model lead shift competitive landscape hey thats market workthe gray ceainly caught many tech bros guard,1612074731024302083,16477920,en,2023-01-08 13:12:21+00:00
2532,2657,propain gaswith blue motherless fatherless godless fiendsiam methis aint gon day,1612074439121723392,1589669033632210945,en,2023-01-08 13:11:11+00:00
2533,2659,edomazzu sent ste station greche grechezoo creativity affinity idhammer ,1612071731555962883,1333017009701916677,en,2023-01-08 13:00:26+00:00
2534,2660,planet uganda wildlife authority uwa undeook habitat feasibility study reconfirm ajai wildlife re,1612065420302815232,1265811674520567810,en,2023-01-08 12:35:21+00:00
2535,2661,domlucre ive heard ton south africa kind puke penny,1612065096179515392,1592918203411341315,en,2023-01-08 12:34:04+00:00
2536,2662,wildlife roundup fascinate wildlife related story nature,1612064953552322560,519683539,en,2023-01-08 12:33:30+00:00
2537,2664,uganda wildlife authority uwa undeook habitat feasibility study reconfirm ajai wildlife reserve still suitable habitat reintroduction white conservation,1612061807669088263,905818825328926720,en,2023-01-08 12:21:00+00:00
2538,2665,unikentsac anyone look humanwildlife conflict lion hyena jackalshoney badger african ivory happy suppo appropriate way,1612059440047599616,83359373,en,2023-01-08 12:11:35+00:00
2539,2666, yale university professor described japanese spot hyena africa thin sinister cunning vicious love cause trouble savannah love pick lion elephant large animal,1612057990118662144,1420977586625146888,en,2023-01-08 12:05:50+00:00
2540,2667, great onehorned indian usually found asia however october conservationist celebrate bih calf call jiya chester zoo whats bih capture video camera,1612056903047159809,1451474420,en,2023-01-08 12:01:30+00:00
2541,2668,wilsonp stephenehorn yep tell instruct insurrection crooked democrat ,1612056695085096961,1066843748,en,2023-01-08 12:00:41+00:00
2542,2669,carolmkg clivedj brendawardle lol call government nationalise private supermarket least intervene make usave store,1612056343980003328,1487041227086344193,en,2023-01-08 11:59:17+00:00
2543,2670,sussexbylines conservation pose difficult choice involve try save many specie possible diminshed ,1612055382389624832,1492882249557155844,en,2023-01-08 11:55:28+00:00
2544,2671, he essentially sing pep rally song glorify xbbhas succumbed stylesee gene wilder play,1612052971713630209,441154386,en,2023-01-08 11:45:53+00:00
2545,2672,deannacongress deanna make cha nasty trait spot wild,1612050696270143490,1265311857537097729,en,2023-01-08 11:36:51+00:00
2546,2673,newsnex aaranyak lauds assam government achievement zero kill ,1612049333314277379,203063155,en,2023-01-08 11:31:26+00:00
2547,2674,conservation pose difficult choice involve try save many specie possible diminshed planet wwf rossmcnally explores challenge,1612048634417233923,1273556383473025025,en,2023-01-08 11:28:39+00:00
2548,2675,onenation thetruthpanther david mahlobo know zuma suppoer loot ssa secret fund horn smugg,1612048448433586178,2870909050,en,2023-01-08 11:27:55+00:00
2549,2676,aaranyak lauds assam government achievement zero kill ,1612046704219492353,1597211108125081602,en,2023-01-08 11:20:59+00:00
2550,2677,valesaiyajin typelet roll wild kratts episode youll eventually find ,1612043690373173251,1426875199396278272,en,2023-01-08 11:09:00+00:00
2551,2678,bibhabtalukdar see lot different poach figure assam come medias specially ,1612041874667376642,203063155,en,2023-01-08 11:01:47+00:00
2552,2679,litsastevens fanks click link si put lubberly storee ver little woz orphan poacher kill mumma horn courageous brave little chap ,1612039269052284928,1041232751469453312,en,2023-01-08 10:51:26+00:00
2553,2680,come endanger specie nnp afternoon,1612038479147311107,1357139850,en,2023-01-08 10:48:18+00:00
2554,2681, baby arrive criticallyendangered black calf born kansa city zoo nye,1612037254515400704,1555615048306933763,en,2023-01-08 10:43:26+00:00
2555,2682,critically endanger eastern black baby born zoo baby easternblack kansascityzoo,1612034439084900352,1291365724372340737,en,2023-01-08 10:32:15+00:00
2556,2683,marc webb cooked hard didnt enough energy direct scene properly spidey chit chat slam car kill people,1612033588656234499,718314967871696898,en,2023-01-08 10:28:52+00:00
2557,2684,mbalulafikile zondo ask ramaphosa david mahlobo cabinet serious corruption today mahlobo run show mangaung horn scandal say renewal yah neh,1612030917178007552,501682868,en,2023-01-08 10:18:15+00:00
2558,2685, use conservation need create visual storytelling conservationits also save rainforesti ask help sentence colorful rain forest caoon stylethe result ,1612030441984491520,1495261955367800833,en,2023-01-08 10:16:22+00:00
2559,2686,thedancingwild bad guess pigeon sound familiar thought idea clue,1612029519086424064,29203604,en,2023-01-08 10:12:42+00:00
2560,2687, many admit role forest guard bbc documentary gall criticize gun poacher decade safeguard kaziranga human kaziranga grassland instead ,1612026278881955840,17828634,en,2023-01-08 09:59:49+00:00
2561,2688,actually fairy look quite human simply good hiding kill quickly simply harvest cut horn stop poach wing value collector anyways,1612023628979404805,1289574010829910016,en,2023-01-08 09:49:17+00:00
2562,2689,wild video show charge tourist safari india nypost,1612023504970612737,881272135,en,2023-01-08 09:48:48+00:00
2563,2690,baby run play private farm shos shosvideo youtube wild wildlife wildlifephotography wildlife wildlifephotography wildlifeconservation wilderness wildlifesafari wildlifeplanet wildanimals,1612021378164703233,1495084795096883203,en,2023-01-08 09:40:21+00:00
2564,2691, tulsa zoo tour review penguin exhibit reserve sea lion cove rain forest lose kingdom aldabra tooises isslc,1612021200854700037,1584436426640343040,en,2023-01-08 09:39:38+00:00
2565,2692, november conference take place panama discus future international trade endanger speciesfollow link read morenews savethespecies conservation science antipoaching southafrica ,1612018337759756288,1381013077424893953,en,2023-01-08 09:28:16+00:00
2566,2693, see lot different poach figure assam come medias specially say kill assam year real figure table lok sabha share clarity assamtribuneoff assamforest,1612015915838869507,143299434,en,2023-01-08 09:18:38+00:00
2567,2694,nepalitimes wildlife conservation nepal largely focus tiger equally imperative turn small,1612013327533887488,736917133121064960,en,2023-01-08 09:08:21+00:00
2568,2695,elonmusk literally old man africa murder ,1612012254752571394,1570213752515235847,en,2023-01-08 09:04:05+00:00
2569,2696, zoo announces bih critically endanger eastern black calf,1612011155504906241,1601162855805599752,en,2023-01-08 08:59:43+00:00
2570,2699,gerhardlouis gwedemantashe imagine state security bed horn syndicate human traffic,1612010002088091648,2314937901,en,2023-01-08 08:55:08+00:00
2571,2700,desireelaverne gwedemantashe syndicate operating limpopo help government official kill wild life especially pangolin traditional medicine barbaric practice,1612008414481387521,367933521,en,2023-01-08 08:48:50+00:00
2572,2701,success story assam sthe character nation reflect condition animalssaachibaat wildlife wildlifeconservation kaziranganationalpark,1612007940436930568,1317443092333486084,en,2023-01-08 08:46:57+00:00
2573,2702, zoo announces bih critically endanger eastern black calf figure calf male female kansa city zoo hold ceremony choose baby name,1612006947372371968,1500728537074257923,en,2023-01-08 08:43:00+00:00
2574,2703,robrobbedwards never fancy visit asia know india abuse elephant china kill elephant ivory horn enhance virility whats left see tour wildlife keep stupid tradition,1612003845080780800,1483801194011181059,en,2023-01-08 08:30:40+00:00
2575,2704, crazy hoosis go run fur bery long time april landan run halp sum furless orphan call africa gib share vi wood make bery happy fanks frens xxx btposse dogsontwitter,1612003613597110273,1041232751469453312,en,2023-01-08 08:29:45+00:00
2576,2705, late south african comic daily thanks ryanotto,1612003146661781504,10174262,en,2023-01-08 08:27:54+00:00
2577,2706,dailysweden white people africa shoot elephant sedate guide others afghanistan photo share,1611999018644545540,320275643,en,2023-01-08 08:11:30+00:00
2578,2708,biancawamu yes expect bianca white kill park huge international outcry endanger specie,1611998014188539905,1278301158621220865,en,2023-01-08 08:07:30+00:00
2579,2709,good morning resident rumba rumbull keeper zoenoahsarkzoofarm animal zoo england bristol cuteanimals sunrise photooftheday photography beautiful landscape cute blueskys newyear,1611996242661236737,22132428,en,2023-01-08 08:00:28+00:00
2580,2711,todaynews zoo announces bih critically endanger eastern black calf foryou,1611995521802985473,4145863691,en,2023-01-08 07:57:36+00:00
2581,2714,gatewaypundit get fight zoo,1611993596693041153,1318781984987058179,en,2023-01-08 07:49:57+00:00
2582,2715,fishhr get horn chest die,1611992448305369094,1366630570545930240,en,2023-01-08 07:45:23+00:00
2583,2716,charge onehorned see chase group tourist india safari video,1611991180325302274,1369876005364494337,en,2023-01-08 07:40:21+00:00
2584,2717,meghanmccain vega underover daysone soul less coked sex traffic gop member held mccaneys head line potus pull trigger time live cspan literally care business usual gawd help ,1611985479850725378,1284889280071053313,en,2023-01-08 07:17:42+00:00
2585,2718,domlucre one live africa real apolytical bad as,1611985453502107650,1598155077512212481,en,2023-01-08 07:17:36+00:00
2586,2719,elonmusk white population benefit tourist security cost protect horn doesnt justify pathetic income tourism desperately need legalize horn trade build population never ,1611985253412790272,1570322810458832897,en,2023-01-08 07:16:48+00:00
2587,2720,coach street ready wild place tonight,1611982303609384962,1103493551596412928,en,2023-01-08 07:05:05+00:00
2588,2721,joncoopeweets say pay total vile soul less sex traffic coke head held skull person line potus pull trigger time live cspan fukn care,1611980208726495233,1284889280071053313,en,2023-01-08 06:56:45+00:00
2589,2722,coach get get kill lol,1611979032748244992,35693754,en,2023-01-08 06:52:05+00:00
2590,2723, vtr select potential site national conservation strategy possibly brought assam sometime next year conservation india,1611976495395704832,869959916,en,2023-01-08 06:42:00+00:00
2591,2724,sent ste station greche grechezoo creativity affinity idhammer foune favour bold hope bald soon,1611975848285847553,491448194,en,2023-01-08 06:39:25+00:00
2592,2725,gobindapkl chitwan bardiya framethe onehorned royal bengal tiger capture single frame bardiya,1611973964074717184,1364243344474263552,en,2023-01-08 06:31:56+00:00
2593,2726,llcoolstain good news bad news poacher,1611972746522628096,1520681620914819073,en,2023-01-08 06:27:06+00:00
2594,2727,thank youboebe gaetz ball demand american people want dont want house speaker consequence promise,1611972702255947778,1463005381290954752,en,2023-01-08 06:26:55+00:00
2595,2728,southafrica tragic news easterncape slaughter poacher feed increase demand status gift chinesenewyear shameful stoppoaching endangeredspecies dontletthemdisappear,1611972394981404673,2182993739,en,2023-01-08 06:25:42+00:00
2596,2729,etnowplus watch chase safari vehicle kaziranga national park footage go viral,1611969354136178688,1488388339955044352,en,2023-01-08 06:13:37+00:00
2597,2730,careforwild cute make cute grass pull noisespoachers need trim perhaps snare body pa drag unmerciful device ,1611965059546370049,635123529,en,2023-01-08 05:56:33+00:00
2598,2731,wild video show charge tourist safari india news,1611953592805605382,803966646,en,2023-01-08 05:10:59+00:00
2599,2732, day african grassland buy ,1611948497363783680,980887347456815107,en,2023-01-08 04:50:44+00:00
2600,2733,cinder absolutely take date see ankylosaur triceratops skeleton preferably kill absolutely favorite monster btw glad exist ala mhigo,1611947127176892418,796136082719047680,en,2023-01-08 04:45:18+00:00
2601,2734,wildlife conservation nepal largely focus tiger equally imperative turn small tooises tules play significant role biodiversity,1611941887023386624,74679662,en,2023-01-08 04:24:28+00:00
2602,2735,snakeygirl galefrosta jstocky there video hippo square scar bit eventually get fold chase horn straight rump,1611940399479754753,1311694712768790529,en,2023-01-08 04:18:34+00:00
2603,2736,althistoryhub captivity big puppy basicallylike yeah big animal dangerous butplenty video think sit next zookeeper let pet ,1611939159463325698,1229997949523857408,en,2023-01-08 04:13:38+00:00
2604,2737,dawntancna maam sorry ponti ferryono bin production racer bbcex xray love natural livestock big cat keeper animal lover stay long aprika uae dubai hotel african horn militia supplier logo samurai war lover cibatu sukabumi,1611932917827244032,1595963589512552448,en,2023-01-08 03:48:50+00:00
2605,2738,save sumatran second chance world ancient specie,1611931388340731904,1487986099267928064,en,2023-01-08 03:42:45+00:00
2606,2741,new york postwild video show charge tourist safari india terrify footage capture cero storm safari tour india force driver frantically try outrace ,1611927422739353601,3534222021,en,2023-01-08 03:27:00+00:00
2607,2746,strict action arm commando forest personnel assam lead zero poach year moreover use technology also help state achieve target ,1611927228270661640,972772323366338560,en,2023-01-08 03:26:14+00:00
2608,2747,special dgp assam gpsingh tweet anti poach effos yield spectacular result poach assam year ,1611926707212283904,972772323366338560,en,2023-01-08 03:24:09+00:00
2609,2748,spacekaren hallaboutafrica thankfully indict poach,1611924654049853447,18780824,en,2023-01-08 03:16:00+00:00
2610,2749,wild video show charge tourist safari india new york post india,1611924625289773057,1555218137091432448,en,2023-01-08 03:15:53+00:00
2611,2750,hodilu horn elephant ivory seize bust smuggler vadodara,1611922941683400704,2484460314,en,2023-01-08 03:09:12+00:00
2612,2754,shoenhead lordvali pretty sure use horn,1611921142595584006,888790555844530177,en,2023-01-08 03:02:03+00:00
2613,2755,kimmburlly debinitaly nationalfile czebotarjessie expose,1611919181796069376,82728883,en,2023-01-08 02:54:15+00:00
2614,2756,sirf cheer new year huge congratulation assam work hard protect zero poach assa,1611914709652979714,3426754587,en,2023-01-08 02:36:29+00:00
2615,2757,wildwarriors everyone call feminist try suppo courageous african woman everything save animal life charity wildlife,1611914508313759745,3426754587,en,2023-01-08 02:35:41+00:00
2616,2758,mccahy shit bird romney mccainmccain normal cowboy self kill brother forrestal sister ship coral sea stayed formation shot ,1611913153373249536,1085944100090798081,en,2023-01-08 02:30:18+00:00
2617,2762,frighten video charge tourist indian national park foxnews,1611911032041279491,1597628303342346240,en,2023-01-08 02:21:52+00:00
2618,2765,novigonews wild video show charge tourist safari india,1611909556824678400,1538959006638788610,en,2023-01-08 02:16:00+00:00
2619,2766,wildwarriors god bless black mamba thank god conservation bless ,1611909469327314945,1193334642910416897,en,2023-01-08 02:15:39+00:00
2620,2769,dancrenshawtx dan youre trader country youre definition ,1611896534261456897,1420751914896035841,en,2023-01-08 01:24:16+00:00
2621,2770,elonmusk omg enlarge make sure wasnt kind rare twin horn something yes real need outlaw big game hunt detest ,1611892215009116160,2201090579,en,2023-01-08 01:07:06+00:00
2622,2771,debinitaly nationalfile czebotarjessie expose,1611891702247178240,1538424010324811776,en,2023-01-08 01:05:03+00:00
2623,2772,gepardtatze monikab repulsive horribly horribly sadand desecration american flag horrify kill ,1611888088904794113,454377033,en,2023-01-08 00:50:42+00:00
2624,2773,beagledirk lievenscheire dusauchoitchris idevisch bibi wil nog steed mammoeten tegen return bring nohern white back extinction,1611885478181208066,1274599584,en,2023-01-08 00:40:20+00:00
2625,2774,universexy elonmusk haha surely double horn,1611885038840209410,41826800,en,2023-01-08 00:38:35+00:00
2626,2775,yeah get beautiful car garage comet slingshot gzilla blitz gzilla dorito acid reaper twotone stinger wildcard thats ,1611881539326955523,1435350881789169665,en,2023-01-08 00:24:40+00:00
2627,2776,djtonybeat madonna guyoseary record warnerrecords sirerecords recordsuk vogue express frozen deeper deeper girl go wild jump isla bonita prayer,1611880880405942278,1381937258375344130,en,2023-01-08 00:22:03+00:00
2628,2777,gepardtatze thankfully indict poach,1611876757933531137,1598446658337099798,en,2023-01-08 00:05:40+00:00
2629,2778,renoomokri create visibility obi incessant hate post feel demarketing daily make way atiku oga laino ,1611869645648154626,1598974895941107723,en,2023-01-07 23:37:25+00:00
2630,2779,feel horn ,1611869358954881025,1260403495250862080,en,2023-01-07 23:36:16+00:00
2631,2780,domlucre african extreamly fast oveurn suv asif plastic table,1611867110346481664,877653217668104192,en,2023-01-07 23:27:20+00:00
2632,2781,elonmusk rip nohern white,1611866926858522624,2976713435,en,2023-01-07 23:26:37+00:00
2633,2783,domlucre white big horn,1611863834595057665,1518476559929253888,en,2023-01-07 23:14:19+00:00
2634,2784,riverru queenofheas kingofheas work together save endanger black,1611863791364460555,1431258670546001922,en,2023-01-07 23:14:09+00:00
2635,2785,davenatoli werribee zoo safari get interrupt curious decide bus perfect way sharpen,1611862532498821120,987844879,en,2023-01-07 23:09:09+00:00
2636,2786, capital windhoek coastal town swakopmund contain german colonialera building windhoek christuskirche built noh etosha national park salt pan draw game include giraffescapital windhoek currency namibia dollar,1611862318211547136,1047897854164062209,en,2023-01-07 23:08:18+00:00
2637,2787,therightmelissa freedom caucus call demand anyone mccahy there reason believe soldout,1611856576712970241,382963058,en,2023-01-07 22:45:29+00:00
2638,2788,misspooh black killmoenetwork say louder,1611855645862514689,1510428000029978628,en,2023-01-07 22:41:47+00:00
2639,2789, baby arrive criticallyendangered black calf born kansa city zoo nye daily mail online,1611848557589299202,623187975,en,2023-01-07 22:13:37+00:00
2640,2790,wildlife black cero lover cero vintage wall natural history national park smellynoises,1611845277119557633,1311248413338542080,en,2023-01-07 22:00:35+00:00
2641,2791, do gop leadership term limit congress american democracy go survive american stand lifer politician demand term limit term presidency year move new thought,1611844503832522752,3328955304,en,2023-01-07 21:57:30+00:00
