,Unnamed: 0,tweet,tweet_id,author_id,lang,created_at
1377,1532,south africa park fear surge poach,1389234711281774592,880112324987822082,en,2021-05-03 15:05:40+00:00
1378,1533,south africa park fear surge poach yahoo stop already manhood small animal horn isnt go make big get already stop kill beautiful creature savetheplanet,1389234624228839434,1370439752671916033,en,2021-05-03 15:05:19+00:00
1379,1536,rpgmisfit metal bull horn stocka ready charge next projectsmallpress ,1389234071956566020,1731588781,en,2021-05-03 15:03:08+00:00
1380,1537,white gym today bank holiday spar session nice see dave passing knowledge skill expeise future british boxer ,1389233788501250051,2575360147,en,2021-05-03 15:02:00+00:00
1381,1538,metal bull horn stocka ready charge next projectsmallpress rpg publishing,1389233765172588544,3907105217,en,2021-05-03 15:01:54+00:00
1382,1540,reuters poach didnt want break covid restriction sound likely,1389233696469921793,1269957235309977601,en,2021-05-03 15:01:38+00:00
1383,1542, real realise threat poach pressure increase lockdown perhaps meet demand international market,1389233358056554499,95151374,en,2021-05-03 15:00:17+00:00
1384,1543,newly discover rare dinosaur embryo show sauropod horn geology geologypage dinosaur fossilan incredibly rare dinosaur embryo discover perfectly preserve egg show scientist new detail read ,1389233286321360897,308995921,en,2021-05-03 15:00:00+00:00
1385,1544,seattletimes lion breeding south africa trade product bone end country wont lobby ,1389233247578558464,2335665432,en,2021-05-03 14:59:51+00:00
1386,1547,south africa park fear surge poach youtube,1389232954782752768,773695333,en,2021-05-03 14:58:41+00:00
1387,1548,south africa park fear surge poach reuters,1389232800792989697,838321345570156545,en,2021-05-03 14:58:05+00:00
1388,1549,paicipate daily travel quiz answer question correctly win excite prizesquestion day conservancy kenya boast large number black sanctuary east africatravelquiz wanderlust travel mondaymotivation,1389232647692500998,67311881,en,2021-05-03 14:57:28+00:00
1389,1550,smhussain lizcheney suppo zoo,1389232567270973440,1337101691968217092,en,2021-05-03 14:57:09+00:00
1390,1555,namibia state get luxury car case global wildlife news visit wildtrails news ,1389231661225701382,2897029440,en,2021-05-03 14:53:33+00:00
1391,1556,stop kill ,1389231490924486661,3003806697,en,2021-05-03 14:52:52+00:00
1392,1557,straderzane aniqrahman thought great thought electro felt shoe horn harry end cameo wouldve good especially fought sta show oscorp set something,1389231163789676549,1076898519074500609,en,2021-05-03 14:51:34+00:00
1393,1558,wkbw icymi buffalo zoo say tashi onehorned pregnant ,1389230234134843394,30213351,en,2021-05-03 14:47:53+00:00
1394,1559,sadly poacher back south africa eas lockdown restriction endpoaching protects southafrica,1389229883059015684,169670924,en,2021-05-03 14:46:29+00:00
1395,1560,south africa end captive lion breeding industry lion bone trade ukchange work still do please read sign petition check buying reason,1389229648064696322,773898611855851520,en,2021-05-03 14:45:33+00:00
1396,1563,poacher risen south africa government loosen covid restriction poacher back south africa cgwohsafrica reuters,1389229319071879168,1389216220461867011,en,2021-05-03 14:44:14+00:00
1397,1566,poacher stage comeback ease lockdown restriction poach rise south africa government loosen coronavirus restriction follow yearlong lull due pandemic wildlife park say,1389226775696199687,34908698,en,2021-05-03 14:34:08+00:00
1398,1572, poach few year low yearly tally south africa begin ease international travel restriction november,1389225547666972673,35748406,en,2021-05-03 14:29:15+00:00
1399,1575,sangfro ban south african domestic trade horn stop south africa want trade internationally ,1389224361098457091,865840907198836736,en,2021-05-03 14:24:32+00:00
1400,1579,lot animal hiding rain today dont blame themthe weather perfect cheeky chesterzoo,1389223242888581120,1186738082952941569,en,2021-05-03 14:20:06+00:00
1401,1580, twin realize critically endanger left wild population less shilpaa,1389222944082071553,1105207377379409920,en,2021-05-03 14:18:55+00:00
1402,1582,reuters ease restriction mean poacher easily roam national park kill much want okay ranger roam anywhere ,1389221707672477700,1089752921720451072,en,2021-05-03 14:14:00+00:00
1403,1584,sirf great sadness announce passing longserving protection unit member ma suyana rest ,1389220331668312067,1019944680748978178,en,2021-05-03 14:08:32+00:00
1404,1585,save pangolin save radiate tooises save penguin save whole wildlife,1389219760123129865,764149147989602304,en,2021-05-03 14:06:15+00:00
1405,1586,petition update south africa end captive lion breeding industry lion bone trade ,1389219712555442177,1301977615847362560,en,2021-05-03 14:06:04+00:00
1406,1589,poach remains big threat help child never know majestic creature donation help secure new home donate visit receive next purchase wwf store,1389219453666308101,40202218,en,2021-05-03 14:05:02+00:00
1407,1590,eyalamatravel ziwa sanctuary place watch uganda wilderness call whatsapp ,1389218622187376644,2467841509,en,2021-05-03 14:01:44+00:00
1408,1591, collins join trader year ago,1389218485604175882,101286554,en,2021-05-03 14:01:12+00:00
1409,1593,ziwa sanctuary place watch uganda wilderness call whatsapp email infoeyalamatravelcomvisituganda eyalamatravel travel wildlife,1389217938071228417,936556133925482496,en,2021-05-03 13:59:01+00:00
1410,1596,businesslivesa poacher move lockdown restriction ease ,1389217552157577219,87194638,en,2021-05-03 13:57:29+00:00
1411,1597,wildaidafrica highlevel panel repo lion elephant leopard mark tectonic shift apaheidera exclusive,1389217216646766592,974018499176730624,en,2021-05-03 13:56:09+00:00
1412,1599,devdiscourse poacher back south africa eas lockdown restriction,1389216807152611330,1299926242410463234,en,2021-05-03 13:54:31+00:00
1413,1603,south africa minister announces new deal sa wildlife industry lion breeding end repos dailymaverick repo gov also address elephant trade breeding etc major shift sa wildlife policy underway,1389215361875255299,358629389,en,2021-05-03 13:48:47+00:00
1414,1605,disgust ban south african domestic trade horn stop south africa want trade internationally endanger specie specie pa sign petition ukchange,1389215240404021252,757888475693711360,en,2021-05-03 13:48:18+00:00
1415,1607,shahbanou ban south african domestic trade horn stop south africa want trade internationally endang,1389215034811748357,705351186023628800,en,2021-05-03 13:47:29+00:00
1416,1610,shahbanou south africa end captive lion breeding industry lion bone trade changefrance,1389214696805441540,705351186023628800,en,2021-05-03 13:46:08+00:00
1417,1611,ktnnewske poach rise south africa government relaxed coronavirus restriction,1389214664807141377,1050065988,en,2021-05-03 13:46:01+00:00
1418,1614, sad news poach increase government ease lockdown restriction hodilu savethe sirf poacher,1389214152334454787,1530626425,en,2021-05-03 13:43:58+00:00
1419,1616,wildaidafrica poach rise south africa government loosen coronavirus restriction follow ,1389212985885958147,974018499176730624,en,2021-05-03 13:39:20+00:00
1420,1618,elephant fish stew sma layer funny chat bryanchristy former head special investigation natgeo author stellar debut thriller company killer join fridayreads indianajones,1389212048089878528,22195976,en,2021-05-03 13:35:37+00:00
1421,1619, combat poach see unlock power data help zambia onceextinct population rebound photo couesy grumeti fund,1389208380519108612,121872852,en,2021-05-03 13:21:02+00:00
1422,1620,poacher back south africa eas lockdown restriction poach,1389206218779111425,21739932,en,2021-05-03 13:12:27+00:00
1423,1621,newsbuffalo buffalo zoo make room exhibit new addition come late fall detail,1389205323659956232,2165955307,en,2021-05-03 13:08:54+00:00
1424,1623,meru deputy governor titus ntuchiu last friday launch meru bongo black conservation trust mbbrct tasked receive first batch bongo set sanctuary kenya forest animal breed read ,1389203329566269440,1255396409865572352,en,2021-05-03 13:00:58+00:00
1425,1624,endanger ever dreamt make hand contribution conservation effos youre avid nature ,1389202980088463360,1117971778867953665,en,2021-05-03 12:59:35+00:00
1426,1625,gulfnews poacher back southafrica eas covid lockdown restrictionsstrict limit travel impose march,1389202316553768963,234325374,en,2021-05-03 12:56:57+00:00
1427,1628,poacher back southafrica eas covid lockdown restrictionsstrict limit travel impose march last year help keep poacher bay,1389200423764987908,20578408,en,2021-05-03 12:49:25+00:00
1428,1629,marsascendant cool shoot back complete game changer poacher back south africa ea,1389199855927676933,1177332981830225920,en,2021-05-03 12:47:10+00:00
1429,1630,discovereskomexpo interest eskom expo project topic consider ask follow question follow category social science project people aware poach problem measure take eskomsa,1389199439181631493,856076948,en,2021-05-03 12:45:31+00:00
1430,1631,poach rise southafrica government loosen coronavirus restriction follow yearlong lull due pandemic,1389198234619351042,619855057,en,2021-05-03 12:40:43+00:00
1431,1632,andbeyondtravel suppoafricasrangers ranger monitoring black population wildlife reserve ranger commit,1389197415551574018,392882728,en,2021-05-03 12:37:28+00:00
1432,1634,neiljohnsonza seismic shift send shock wave many area sa wildlife industry cabinet endorse ,1389194982465146880,340297637,en,2021-05-03 12:27:48+00:00
1433,1635,mwahafarn sentence possession horn amg,1389194884616232961,492478295,en,2021-05-03 12:27:25+00:00
1434,1636, sentence possession horn amg,1389194160998129665,1229703470812467201,en,2021-05-03 12:24:32+00:00
1435,1637,poach rise south africa government loosen coronavirus restriction follow yearlong lull due pandemic wildlife park say reuters,1389193889349832705,748778728902172672,en,2021-05-03 12:23:27+00:00
1436,1638, seismic shift send shock wave many area sa wildlife industry cabinet endorse repo call end lion farm captive lion hunt cubpetting commercial farm ,1389193807523102720,244422402,en,2021-05-03 12:23:08+00:00
1437,1640,lionelmedia get horn,1389192160910655490,967158604678778882,en,2021-05-03 12:16:35+00:00
1438,1641,covidisairborne badger fox bear migrate bird elephant lion tiger even humble hedgehog regard justified giftand long overduei sympathy specie whatsoeverthe sooner extinct well,1389188916037750785,1330195717718233096,en,2021-05-03 12:03:42+00:00
1439,1642,animal park elsewherethe high level panel repo africa regard management lion leopard elephant publishednote recommendation end captive breed lion industry animal photo petr ganajpexels,1389184036459982851,1255008942,en,2021-05-03 11:44:18+00:00
1440,1643,mandela ashamed south africa govt poacher back south africa eas lockdown restriction,1389183926732734467,2184934963,en,2021-05-03 11:43:52+00:00
1441,1644,reuters primary market horn chinago figure,1389182165766844418,524344367,en,2021-05-03 11:36:52+00:00
1442,1645,stroll cotswildtweets wildlife park garden watch graze lawn front gothic manor house walk giraffe walkway watch penguin fed fantastic day family openingupox,1389181945796599811,43933842,en,2021-05-03 11:36:00+00:00
1443,1646, poacher back south africa eas lockdown restriction smanews,1389179795515138048,270661400,en,2021-05-03 11:27:27+00:00
1444,1647,poach often involves local international poacher smuggle high value commodity border often asia demand high,1389177662111768576,109001490,en,2021-05-03 11:18:58+00:00
1445,1648,heritageassocsa van wyks estimation plant poach lucrative country horn industry,1389176827332210689,2396489030,en,2021-05-03 11:15:39+00:00
1446,1649, windhoek resident admit possess horn city nearly year ago suffer expensive loss end trial windhoek regional cou friday,1389176688530104321,40850617,en,2021-05-03 11:15:06+00:00
1447,1650,poach escalate south african government ease covid related travel restriction south africa lockdown safer,1389175960117956609,434030422,en,2021-05-03 11:12:13+00:00
1448,1651,ksafricahack south african environment minister say lion breeding end horn trade wont back south africa htt,1389173952371646465,22981265,en,2021-05-03 11:04:14+00:00
1449,1652, seismic shift send shock wave many area sa wildlife industry cabinet endorse repo call end lion farm captive lion hunt cubpetting commercial farm consactiontrust,1389173331212054530,1410873996,en,2021-05-03 11:01:46+00:00
1450,1653, pastor member namibian police allegedly found possession horn last week grant bail amount appear ondangwa magistrate cou,1389173043218587650,40850617,en,2021-05-03 11:00:37+00:00
1451,1654, buffalo zoo make room exhibit new addition come late fall detail,1389172969876844544,15520253,en,2021-05-03 11:00:20+00:00
1452,1655,reuters problem horn poach purely chinese issue chinamissionun almost wipe donkey chineseembkenya pretend expoing donkey meat yet busy cover game trophy,1389172778578845697,284017301,en,2021-05-03 10:59:34+00:00
1453,1657,eastern black nandi sudan born leipzig zoo germany separate young year reunite twycross zoo international breeding programme,1389172153120079872,44861089,en,2021-05-03 10:57:05+00:00
1454,1658, cool shoot back complete game changer poacher back south africa eas lockdown restriction,1389172014510903296,1285687851514986498,en,2021-05-03 10:56:32+00:00
1455,1660,reutersafrica poacher back south africa eas lockdown restriction,1389170606906777600,47964081,en,2021-05-03 10:50:56+00:00
1456,1661,trader rise grind white coffee brew morning,1389169015868755970,1370483739516624904,en,2021-05-03 10:44:37+00:00
1457,1663,poatvuganda ugwildlife sirf funduganda funduk sanctuary temporarily close safety funduganda fund land owner so difference ugwildlife happy open sanctuary tourism activity continue,1389166183161729028,3954613461,en,2021-05-03 10:33:22+00:00
1458,1665,rainbowmaninuk apkmusicreview jamesmelville afraid possible mutation never doesnt need sarscov mutate virus virus become deadly sarscov mutate speak kill half planet measles mutate spread right ,1389164395230605312,1140807204,en,2021-05-03 10:26:15+00:00
1459,1667,can lion hunt bone trade horn elephant tusk tiger bone leopard wildlife put stain south africa reputation voice wildlife china bring pandemic wet market bone trade continued,1389163261673811969,821844927449591808,en,2021-05-03 10:21:45+00:00
1460,1668,acc shaw africa lead wwf south africa paicularly kruger experience serious number poach incident ease international travel restriction november,1389163194552356865,44861089,en,2021-05-03 10:21:29+00:00
1461,1669,cero question black white nature twitternaturecommunity wildlife africa africa savethe savetheday,1389160458234564611,1158444726401548291,en,2021-05-03 10:10:37+00:00
1462,1671,wendyverwey thanks adventure marakele national park work sanparks sighting list gtgtmongooseimpalaelephantrhi,1389158479970062338,3899146661,en,2021-05-03 10:02:45+00:00
1463,1673, many year environmental ngo say permit firesales ivory stimulate demand asia therefore poach also true horn pinnockstop trade stop demand elephant,1389157303946039297,930497239876816903,en,2021-05-03 09:58:05+00:00
1464,1674, urgently need initiate animal breed kill hunt dehorn body pa use tcm traditionell chinese medicine stop trade stop demand lion tiger,1389155977598013440,930497239876816903,en,2021-05-03 09:52:48+00:00
1465,1675,awfofficial there little attention medium west african biodiversity film crew east southern africa combine general lack biodiversity valuation make think care extinct miss african ,1389153239245938688,4848960831,en,2021-05-03 09:41:56+00:00
1466,1676,thanks adventure marakele national park work sanparks sighting list gtgtmongooseimpalaelephantbushbucklionwahognyala kudu giraffewaterbuckzebrareedbuckklipspringerduikerbuffalovervet monkey black mamba,1389147006640209921,52707946,en,2021-05-03 09:17:10+00:00
1467,1677,borg fear rejection cause jump trade soon weve make profit mindset impoant speci,1389140769819222022,918122060811030530,en,2021-05-03 08:52:23+00:00
1468,1678,poach elephant last year kenya mangrove forest help stall environmental crime bbc future,1389139689114849280,8526602,en,2021-05-03 08:48:05+00:00
1469,1679,wildwingssafari hippo thirdlargest living land mammal elephant white powerful jaw capable ,1389135996898488321,2998848173,en,2021-05-03 08:33:25+00:00
1470,1681,dee variety rare succulent draw poacher many specie specialise grow vall,1389131417515347975,14355051,en,2021-05-03 08:15:13+00:00
1471,1682,also fuher proposal cite trade horn make ceain condition met include develop global consensus legal international trade horn,1389131206613213196,2543177898,en,2021-05-03 08:14:23+00:00
1472,1683, variety rare succulent draw poacher many specie specialise grow valley mountain slopeplant poach lucrative country horn industry succulent indigenous southafrica,1389128481943003137,596257868,en,2021-05-03 08:03:33+00:00
1473,1684, wildlife crime case unodc suppoed china custom horn microchip scanner open new line investigation unodc also help southafrica china share cross border data information endwildlifecrime,1389127592779780099,1046760529023455233,en,2021-05-03 08:00:01+00:00
1474,1685,succulent smuggle south africa rare dese plant vanish plant poach lucrative country horn industry,1389125989695987712,41103933,en,2021-05-03 07:53:39+00:00
1475,1686,oceanblus chicago georgewbu bidenburner joebiden youd shut entire power grid eah kill bitcoin happens screw anyway china know currency future jumping come day central bank print money buy bitcoin,1389124299944972290,3826867533,en,2021-05-03 07:46:56+00:00
1476,1687, notoriously solitary animal teenager quite social watch teenage greet takemeback wildlifepark naturereserve travelphotography naturephotography naturegood naturecaptures wildlife,1389122557052432388,145994222,en,2021-05-03 07:40:00+00:00
1477,1688,elikill neotikz majindimeh matheus strasspetasse model plaid ,1389117420120559624,845969484724785152,en,2021-05-03 07:19:36+00:00
1478,1689,excellent news sta week south africa ban breeding lion captivity hunt phase captive breeding also recommend,1389116638461665280,3108175669,en,2021-05-03 07:16:29+00:00
1479,1690,oceanblus chicago georgewbu bidenburner joebiden buy physical buy bitcoin take exchange kill internet shut bitcoin think ,1389116245048401929,3826867533,en,2021-05-03 07:14:56+00:00
1480,1691, highlevel panel repo lion elephant leopard mark tectonic shift apaheidera exclusive ownership use wildlife inclusive transformative approach dailymaverick,1389114759237210113,748778728902172672,en,2021-05-03 07:09:01+00:00
1481,1692, excite announce soon chat hunter human mom leandi yolande orphanage learn hunter incredible antipoaching dog join tanya facebook live thursday ,1389112488482983937,2542938512,en,2021-05-03 07:00:00+00:00
1482,1693,bbgafrica south african plan end lion breeding bone hunt cub pet wont oppose international ban elepha,1389109365194596352,1561318320,en,2021-05-03 06:47:35+00:00
1483,1694,solanitanjo marcellomj something change happen ivory market kill elephant ,1389100876950908931,778662491899498496,en,2021-05-03 06:13:51+00:00
1484,1695,bonnedebod high level panel repo brings possibility marketing horn stockpile international donor dispo,1389100762689585152,214178467,en,2021-05-03 06:13:24+00:00
1485,1696,defccofficial know cero make array funny noise theyre communicate illegal trade horn,1389091302344593408,2500055300,en,2021-05-03 05:35:49+00:00
1486,1697,lesdachef endanger ,1389091234023624706,213364197,en,2021-05-03 05:35:32+00:00
1487,1698, detailed zoo blur range vision ,1389083300925517824,19438916,en,2021-05-03 05:04:01+00:00
1488,1699, omahabrownsfan nathanb yandelnv pfffantasy gamergod connor get upgraded williamson saw minimal snap trade week villanueva literally bad guy line feiler bit loss already get phase kevin dotson rookie team rounder,1389081042292776963,708760194839408648,en,2021-05-03 04:55:03+00:00
1489,1700,coryhorn frakbard pffmike coty idiot,1389077361157619714,1218682075009769472,en,2021-05-03 04:40:25+00:00
1490,1701,act save face extinction saveanimals,1389076016451133441,1081760004598681600,en,2021-05-03 04:35:04+00:00
1491,1703,killateral kingstevieiou brgridiron kill lion fuck trophy talk sanction bullshit lion leopard wild dog control population,1389066968792186883,586259409,en,2021-05-03 03:59:07+00:00
1492,1704,lion breeding horn trade wont back south africa seattle time,1389061534807072768,593401406,en,2021-05-03 03:37:32+00:00
1493,1705,awfofficial poach destroy africa population elephant lion leopard endanger animal slaught,1389061359728435201,158170592,en,2021-05-03 03:36:50+00:00
1494,1706, mother car,1389060394648489987,275042849,en,2021-05-03 03:33:00+00:00
1495,1707,ecowarriorss many animal go extinct sadthe sumatran world small face extinction due ,1389054427470786563,4280670673,en,2021-05-03 03:09:17+00:00
1496,1708,barbaracreecy fantastic step forward wildlife south africa lion wildlife need conservation commercialization,1389050224753225734,977559884043620352,en,2021-05-03 02:52:35+00:00
1497,1709,discussingfilm loathe movie much first andrew garfield spiderman much rush gwen stacys death kill sinister setup godawful end bad plot huge mess,1389049789950611459,2193103322,en,2021-05-03 02:50:51+00:00
1498,1710, great day lion elephant south africa finally admits commercialization conservation,1389048957528121350,977559884043620352,en,2021-05-03 02:47:33+00:00
1499,1711,justsexyguys dick like cosplay horn hard,1389047863863390213,1369513794771316740,en,2021-05-03 02:43:12+00:00
1500,1712, assume also misao grows crocodile tail arm horn shoulder,1389046643606048770,1587029653,en,2021-05-03 02:38:21+00:00
1501,1713,senlishaswings slaywood bstrykerwrites alright let see well fuzzy early memory watch news repo john lennon assassinationed koch early mayor remember popple wuzzle monkey butterfly wing horn,1389032156542947329,2195715400,en,2021-05-03 01:40:47+00:00
1502,1714,dipakkrias patna zoo high onehorned population asia know hard work put ,1389028363071680513,1265827203083878408,en,2021-05-03 01:25:43+00:00
1503,1715, late rare studio wildlife news conservation environment,1389027541399347200,973866358705475584,en,2021-05-03 01:22:27+00:00
1504,1716,beginner embroidery kit tutorial modern hand embroidery hoop diy craft gift easy embroidery pattern embroidery craftkit nogpepperme etsy wildlifea,1389023352040435712,969616881962438665,en,2021-05-03 01:05:48+00:00
1505,1717,poach south africa fall covid lockdown hope trend continue,1389012211352227840,1632841392,en,2021-05-03 00:21:32+00:00
1506,1719,gemcitygem jungle gem thats cute omg also see goat jewellike horn jungle gem precious pas ,1389010266004803587,3080998517,en,2021-05-03 00:13:48+00:00
1507,1720,thesolardude ralph try dad homemade horn dust snack great shot scott,1389009055507795977,76025491,en,2021-05-03 00:09:00+00:00
1508,1721,heidysilver also sorry trade easter stroller,1389007788014284804,1266726367661559809,en,2021-05-03 00:03:57+00:00
1509,1722,lion breeding horn trade wont back ,1389002287280914432,1291742855023808513,en,2021-05-02 23:42:06+00:00
1510,1723,sirf week mother day perfect gift shop mom love honor ,1388997045755600896,825258604483604480,en,2021-05-02 23:21:16+00:00
1511,1724,hodilu team scientist natural history museum london found siberian unicorn call elasmotherium ,1388990636792156161,1010622153862021121,en,2021-05-02 22:55:48+00:00
1512,1725,south african thug moron shoot armored truck tickle ,1388986925063802882,1376214342270615554,en,2021-05-02 22:41:03+00:00
1513,1726, rustyrockets really great video create awareness regard poach,1388984741093859328,2225238880,en,2021-05-02 22:32:23+00:00
1514,1727,sanantoniozoo treat mom zoonique experience mother day breakfast show mom truly love everything ,1388983421494562831,1901082073,en,2021-05-02 22:27:08+00:00
1515,1728,jessmcurrie sit kill time wait siren match sta think right helen housby ,1388982345953255427,237612784,en,2021-05-02 22:22:51+00:00
1516,1729, uganda wildlife authority need usd relocate ziwa sanctuary national park authority recently say endanger white sanctuary introduce protect area,1388973417739735045,1927235594,en,2021-05-02 21:47:23+00:00
1517,1730,imho capability there match superhornet,1388971296743120898,17400044,en,2021-05-02 21:38:57+00:00
1518,1731,population recover namibia thanks communityled intervention magazine aicles wwf,1388967707270422540,351478142,en,2021-05-02 21:24:41+00:00
1519,1732,finally tree seed make horn ,1388967300125138960,353261084,en,2021-05-02 21:23:04+00:00
1520,1733,hippo thirdlargest living land mammal elephant white powerful jaw capable opening degree reveal enormous incisor nicky firer kruger national park,1388966800537358338,1344476419,en,2021-05-02 21:21:05+00:00
1521,1734,treat mom zoonique experience mother day breakfast show mom truly love everything allyoucaretoeat breakfast event deck learn purchase ticket ,1388961627270172672,381719739,en,2021-05-02 21:00:32+00:00
1522,1735,wgrz tashi deliver calf last calf mohan born buffalo zoo ,1388961255877132290,2730010063,en,2021-05-02 20:59:03+00:00
1523,1736,tashi deliver calf last calf mohan born buffalo zoo ,1388960235222622210,15308015,en,2021-05-02 20:55:00+00:00
1524,1737,fishvetmj lion breeding horn trade wont back south africa accord ministerial statement,1388945731428528128,1261232004508639232,en,2021-05-02 19:57:22+00:00
1525,1738,finally complete zambia vacation perhaps include visit mosioatunya learn zambia white population threat extinctionemailnahubwesafarilodgegmailcomtravel tourism travelblogger traveltheworld traveler traveltips,1388944326500229126,1155776098262818817,en,2021-05-02 19:51:47+00:00
