,Unnamed: 0,tweet,tweet_id,author_id,lang,created_at
3860,4200,mark lumberzoo repandybiggsaz donald trump junior good speaker house nothing say speaker house ha representative many great conservative speaker house instead want put ,1610407302200463360,1586864910922760192,en,2023-01-03 22:46:35+00:00
3861,4201,vesperskill mtaibbi add ,1610405891060400128,1595074252314746886,en,2023-01-03 22:40:58+00:00
3862,4202, sare readyfeahehorn collegeathletics hypevideo gastoncollege,1610405351186366465,1397633781540872192,en,2023-01-03 22:38:50+00:00
3863,4203,good news indian authority bring poach zero insidethats great news let hope continue,1610404703946391553,1004813316,en,2023-01-03 22:36:15+00:00
3864,4204,papitrumpo wildbillnc yet buddy vote bill,1610404549079990275,1587967843953434625,en,2023-01-03 22:35:39+00:00
3865,4205, post accurate number hard come lore hippo kill people year lion elephant leopard buffalo combine dont get close reddit,1610401546835054592,1480285405375258631,en,2023-01-03 22:23:43+00:00
3866,4206,repdancrenshaw insiderader repdancrenshaw sit youve make enough back door deal much gopleader offer vote,1610399268413513729,535590434,en,2023-01-03 22:14:40+00:00
3867,4207, bring rifle elephant lurecan horn help erectile dysfunctionstupidquestionsatthezoo,1610399125845032966,1606441330879696897,en,2023-01-03 22:14:06+00:00
3868,4208,record mikekillmon madonna wish,1610399078608769024,16263931,en,2023-01-03 22:13:54+00:00
3869,4209,honestirishlad kitkast hate dont fall line full hate maybe hate fill agree people critical think skill,1610398813813985282,2870860623,en,2023-01-03 22:12:51+00:00
3870,4210,incredible conservation effos india poach assam time year,1610398771061444609,118644946,en,2023-01-03 22:12:41+00:00
3871,4211,michelewrites ive ignore shark chase elephant african dangerousa dangerous sma elephanta manta ray alarm turn friendlyhorses child ran realise playinghumans run,1610397688260087809,1154584416338845697,en,2023-01-03 22:08:23+00:00
3872,4212,happy bookbihday recess late book new york time bestselling magic tree house series join jack annie adventure save baby learn endanger specie conservation effos protect ,1610397118816047104,3344479487,en,2023-01-03 22:06:07+00:00
3873,4213,bikepacking toughest form last october elmaxus realize longtime dream take run kilometre metre elevation gain south africa namibia memory lifetime,1610396871486328833,69898122,en,2023-01-03 22:05:08+00:00
3874,4214,stun almost zero poach indian state assam year,1610396750468059136,1497116909569179650,en,2023-01-03 22:04:39+00:00
3875,4215,jerseycraig hard unified pay africa,1610395760348266497,1533832132711354369,en,2023-01-03 22:00:43+00:00
3876,4216,eddiekago peak magical kenya moment summarizes caption black calf grazing,1610395114240892929,965540011,en,2023-01-03 21:58:09+00:00
3877,4217, single poach past year assam thank info swarajyamag thank work himantabiswa,1610394407030620161,4719173240,en,2023-01-03 21:55:20+00:00
3878,4218,gmamaladd dan crenshaw wef acolyte dont care say anything stock market apparently he make pretty penny trading stock last couple year,1610389710647758848,902296820239536129,en,2023-01-03 21:36:41+00:00
3879,4219,tblackw mikekillmon madonna maverick record warnermusic look forward ,1610389509794926593,16263931,en,2023-01-03 21:35:53+00:00
3880,4220,dcenquirer dineshdsouza yes trade actual conservative,1610389306257952775,1597387374241136641,en,2023-01-03 21:35:04+00:00
3881,4221,mikekillmon madonna maverick record warnermusic look forward ,1610385277507305473,1524502373409992704,en,2023-01-03 21:19:04+00:00
3882,4222, poach assam india time year,1610385023357665285,60897114,en,2023-01-03 21:18:03+00:00
3883,4223,ieexplained wwf say recovery great onehorned great conservation success story asiaa,1610384902998089728,2402110183,en,2023-01-03 21:17:35+00:00
3884,4225,record mikekillmon gregvsmatt mattrett madonna thanks matt hey mattrett look absolutely amaze,1610384475317305346,1524502373409992704,en,2023-01-03 21:15:53+00:00
3885,4227,record duranduran back day record week make instantly wealthy unit move wild ,1610382906169634817,20259176,en,2023-01-03 21:09:38+00:00
3886,4228,convebond never own tesla buying day feel pretty pessimistic terrible news finally come people look trade sell horn buy fishing line look great line ill bite,1610382442631778304,1563143496781135872,en,2023-01-03 21:07:48+00:00
3887,4229,ravinwildlife horn mammal specie left world naturephotography kaziranga ,1610381790446866433,1343916687326851072,en,2023-01-03 21:05:12+00:00
3888,4230,garretlewis cant maga trump never expect win election see disastrous result kari key race national horrible strategy,1610381271129296896,65803165,en,2023-01-03 21:03:09+00:00
3889,4231,new year new fight mother begin kevin mccahy shouldnt idolize rich people staed generational wealth,1610380974667497472,149410682,en,2023-01-03 21:01:58+00:00
3890,4232,extraultramaga edenjax johnrich always pull stuff well vote youll democrat noinstead ask others suck vote mccahy good pay demand mccahy step aside good pay,1610379163541831682,1585936712148074496,en,2023-01-03 20:54:46+00:00
3891,4233,opindia zero cero poach incident assam modi lauds people effos conservationvia googlenews,1610377066788319232,1279021008154812416,en,2023-01-03 20:46:26+00:00
3892,4234, repo state kruger national park knp lose poach compare previous year kill poacher repoing year relate average day poach,1610376326627704832,869959916,en,2023-01-03 20:43:30+00:00
3893,4235,michelewrites wildlife documentary producerelephant cape buffalonile crocodilehippopotamusgrizzly bear moosealso ive lick giraffe tongue way akin grit sandpaper,1610375679236882433,47085095,en,2023-01-03 20:40:55+00:00
3894,4236,bbe immeme repkinzinger cya col klinker keep skeleton closet know suffer extinction event truth loose power,1610374507226603521,1508799125910958091,en,2023-01-03 20:36:16+00:00
3895,4237,elonmusk shellenbergermd scottpelley paulrehrlich everyone knew white die everyone knew people paid poacherseveryone knew anythingthis happen specie nothing change,1610373908162560005,1519103100958744578,en,2023-01-03 20:33:53+00:00
3896,4239, wonderful time watch southern white nairobi national park southern bypass thank much jeroen team together strong visitnairobinationalparktheworldsonlywildlifecapitallovers love,1610372439615340544,973910373136064512,en,2023-01-03 20:28:03+00:00
3897,4240, fantastic news poach assam time year,1610371939817644033,3019202625,en,2023-01-03 20:26:04+00:00
3898,4241,nationalfile say vote mccahy vote yet yes gaetz mccahy establishment,1610371180426399753,2302448832,en,2023-01-03 20:23:03+00:00
3899,4242,massive chase stale tourist national park,1610369871803564034,779007929794134018,en,2023-01-03 20:17:51+00:00
3900,4243,assam record zero poach endanger know horn fetch big money suppose medicinal value first time nearly year utpalparashar repos,1610369230959951876,151807207,en,2023-01-03 20:15:18+00:00
3901,4245,blackbacked jackal sunset black reserve south africa,1610368470981410818,729641943291047936,en,2023-01-03 20:12:17+00:00
3902,4246,belindagreb scary thing lifetime cent world kill mark carwardine black ,1610366608098168838,721962773693997056,en,2023-01-03 20:04:53+00:00
3903,4247,hornet yes sir wont ,1610365984996556800,1504880170804592647,en,2023-01-03 20:02:24+00:00
3904,4248,trophyxpose wow amaze sight lucky didnt get scar different scenario show far encroach habitat actually quite sad tracey,1610364075908935680,1550316429521457152,en,2023-01-03 19:54:49+00:00
3905,4249, first year poach assam modi hail effos,1610363135763922945,1203501231282565120,en,2023-01-03 19:51:05+00:00
3906,4250,record gregvsmatt mikekillmon guy write book,1610362950673629185,16263931,en,2023-01-03 19:50:21+00:00
3907,4251,scrrreamingpink call horn beetleamazing little creature,1610362181266161664,1426159448591114244,en,2023-01-03 19:47:17+00:00
3908,4253,cvpayne never want mccahy begin never bother boost real leader look straders still run show,1610361980891668481,1588654439539347457,en,2023-01-03 19:46:29+00:00
3909,4254,upasanajonak great news graph shoer due increase population ,1610361974617145344,2864021982,en,2023-01-03 19:46:28+00:00
3910,4255, scary thing lifetime cent world kill mark carwardine black cero belinda greb photographyphotography,1610361452291923972,1689606158,en,2023-01-03 19:44:23+00:00
3911,4256,takegreenpill herbal medicine absolutely want control inflamation dont reach oxy take turmeric instead chinese medicine extent accupuncture yes horn impotenceahh tiger soup cancerahh ,1610360814233587712,1596730560247988224,en,2023-01-03 19:41:51+00:00
3912,4257, andstrachan gbnews yes still use system ensure approve people come low skilled job gamble someone come dinghy,1610360427858333703,307803415,en,2023-01-03 19:40:19+00:00
3913,4258, poach assam india first time year,1610359742035300353,1027986781571108864,en,2023-01-03 19:37:36+00:00
3914,4259,newspug official credit sincere conceed coordinate effos state forest police depaments zero poach,1610359121974554625,1186015670607196160,en,2023-01-03 19:35:08+00:00
3915,4260,killaxxxcam choicemany ,1610358885906550786,269555356,en,2023-01-03 19:34:12+00:00
3916,4261,tomfitton cresnshaw trade turn trump fuck pay,1610358708600537095,54024031,en,2023-01-03 19:33:29+00:00
3917,4263,bigblackwolf brookfieldzoo come word bunch doesnt work,1610357571763798017,1927156488,en,2023-01-03 19:28:58+00:00
3918,4264,snfllf cbthunting henrysmithuk strange mention snfllf well regulate trophy hunt credit funding conservation effectively save southern white brink extinctionyou read ,1610357374140944384,701561603267960832,en,2023-01-03 19:28:11+00:00
3919,4265,gjallarhornet poach assam time year india,1610356762288480256,279028135,en,2023-01-03 19:25:45+00:00
3920,4266, poach assam time year india,1610356543505170432,90466734,en,2023-01-03 19:24:53+00:00
3921,4267,todaynews poach assam first year foryou,1610355995288522756,4145863691,en,2023-01-03 19:22:42+00:00
3922,4269,boxinguk dennishobson fightzonetv billythekidpick white frans botha south africa,1610354092752224258,35705804,en,2023-01-03 19:15:09+00:00
3923,4270,empressmoon loooonng ago operation suck nose stuffed full breathing even everythings fix problem also persist allergy use horn often change brings ,1610354020782063618,1129019833960620032,en,2023-01-03 19:14:52+00:00
3924,4271,pray brave courageous gop congressman stand establishment time stand fight demand actual constitutional leadership america do ,1610353467821899776,34621278,en,2023-01-03 19:12:40+00:00
3925,4272,sumirdh assam achieve target zero poach deccanherald gpsinghips,1610351775357468672,1433906256381726725,en,2023-01-03 19:05:56+00:00
3926,4274, toonfanwz gbnews reverse colonialism use occupy country population work field today let work expense home country,1610350864568303618,744633008121085953,en,2023-01-03 19:02:19+00:00
3927,4276,afamcdk rid bike fun enjoyable way raise awareness conservation threat face iconic anim,1610346645127839745,39222081,en,2023-01-03 18:45:33+00:00
3928,4277, andstrachan gbnews actually say best talent attract allow oppounities improve country skill capability,1610345337444761600,307803415,en,2023-01-03 18:40:21+00:00
3929,4278,assam see zero poach decade deccanherald,1610344315070603264,1565590852864704512,en,2023-01-03 18:36:18+00:00
3930,4279, first time year single poach assam,1610343241865461761,96900937,en,2023-01-03 18:32:02+00:00
3931,4280,sykesjeff love somewhere photograph bear wolf wild african safari see ,1610343241471205377,164210910,en,2023-01-03 18:32:02+00:00
3932,4281,petersengenes remove ronda mcdaniels get board congress people demand right ,1610342083272839175,1459875557613707264,en,2023-01-03 18:27:26+00:00
3933,4282,prime minister narendra modi laud effos people assam towards conservation state,1610340525848264704,929076201187975168,en,2023-01-03 18:21:14+00:00
3934,4283,airnewsales prime minister narendramodi compliment people assam effos conservation state ,1610338375139217409,2865086833,en,2023-01-03 18:12:41+00:00
3935,4284,agallion captbeaux choseusernam adamkinzinger hey terry dont need learn anything need learn side democrat wan democrat pedofiles human traffic money laundering,1610338247887970306,1480896145505361922,en,2023-01-03 18:12:11+00:00
3936,4285,repstefanik housegop nose big horn face,1610337619585417219,1600492445879488518,en,2023-01-03 18:09:41+00:00
3937,4288, modi lauds assam conservation effos zero poach incident indiablooms first poal digital news management pmmodi assam zeropoaching himantabiswasarma,1610335081146757121,81334244,en,2023-01-03 17:59:36+00:00
3938,4289,aezziphotos georgebturner sudan nohern white male lucky enough see sadly pass away ,1610334196312035337,1587733746056368129,en,2023-01-03 17:56:05+00:00
3939,4290,dscreech moonzilla yeah horn make keratin,1610333756581085186,611801511,en,2023-01-03 17:54:20+00:00
3940,4292,hopelesstrader clownworld really never trumpers ethical others democrat liberal hack nothing investigate djt find excuse get rid presidency eve jan committee kangaroo cou style waste ,1610333194233987072,21037059,en,2023-01-03 17:52:06+00:00
3941,4293, poach assam india first time year news,1610333183723044864,1249771979927965698,en,2023-01-03 17:52:04+00:00
3942,4294,mikekillmon record greenday happy new year record love right back tweet power oaklandcoff,1610332052846526464,16263931,en,2023-01-03 17:47:34+00:00
3943,4295,repodreptiles moonzilla grow horn back,1610332029840769024,951459086771671041,en,2023-01-03 17:47:29+00:00
3944,4297, amount meth need smoke say something stupid kill ,1610330511104421889,21432906,en,2023-01-03 17:41:26+00:00
3945,4298,indrajat poach major issue congress rule sincere effos yield result,1610330440761483266,1022132821849075714,en,2023-01-03 17:41:10+00:00
3946,4300, javan world endanger cero specie dozen left main threat palmoil expansion deforestation suppo shop boycottwildlife palmoildetect,1610330021284954113,1351436889316683778,en,2023-01-03 17:39:30+00:00
3947,4302,house definitely investigate babbitt kill killer,1610328990325039105,46716898,en,2023-01-03 17:35:24+00:00
3948,4303,wildwingssafari big lion elephant buffalo leopard nicky firer kruger national park,1610328496059842561,58026269,en,2023-01-03 17:33:26+00:00
3949,4304,georgebturner sudan nohern white male lucky enough see sadly pass away image handy point shoot camera ,1610327399442391041,1435642088926978052,en,2023-01-03 17:29:05+00:00
3950,4306,charliekirk mean nohern white ,1610324433146875904,1586096292563849216,en,2023-01-03 17:17:17+00:00
3951,4313,repstefanik housegop kevin mccahy tool deep state garbage democrat literally murder people pilfer united state coffer traffic child point finger create fake january committee,1610324038798442499,1598485871170576385,en,2023-01-03 17:15:43+00:00
3952,4315, first time many year poach assam watch video detail kaziranganationalpark poach newsmo jessicagoel,1610323176365641728,19897138,en,2023-01-03 17:12:18+00:00
3953,4316, kaziranga national park chase tourist vehicle,1610322363849277440,3637960850,en,2023-01-03 17:09:04+00:00
3954,4317,pratidintime assam modi lauds people assam conservation effos state conservation zeropoachingincidents,1610322363786358786,807951707464343553,en,2023-01-03 17:09:04+00:00
3955,4319, accurate number hard come lore hippo kill people year lion elephant leopard buffalo combine dont get close,1610320801907052545,1356477814845755393,en,2023-01-03 17:02:52+00:00
3956,4320,vivekwild assamforest wtiorgindia founate visit kaziranga last month see firsthand success conservation effos,1610319565552234496,337917494,en,2023-01-03 16:57:57+00:00
3957,4321,national geographic photo favorite instagram follower photograph keeper joseph wachira comfoing sudan last living male nohern white laid die photography video,1610318375980519424,1567648707415363586,en,2023-01-03 16:53:13+00:00
3958,4322,marklevinshow fpjoes administration killer tule boy need vote american killer,1610318249819774977,1590801730605817863,en,2023-01-03 16:52:43+00:00
3959,4324,kmssecond attempt turn much betterno wonder remains fav walk routefour traffic stopper bad boy pair crest crane head roost nairobinationalpark dry btw catchy reggae soundtrack,1610316577194344454,50093081,en,2023-01-03 16:46:04+00:00
3960,4325,beardvet belong zoo ,1610316135517274113,1518673116716752897,en,2023-01-03 16:44:19+00:00
3961,4326, close shave junglelife jungle wildlife forest safari nature life dangerzone animalattack unicorn close encounter,1610315614824071176,727677621329342464,en,2023-01-03 16:42:15+00:00
3962,4327,bonginorepo fpjoes administration killer tule boy need coho,1610314506881871874,1590801730605817863,en,2023-01-03 16:37:51+00:00
3963,4328, mental image costume horn hold pink teacup elephant dance background passthebrainbleach,1610312821610532864,66018065,en,2023-01-03 16:31:09+00:00
3964,4329, enjoy hang bird otherestimated wild cero specie subspecies large specie white grows weigh kilogramstheir ,1610312130741379073,1563173732926885889,en,2023-01-03 16:28:24+00:00
3965,4331,narendramodi poach bjp govt ,1610310939827646465,1573923788005072896,en,2023-01-03 16:23:40+00:00
3966,4332, choice jimjordan gopleader kevin useless ,1610310721002430465,632529876,en,2023-01-03 16:22:48+00:00
3967,4334,greatthunberg rehoming wildlife bison revive threaten specie,1610309467773730818,2998848173,en,2023-01-03 16:17:49+00:00
3968,4336,loosebool zero poach guy get arrest december poach ,1610308387232694275,63384915,en,2023-01-03 16:13:32+00:00
3969,4337,zero poach assam state achieve feat,1610308272397119491,2317453476,en,2023-01-03 16:13:04+00:00
3970,4338,guwahatiplus record zero poach case assam read assam cero cmpatow,1610308027151966208,1542523103636467713,en,2023-01-03 16:12:06+00:00
3971,4339,wildwingssafari wildlife highlight include leopard laze tree elephant calf lion cub calf simon,1610307987138117632,2998848173,en,2023-01-03 16:11:56+00:00
3972,4340,wildwingssafari wildlife highlight include lion fight monkey strike perfect pose african fish eagle ,1610307398174150656,2998848173,en,2023-01-03 16:09:36+00:00
3973,4341,loosebool sir found move orang national park horn sawedoff new ,1610306872665571329,801503636865986560,en,2023-01-03 16:07:31+00:00
3974,4342, indeed great achievement assamforest deserve heay congratulation poach year indeed testament strict protection specie bounce back wtiorgindia,1610306684018364420,419344685,en,2023-01-03 16:06:46+00:00
3975,4344,honble shri narendramodi lauds conservation effos people assam zero poach incident repoed ,1610305336539504641,1206292736938086401,en,2023-01-03 16:01:24+00:00
3976,4345, finding study significantly impoant wildlife conservationit demonstrates spread pathogen multihost system impoant consequence conservation different specie ecosystem whole,1610305237134315521,9366272,en,2023-01-03 16:01:01+00:00
3977,4346,paulkoshy sardesairajdeep sardesai african black extinct level arrogance show place garbage last decade people even remote village communicate english travel abd country,1610304835030769665,1566514219813666816,en,2023-01-03 15:59:25+00:00
3978,4350,lilyswildflower lola look queen ,1610302332931276802,1361888542440439809,en,2023-01-03 15:49:28+00:00
3979,4355,trophyxpose meldawson hundred thousand year newborn comparison wreck planet many specie,1610299691429683201,857584868229881856,en,2023-01-03 15:38:59+00:00
3980,4357,dickerinos uncontrollably big horny,1610296884450545664,623249649,en,2023-01-03 15:27:49+00:00
3981,4359, first time decade assam repoed case poach incident fpexplained poach,1610293579708239873,256495314,en,2023-01-03 15:14:41+00:00
3982,4360,heafelt thanks people government assam reaffirm commitment towards protection conservation ,1610293451257688065,2570829264,en,2023-01-03 15:14:11+00:00
3983,4361,hime maisondegoat need goto marketplace spend little gmilk switch background btc eye version ,1610292654172180486,1414459316128477185,en,2023-01-03 15:11:01+00:00
3984,4362,repos year come good oneno poach assam india time yearsassam home world large population onehorned sconservationoptimism recap extinctionrebellion,1610290950173257729,776614746447458304,en,2023-01-03 15:04:14+00:00
3985,4363, time triviatuesday call group colonyb packc crashd fleettell answer comment black brookfield zoo,1610290546232233984,26664495,en,2023-01-03 15:02:38+00:00
3986,4364, bond marine corridor scroll back thegef event offer much inspiration include pledge project africa minigrids program soil restoration take look,1610290327541223431,39085195,en,2023-01-03 15:01:46+00:00
3987,4365, lauds people assam proactive effos conservation shillongtimesin,1610288281358594049,560159133,en,2023-01-03 14:53:38+00:00
3988,4366,modi mastermind developed india lauds conservation effos people assam zero poach incident repoed namo app,1610287411426373632,1150377470874415104,en,2023-01-03 14:50:11+00:00
3989,4368,mind intern banana help script control room go remember producer director kill live air discussioni glad sit quietly corner,1610285709868564480,1103747253049614336,en,2023-01-03 14:43:25+00:00
3990,4370, follow true indian cero indian found brahmaputra valley noh bengal south nepal horn modify teeth outgrown horn orang pobitora manas collectively indian ,1610284949101498368,1539576423954120704,en,2023-01-03 14:40:24+00:00
3991,4372, lauds conservation effos people assam zero poach incident repoed pib delhithe prime minister shri narendra modi compliment people assam effos conservation state,1610284701746434051,727582681148559360,en,2023-01-03 14:39:25+00:00
3992,4375,zero poach assam wow good newskudos himanta biswa sarma assam forest police dept,1610282170454790145,1533995896731750405,en,2023-01-03 14:29:21+00:00
3993,4376, narendramodi dada lauds conservation effos people assam zero poach incident repoed january namo app,1610281108658360322,1277901865993158656,en,2023-01-03 14:25:08+00:00
3994,4378,tonykaryakaa incident poach tremendous effo mygovassam able leadership cmofficeassam,1610280881327050753,1092362889564807169,en,2023-01-03 14:24:14+00:00
3995,4379,eahchangers rehoming wildlife bison revive threaten specie sdg lifeonland biodiversity conservation travel traveltuesday endanger redlist iucn,1610279494035673088,14974486,en,2023-01-03 14:18:43+00:00
3996,4380,sikkayathah aranganathan himantabiswa thats becos yesteryear poacher today run govt source income phew,1610279285251792903,1487110399044784130,en,2023-01-03 14:17:53+00:00
3997,4383, fantastic news happy wildlife,1610278360172875776,86267028,en,2023-01-03 14:14:13+00:00
3998,4384,theashoksinghal incident poach repoed thanks antipoaching measure initiate honble ,1610278239171399680,1463813643003256832,en,2023-01-03 14:13:44+00:00
3999,4386, incident poach repoed thanks antipoaching measure initiate honble himantabiswa dangoriyathis signifiant achievement fuhers honble shri narendramodi ji vision wildlife conservation,1610276551031160832,145874163,en,2023-01-03 14:07:01+00:00
4000,4388, poach assam team official achieve amaze feat india news,1610276283589558276,191768572,en,2023-01-03 14:05:58+00:00
4001,4389,zero cero poach incident assam modi lauds people effos conservation,1610274784318820353,74980737,en,2023-01-03 14:00:00+00:00
4002,4390,maisondegoat need goto marketplace spend little gmilk switch background btc eye version spy go vault aka locker shoutout smoking nickname,1610273977389154305,23981978,en,2023-01-03 13:56:48+00:00
4003,4391,assam modi lauds people assam conservation effos state conservation zeropoachingincidents compliment narendramodi himantabiswa,1610273792215126021,438156528,en,2023-01-03 13:56:04+00:00
4004,4392,vote country time bullshit unsecure border inflation kill country petroleum industry tank grow fuk ,1610273754294415362,1586022664438587392,en,2023-01-03 13:55:55+00:00
4005,4393,official credit sincere conceed coordinate effos state forest police depaments zero poach ,1610273700024041473,1482366940861640708,en,2023-01-03 13:55:42+00:00
4006,4395, burnol moment call woke fake nature conservationist poach major issue congress rule sincere effos wildlife conservation yield result,1610272814128582658,96196082,en,2023-01-03 13:52:10+00:00
4007,4396,debadmj himantabiswa cm message sound good entirely accurate newspaper hindu repoed goh orang survive removal horn poachersfounately injured animal rescue,1610272626928148482,44861089,en,2023-01-03 13:51:26+00:00
4008,4397, first time many year poach assamindia ,1610272392579846144,1317484125528444930,en,2023-01-03 13:50:30+00:00
4009,4398, shri narendramodi lauds conservation effos people assam zero poach incident repoed read ,1610269534006673411,3240740509,en,2023-01-03 13:39:08+00:00
4010,4399, rehoming wildlife bison revive threaten specie sdg lifeonland biodiversity conservation travel traveltuesday endanger redlist iucn,1610269391782031361,730795063840804864,en,2023-01-03 13:38:35+00:00
4011,4400,enewsbharati poach incident repoed assam chief minister himanta biswa sarma interact repo,1610268842026242048,4325261772,en,2023-01-03 13:36:23+00:00
4012,4401,kukkurovaca know thats left unicorn magnificent activism wild palm,1610268229372346376,35776641,en,2023-01-03 13:33:57+00:00
4013,4402, modi lauds assam people zero poach incident repoed mynewsne assam himantabiswasarma narendramodi poach lauds people,1610267756389367809,1264500846869372931,en,2023-01-03 13:32:05+00:00
4014,4404,assam achieves zero poach horn onehorned,1610267233665564672,1091263010558029824,en,2023-01-03 13:30:00+00:00
4015,4405, poach assam india time year news,1610266237312946181,1037391524701581313,en,2023-01-03 13:26:02+00:00
4016,4406, poach assam india time year rworldnews,1610265327052492800,1442512156193292293,en,2023-01-03 13:22:25+00:00
4017,4408,mating pain mating front tourist nairobi national park,1610264348655783941,4873215750,en,2023-01-03 13:18:32+00:00
