,Unnamed: 0,tweet,tweet_id,author_id,lang,created_at
0,0,rainmaker use detailed fossil comparison technique scientist able identify giant new sabertoothed cat specie,1391415080080875524,838081120101150721,en,2021-05-09 15:29:40+00:00
1,1,happy mother day mechanical inc runwith mechanicalinc servingwestgeorgia residentialhvac commericalhvac industrialhvac hourservice,1391414442953478144,1352621981917720578,en,2021-05-09 15:27:09+00:00
2,2,drwillfowlds hope mothersday relaxed super mom thandi first calf thembi poachingsurvivor ,1391413833533693953,22230837,en,2021-05-09 15:24:43+00:00
3,3,wish mom amaze motherday friend shelter ,1391412264842973193,1130883849586716672,en,2021-05-09 15:18:29+00:00
4,4,hope mothersday relaxed super mom thandi first calf thembi poachingsurvivor ,1391411637681377283,869959916,en,2021-05-09 15:16:00+00:00
5,5,cbthunting government say want ban hunt trophy still let rich brit shoot critically endanger ,1391411421867646977,759955208306888704,en,2021-05-09 15:15:08+00:00
6,6,assam police arrest suspect poacher karbi anglong recover rifle magazine round live ammunition number torch bag itemspoachers hunt,1391410936863363077,1113747196099399680,en,2021-05-09 15:13:13+00:00
7,7,happy mother day remember mom shoot free day chiappafirearms shoot center cape coral,1391409091059359749,1339260938424344577,en,2021-05-09 15:05:53+00:00
8,8, suppoing work community scout ranger training provision equipment awf empowers community living protect area fight illegal wildlife kill traffic awfcommunities,1391407781375356931,87278028,en,2021-05-09 15:00:40+00:00
9,9,nczoo young big still keep mom toe happy mother day noh carolina zoo,1391407430525980674,2815688831,en,2021-05-09 14:59:17+00:00
10,10,record fully endorse treatyourself challenge mothersday well do jennifer duranduran,1391406829318463495,61661919,en,2021-05-09 14:56:53+00:00
11,11,gpsinghassam karbianglongpol recovers series rifle arrest poacher way kaziranga national park ,1391406546576281603,919142022350495744,en,2021-05-09 14:55:46+00:00
12,12,mother child mother day chubbyunicorn kindi,1391405011956113415,338672288,en,2021-05-09 14:49:40+00:00
13,13,ani assam police arrest suspect poacher karbi anglong recover arm ammunition possessionthe,1391404189935280134,2479003610,en,2021-05-09 14:46:24+00:00
14,14,happy mother day mom everywhere special thanks everyone work hard end poach protect family happymothersday ,1391404149011517445,1253114140178219010,en,2021-05-09 14:46:14+00:00
15,15,horni join friend olpejeta wish inspirational sirdavidattenborough happy bihday,1391403109046525953,613462039,en,2021-05-09 14:42:06+00:00
16,16,today karbianglongpol apprehend poacher cache arm ammunition include aksgood job guysevery gun recover poacher arrest help go extinctkarbianglong saving cero onehorned assamnews,1391402007194333197,1218596352965263360,en,2021-05-09 14:37:44+00:00
17,17,stekenya applaud south africa government decision prioritise wildlife commercial exploitation agree shift,1391401846963638275,1073096424903069696,en,2021-05-09 14:37:05+00:00
18,18,newly identify specie sabertoothed cat big hunt america,1391400389954703365,336221131,en,2021-05-09 14:31:18+00:00
19,19,bafjustthefacts joint comped actual favs pantry downtown slum norm vega omelet house cafe monde nola chicory beignet enough sugar kill lol,1391400064531111936,1184494271992197126,en,2021-05-09 14:30:01+00:00
20,20,cbssunday ajani joe black calf enjoy share mud puddle mother seyja cincinnati zoo,1391398875181862917,2930152812,en,2021-05-09 14:25:17+00:00
21,21,today founate enough see dehorn reso hack innocent animal horn save life world full many bad people use abuse animal see fit theirlivesmatter alllivesmatter,1391398733095571456,730822614,en,2021-05-09 14:24:43+00:00
22,22,stevestuwill newly identify specie sabertoothed cat big hunt ,1391398385433944064,55369958,en,2021-05-09 14:23:20+00:00
23,23,matt take time time inspect everything take time explain everything first time home buyer helpful someone help understand everything give say chrissy google summitwebmarketing,1391397197451874304,2255165954,en,2021-05-09 14:18:37+00:00
24,25,grancracker itsjenjensworld bibekum moiciaanders tuffguysmom smurrayesq dermonashley joejacksonlive dianeh mcisaacdamien seymourslothrop draytrades mightymercer lutherudy polandesther criticalnerve resisteru baby thanks,1391396507245481992,1280830046110875649,en,2021-05-09 14:15:52+00:00
25,26,fiskantes noidtwo spencernoon country happens skin whitener fake antibiotic horn cure cancer even germany thalidomide shitshow sgiven potential harm cause scam drug many place move right direction pharma regulation,1391395873096036352,1289834351803265025,en,2021-05-09 14:13:21+00:00
26,27,maffewgregg wish happy mother day usa,1391394393995808769,706894613211168768,en,2021-05-09 14:07:29+00:00
27,28,newly identify specie sabeoothed cat big hunt america,1391394129712754689,30157023,en,2021-05-09 14:06:26+00:00
28,29,missus happy mother day little let sleep ,1391394025341607936,1241360366325489670,en,2021-05-09 14:06:01+00:00
29,30,coach mother continue strength hold family together guy love beauty ,1391393803261648899,1131537831325818880,en,2021-05-09 14:05:08+00:00
30,31, early sunday morning sta happy mother day beautiful mother wisco repthe baseball,1391392123321257985,758995522568859649,en,2021-05-09 13:58:27+00:00
31,32,donlieber weinsteinlaw fredguttenberg want barbaric unethical hit nail head yemen still kill make handle ceremonial dick dagger,1391391637163626501,788543540380991488,en,2021-05-09 13:56:31+00:00
32,33,rocknroller realmikepacker horn probably good thing hippo,1391390943681601540,1325342075664158722,en,2021-05-09 13:53:46+00:00
33,34,assam police arrest suspect poacher karbi anglong recover arm ammunition possessionthe police also recover rifle magazine round live ammunition number torch bag item,1391390200870305794,1274733565108826112,en,2021-05-09 13:50:49+00:00
34,35,debadmj indian pair refresh mood pobitorawildlifesanctuarystaysafestayhealthy positive indiafightsc,1391389889820758023,1183898923871690752,en,2021-05-09 13:49:35+00:00
35,36, special shoutout mum wonderful people incredible thing precious orphan zululand mothersday mum,1391388101449289729,519683539,en,2021-05-09 13:42:28+00:00
36,37, mom common theyre strong bold tackle challenge head happy mother day amaze mom special shoutout mom ,1391387478448381954,68730054,en,2021-05-09 13:40:00+00:00
37,38,peteregan rickygervais marcthevet cbthunting grumpyoldrick drbrianmay actually pay see bunch cnts try kill gun shtbags,1391386884849426432,222218385,en,2021-05-09 13:37:38+00:00
38,39,ban south african domestic trade horn stop south africa want trade internationally endanger specie specie pa sign petition ukchange,1391386261408133136,366562639,en,2021-05-09 13:35:10+00:00
39,41,awglobal hope world endangeredspecies life southsudans vast wilderness,1391384699285688321,1315551732974317570,en,2021-05-09 13:28:57+00:00
40,42,hope world endangeredspecies life southsudans vast wilderness,1391382979092619268,708826764,en,2021-05-09 13:22:07+00:00
41,44,assam police arrest suspect poacher karbi anglong recover arm ammunition possessionthe police also recover rifle magazine round live ammunition number torch bag item thenewsshots,1391381661120663553,1298619383388884997,en,2021-05-09 13:16:53+00:00
42,46,blue happy mother day woman thank mom mothersday formom,1391379318081613827,625906744,en,2021-05-09 13:07:34+00:00
43,47,rememberingsudan nohern white,1391378982638034944,980604866912489472,en,2021-05-09 13:06:14+00:00
44,48,iicaprisun iceyxtrxdes hello look pet interested try buy trade please lmk still look trade ,1391378603921772545,1267515418811551744,en,2021-05-09 13:04:44+00:00
45,49, travel africa shoot black absolute madness people prosecute maybe spend money therapy literally less black left existence allow wealthy shoot ,1391376623358910464,2611513683,en,2021-05-09 12:56:52+00:00
46,50,nreillyjohnson woohoo thrill final throw dice acceptance splash inbox nationalflashfd ,1391375000263868425,401549007,en,2021-05-09 12:50:25+00:00
47,51,mirrorpolitics rickygervais hunter picture die exactly kill stupid fkers,1391370866508845057,89297803,en,2021-05-09 12:33:59+00:00
48,52,newly identify specie sabertoothed cat big hunt america smanews,1391368135404519424,1267636346014728192,en,2021-05-09 12:23:08+00:00
49,53,mirrorpolitics rickygervais endanger less,1391368008942170117,954015349,en,2021-05-09 12:22:38+00:00
50,54,woohoo thrill final throw dice acceptance splash inbox nationalflashfd flashflood little story charge view june time confirm flashfloodthank oppounity,1391367978084622347,981131994,en,2021-05-09 12:22:30+00:00
51,55, potential fossil africa make favorite ancient gorilla elephant theropod sauropod thing wish discover,1391366902816153600,875132295019212804,en,2021-05-09 12:18:14+00:00
52,56,oelephants bantrophyhuntingi trophy myhornismyhorn,1391360866671603712,840255265496813575,en,2021-05-09 11:54:15+00:00
53,57, lil closeup sketch calf,1391359769357656064,910763468428533760,en,2021-05-09 11:49:53+00:00
54,58,ourworldphotos bodyguard protect last remain nohern white eah httptcomjkegkxhz,1391358823923818501,3187109420,en,2021-05-09 11:46:08+00:00
55,59,planet trade supply exotic pet trade new study confirms grey parrot also sell traditiona,1391358334981312518,2189053751,en,2021-05-09 11:44:11+00:00
56,60,take look sophisticated weapon poacher equip day kill kaziranganationalpark assam congratulation karbianglongpol,1391357751259910148,203063155,en,2021-05-09 11:41:52+00:00
57,61,hodilu male kimba schwerin zoo expect move zurich zoo june new successful breeding,1391356507371999237,185034334,en,2021-05-09 11:36:56+00:00
58,62,hodilu kenya begin first national wildlife census friday focus counting rare specie include elephant ,1391356421699158016,185034334,en,2021-05-09 11:36:35+00:00
59,63,tigerdriverx happy mother day ,1391353870018883588,1178322700592394240,en,2021-05-09 11:26:27+00:00
60,64,yanaufelman wild go wild new awork hicetnunc hicetnunc hicetnunc cle,1391350105077338115,1378636470437691396,en,2021-05-09 11:11:29+00:00
61,65,bibekanand dedicate mothershappymothersdayindiwild aweassamincredibleindia indian calf cell ,1391347574712397832,1360138409348538370,en,2021-05-09 11:01:26+00:00
62,66,newly identify specie sabertoothed cat big hunt americathe research publish journal mammalian evolution,1391347410107043843,86565297,en,2021-05-09 11:00:47+00:00
63,67,tear thandi calf,1391346618776100866,1389678952571092997,en,2021-05-09 10:57:38+00:00
64,68,kashmiripandit sure fil go theyvwere say poitn etc openly kill well,1391346352513175557,1102171981158338560,en,2021-05-09 10:56:35+00:00
65,69,hope world endanger specie life south sudan vast wilderness independent,1391344207818858497,1032922624890994689,en,2021-05-09 10:48:03+00:00
66,70,also zoo rlly big tooises touch obviously baby goat stuff thats cool havent do make seperate reservation maybe next time,1391344071256510466,1720212996,en,2021-05-09 10:47:31+00:00
67,71,petition ban south african trade horn global trade endanger specie pa ,1391342057382424576,1514639766,en,2021-05-09 10:39:31+00:00
68,72,lisalisaw ban south african domestic trade horn stop south africa want trade internationally endange,1391342010385244164,1514639766,en,2021-05-09 10:39:19+00:00
69,73, mom professional let know free itsm membership mothersday mothersday mothersdaygift mom itsm itmanagment itprofessional womeninstem,1391340146109423617,1264904751159918593,en,2021-05-09 10:31:55+00:00
70,74,horni conservationist world celebrate news south africa look set end controversial captive ,1391337636564963329,1061345761722535936,en,2021-05-09 10:21:57+00:00
71,75,dedicate mothershappymothersdayindiwild aweassamincredibleindia indian calf cell phone click pobitora wls assam india,1391336936598474756,179874636,en,2021-05-09 10:19:10+00:00
72,76,newly identify specie sabertoothed cat big hunt ,1391335888559431680,33856936,en,2021-05-09 10:15:00+00:00
73,77,hemforce mission prevent extinction wild southern africa protect endanger animalswe ,1391330443224666115,56621626,en,2021-05-09 09:53:21+00:00
74,78,dailymirror population today elephant population seem decline quite considerably year please search google lunar mountaineer bbc link olympus mon,1391330298483429377,1368887668495499265,en,2021-05-09 09:52:47+00:00
75,79,nyatsanze maguranyanga horncutter offering elephant behalf son imwi vemombe,1391328717113278464,502042014,en,2021-05-09 09:46:30+00:00
76,80, carrier paper interview nissa ole kinyaga silver guide kenya find work side side african wildlife country new successful sanctuary,1391327084451147777,3200458739,en,2021-05-09 09:40:01+00:00
77,81,door rickygervais trophy hunt southern african country pay hunt kill many different animal lion elephant giraffe ,1391320623859724288,1602679219,en,2021-05-09 09:14:20+00:00
78,82,happy mother day humani turgwe river lodge rocky orphan rock,1391320441936093186,1091779297591873536,en,2021-05-09 09:13:37+00:00
79,83,spokespersonchn zlj great news tibetan antelope china need stop eat tiger product market world tiger horn pangolin hundred specie found disease ridden wet market china,1391319882956898305,1153976983077834753,en,2021-05-09 09:11:24+00:00
80,84,newly identify specie sabertoothed cat big hunt america science fossil cat prehistoric,1391318546798497792,763247575524708352,en,2021-05-09 09:06:05+00:00
81,85,also walk conservation poacher access stupid human try domesticate wildlife,1391318392196542467,821844927449591808,en,2021-05-09 09:05:28+00:00
82,86, think population white produce new generation year theyre verge extinction ,1391318363448688643,256409754,en,2021-05-09 09:05:21+00:00
83,87, backing fabric new home tomorrow cero africananimals wildanimals safarianimals safari endanger lookafterourplanet oneworld gentlegiant,1391313341226881025,1259791263173353473,en,2021-05-09 08:45:24+00:00
84,88,wwfkenya threaten baby run front mother young rarely attack due protectiveness ,1391312939529945091,595734891,en,2021-05-09 08:43:48+00:00
85,89, threaten baby run front mother young rarely attack due protectiveness mother,1391312118444609536,1073837954,en,2021-05-09 08:40:33+00:00
86,90,piersmorgan exactly first saw duchess sussex author hat living royalty disrespect queen still thick face enough use duchess title family wild boar kind thick skin bench,1391305564395765768,1367828861916827650,en,2021-05-09 08:14:30+00:00
87,91, theme reso give unique holiday experience safariinspired ambience accommodationdiscover sensation living reso surround zoo complete typical wildlife giraffe zebra cape buffalo hippo wildebeest ,1391301009356382213,1156238578667491328,en,2021-05-09 07:56:24+00:00
88,92,newly identify specie sabertoothed cat big hunt america science,1391299097873768455,622973230,en,2021-05-09 07:48:48+00:00
89,93,congratulation new elect himantabiswa hope proactive leadership assam march forward fulfil aspiration assamese people best wish sarbanandsonwal effos past year specially check poach assam,1391298316416077828,143299434,en,2021-05-09 07:45:42+00:00
90,94,simsgumz beachalso inqolobane isale ethekwini something zoo,1391297539400417280,622653144,en,2021-05-09 07:42:37+00:00
91,95,recfund year battling poach crisis nearly invest conservation thats milesto,1391296771637268481,78661261,en,2021-05-09 07:39:34+00:00
92,96,planet poach rise south africa government loosen coronavirus restriction follow ,1391293600387018753,4905332446,en,2021-05-09 07:26:57+00:00
93,97,thats lot scumbags proud kill defenseless,1391281417800372225,1698723264,en,2021-05-09 06:38:33+00:00
94,98, government say want ban hunt trophy still let rich brit shoot critically endanger lion elephant polar bear bantrophyhunting bloodmoney loophole,1391280661948993536,84432492,en,2021-05-09 06:35:33+00:00
95,99,helping kariega paners kariegagameres incredible work wildlife call reser,1391278011803185152,245088788,en,2021-05-09 06:25:01+00:00
96,100, safari best kazirangakohora central range generally believe best range safari house dense population elephant spot tiger migratory bird eastern range prefer visitorstravel natgeotravel,1391277735075483648,1379341806291218432,en,2021-05-09 06:23:55+00:00
97,101,helping emergency orphan appeal plan sneak attack get caught act orphan conservation,1391277477427916800,245088788,en,2021-05-09 06:22:53+00:00
98,102,merielmyers use ranger south africa spent night protect day survey patrol reserve specie favourite observe giraffe watch chew bone calcium always make smile ,1391277199446188034,1150415456,en,2021-05-09 06:21:47+00:00
99,103, mission prevent extinction wild southern africa protect endanger animalswe keep eye elephant leopard lion pangolin wild dog creature roam territory protecthemmersbach force,1391272483999948801,866994053681881088,en,2021-05-09 06:03:03+00:00
100,104,omgthemess excuse kill tiger,1391263673738432513,3238459861,en,2021-05-09 05:28:02+00:00
101,105,kariegagameres know approx white left wild help conserve significant ,1391263537859751939,439054393,en,2021-05-09 05:27:30+00:00
102,106, excuse kill tiger,1391263442795859968,1388148914,en,2021-05-09 05:27:07+00:00
103,107,kariegagameres workersday today pay tribute antipoaching team protect wildlife especially help keep ,1391263370989359110,439054393,en,2021-05-09 05:26:50+00:00
104,108,male fight calf kid mate mother olpejeta conservancy survival struggle specie isnt youtube,1391260615587549185,399463138,en,2021-05-09 05:15:53+00:00
105,109,natgeo freerunning hound revolutionize effos track poacher kruger national park savetheday,1391256802524684288,2774678940,en,2021-05-09 05:00:44+00:00
106,110,think almost exclusively last several month esp product broadening lowincome indebtedness enrichment company landlord also paternalism marketing keep go back loneberrywangs carceral capitalism,1391251024212541440,2273152536,en,2021-05-09 04:37:47+00:00
107,111,planet friend drwillfowlds action recently onelandloveit team conservation effos ,1391241434183962625,300254843,en,2021-05-09 03:59:40+00:00
108,112,clann sundownsol told rest squad one last laugh say told jerk horneds response,1391239778520154112,725718738763440130,en,2021-05-09 03:53:05+00:00
109,113,gabiiel ema wojho simplyyanggang chenweihua gretathunberg tiger bone horn stuffthis several year old course china hasnt change,1391238251688562689,826872089911185408,en,2021-05-09 03:47:01+00:00
110,114,indian pair refresh mood pobitorawildlifesanctuarystaysafestayhealthy positive indiafightscovid hodilu savethe sirf,1391237596865470465,2504202403,en,2021-05-09 03:44:25+00:00
111,115,icymi maria genero recently go wild buffalo zoo discuss difference specie ,1391230192140570627,15308015,en,2021-05-09 03:15:00+00:00
112,116,akaxochi newly identify specie sabertoothed cat big hunt america,1391226043760095236,2217063241,en,2021-05-09 02:58:31+00:00
113,119,camirlufe ever wonder beetle horn develop grub pupa insect fascinatingthe horn compactly fold,1391221359791968257,554633983,en,2021-05-09 02:39:54+00:00
114,120,make horn jarrah,1391220319751340032,909476188615098368,en,2021-05-09 02:35:46+00:00
115,121,reuters javan enjoys mud bath tropical water indonesia ujung kulon national park,1391213181373194240,716071222421815296,en,2021-05-09 02:07:24+00:00
116,122,ever wonder beetle horn develop grub pupa insect fascinatingthe horn compactly fold beneath larval cuticle unfolds accordion horn approx size adult romainpboisseau dougemlen,1391212213713608705,482216305,en,2021-05-09 02:03:33+00:00
117,124,amaze aistic talent creativity imagination creativity imagination cero globalstreeta camouflage wdwilddrawing bali indonesia globalstreeta streeta paintedcities,1391205034856169476,262413057,en,2021-05-09 01:35:02+00:00
118,126, chance capture mother child chester zoo walk past enclosure happen stop together nature chesterzoo mother child animal horn,1391204258763116545,42930140,en,2021-05-09 01:31:57+00:00
119,127, late rare studio wildlife news thanks brafot wildlife conservation,1391201821570502659,973866358705475584,en,2021-05-09 01:22:16+00:00
120,128,tameoscar rememberingsudan nohern white mothersday,1391200676487774211,1958553691,en,2021-05-09 01:17:43+00:00
121,129,wildlifemag photo day indian aka onehorned kaziranga national park assam india zhayynn james ,1391200464021114880,1958553691,en,2021-05-09 01:16:52+00:00
122,130,weehepeople matthewotoole unionistsloyalists wont take seriously try convince everyone include africa land protocol know bojo dup deliver sign seal bribe end unionisolated alonelearn,1391200408798908421,1252189191489847298,en,2021-05-09 01:16:39+00:00
123,131,stevebloomphoto first day first trip africa begin change career wildlife photographer way back ,1391198725310136321,3426754587,en,2021-05-09 01:09:57+00:00
124,132,wgrz today buffalo series wild buffalo zoo find tell difference spe,1391198553607917574,3426754587,en,2021-05-09 01:09:17+00:00
125,133,awfofficial protect awf suppos wildlife scout ranger provide facilitate training surveillance trackin,1391198373378727938,921576933028085760,en,2021-05-09 01:08:34+00:00
126,134,endanger dont let remains fight intense time act ,1391198042573971457,3426754587,en,2021-05-09 01:07:15+00:00
127,135,endanger hold fate organism planet hand protect habitat share,1391197933744189442,3426754587,en,2021-05-09 01:06:49+00:00
128,137,drwillfowlds suppoing conservation chipembere foundation crf recently receive amaze donation ,1391197273200209928,3426754587,en,2021-05-09 01:04:11+00:00
129,138,endanger human being ignore suffer others conservation,1391197040881831944,3426754587,en,2021-05-09 01:03:16+00:00
130,139,kingggb frankie whyyou kill white sfrankie,1391196358753857538,264313560,en,2021-05-09 01:00:33+00:00
131,140,fresnozoo tell mom youre best mother adopt favorite animal mother day adoptananimal special includ,1391192080727216129,1351182373224927234,en,2021-05-09 00:43:33+00:00
132,141,horni new research bought cautiously good news imperilled sumatran news dwindle pop,1391189447354560513,1059502628,en,2021-05-09 00:33:05+00:00
133,142,julianamonty baby try wake mother kill horn devastate reality poacher leave ,1391184037105049606,1342079958860976134,en,2021-05-09 00:11:36+00:00
134,143,yanaufelman unborncreate hicetnunc thats awesome wild,1391176724021276672,1385307038599716864,en,2021-05-08 23:42:32+00:00
135,144,natgeotravel people try save specie taught photographer ami vitale indelible lesson savetheday,1391170500869726208,129508496,en,2021-05-08 23:17:48+00:00
136,145, houseguest week ago unwillingly invite home twice space day rescue host bewilder enteaining snuggle return suburban wild back bell,1391166626935066629,17053,en,2021-05-08 23:02:25+00:00
137,146,eralpatky hcandler rainforestresq never occur travel africa see animal extinction elephant ,1391164539064963073,3181005949,en,2021-05-08 22:54:07+00:00
138,148,emmatrs second half kill ,1391155961054724098,500239975,en,2021-05-08 22:20:02+00:00
139,149,early mother day celebration bronxzoo ruzi happymothersday bronxzoo cero,1391152456063590400,3006025090,en,2021-05-08 22:06:06+00:00
140,150,sumatran show low inbreeding happens collapse quick,1391144307583852550,2823365823,en,2021-05-08 21:33:43+00:00
141,151, endanger specie spot south sudan ssot ,1391143068783595536,1255892827608940545,en,2021-05-08 21:28:48+00:00
142,152, already know regard poach white soon become extinct,1391140783714099200,278214155,en,2021-05-08 21:19:43+00:00
143,153,lorraineandlill hope world endanger specie life south sudan vast wilderness,1391139199236157442,133841187,en,2021-05-08 21:13:25+00:00
144,154,fossilrim nationalbabysittersday perhaps nobody many babysitter jiwe white calf ,1391137081624248325,2245546364,en,2021-05-08 21:05:00+00:00
145,155,holy feline fossil batman newly identify specie sabertoothed cat big hunt america scichat eahscience,1391136211276812291,14310068,en,2021-05-08 21:01:33+00:00
146,156,yaminetto suncitadel canon tell mangax zero cain neon tiger blast hornet tunnel blizzard buffalo,1391134424419512321,1273351385887670274,en,2021-05-08 20:54:27+00:00
147,157, reidparkzoo southern white yabonga fireball come see next time visit zoo animal,1391134177030918148,1386097599531261953,en,2021-05-08 20:53:28+00:00
148,159,nearby woodland park groom unfounately lousy aurora ave traffic noise poor hear time dog owner today use leash park bad thing told seattlezoo open zoo ground old day,1391130628557398017,256755958,en,2021-05-08 20:39:22+00:00
149,160,bloodthirsty trophyhunters kill animal minute damn expose industry reveal animal include lion elephant endanger slaughter past decade,1391130512761229317,1282615822083661824,en,2021-05-08 20:38:54+00:00
150,161,white rare wild,1391128912072085508,1689252246,en,2021-05-08 20:32:33+00:00
151,162,killiegamer mspalnts gon follow mobile witchhunter stormtrooper army request get dont think theyre rule anymore,1391128618802335746,78658724,en,2021-05-08 20:31:23+00:00
152,163,horni conservationist south africa kwazulunatal province recently undeook major dehorn operation effo,1391127684336525312,804678572568936448,en,2021-05-08 20:27:40+00:00
153,164,celebrate mothersday thank mum maternal figure life love suppo hard work adopt orphan elephant rescue animal care lose mother help,1391125552786853890,86554003,en,2021-05-08 20:19:12+00:00
154,165,bobenns stonecoldapathy sherriemackay johnhou donwinslow often animal get old male cant mate successfully injure young rival prevent mating found research conservation cull keep population healthy grow,1391125509023670272,902268741844692992,en,2021-05-08 20:19:01+00:00
155,166,slynvulpes yeah arent shapedtheyre dude grey suit horn eye itim talk literal robot concept anot bipedal design,1391123587910803458,963181603554983937,en,2021-05-08 20:11:23+00:00
