,Unnamed: 0,tweet,tweet_id,author_id,lang,created_at
4025,4386,win trade join mass switch public liability insurance use massive deal gas app enter month amaze giveawayyoull even get discount thats exclusive user,1384488067113836547,770336297856761856,en,2021-04-20 12:44:12+00:00
4026,4387,kill big monster space ,1384484473199374339,533684822,en,2021-04-20 12:29:55+00:00
4027,4388,accept ugwildlife uganda wildlife authority cant manage ziwa conservancy different level conservation point,1384483360504905737,519336219,en,2021-04-20 12:25:30+00:00
4028,4389,babyleobill number indian endanger specieswe destroyed habitat developed farmland,1384482855875579914,1169423036333772800,en,2021-04-20 12:23:29+00:00
4029,4390,enca come crimewatch investigate poach abramjee visit kruger national park look effos ,1384480007595167745,1268587026,en,2021-04-20 12:12:10+00:00
4030,4391,karmabantrophyhunting suspect poacher trophyhunter kill elephant eat lion southafrica,1384479626689454082,167142020,en,2021-04-20 12:10:40+00:00
4031,4392,steer excite give guardian masterclass financial decision make time medium zoom ,1384478095004999681,23583839,en,2021-04-20 12:04:34+00:00
4032,4393,summeonhaise insaneclipss likely sanctuary he carers animal probably elephant tuskselephant tusk horn remove soon grow back avoid poacher trespass kill ,1384473205830656002,832322628086067208,en,2021-04-20 11:45:09+00:00
4033,4394, notable population private reserve increase government reserve population decreaseds poach southafrica,1384469499022172160,1310954464065486851,en,2021-04-20 11:30:25+00:00
4034,4395,charity feature pangolin preservationrevolutionorg repost revolutionorg pangolin seize revolution veterinary nurse jacky spiby assist provet animal hospital yet pangolin confiscate trade young male ,1384469203328045057,1082981427128487936,en,2021-04-20 11:29:14+00:00
4035,4396,accord ecologist population nepal nationalparks grown high year break tourism cause covid pandemic allow regeneration habitat animal,1384468679253975042,1253567836900986880,en,2021-04-20 11:27:09+00:00
4036,4397,orphan story premiere international wildlife film festival durbantv,1384467272064921608,51004060,en,2021-04-20 11:21:34+00:00
4037,4398, uganda wildlife authority uwa immediate effect indefinitely close ziwa sanctuary publicdetails newvisionat visionupdates,1384466624577785857,56960258,en,2021-04-20 11:19:00+00:00
4038,4399,harrisonsmith think fool elephant think jason god damn poacher,1384464941881696256,1127798189334122496,en,2021-04-20 11:12:18+00:00
4039,4400,coinmastergame cross road help need defense village thank friend find mother day come,1384464719558418435,80853236,en,2021-04-20 11:11:25+00:00
4040,4401,africatembelea minister butime order closure ziwa sanctuary public land dispute urge uwa expedite introducti,1384462573823688707,60303483,en,2021-04-20 11:02:54+00:00
4041,4402,mammal horse sabertoothed cat roam park acre protect expanse mixedgrass prairie bison bighorn sheep prairie dog blackfooted ferret live today ,1384461951758123015,711656024764243968,en,2021-04-20 11:00:26+00:00
4042,4403, recently conclude census march april count great onehorned cero nepal,1384461780223553537,160131888,en,2021-04-20 10:59:45+00:00
4043,4404,uganda wildlife authority issue statement closure ziwa sanctuary publicmamafmnewsupates,1384461461175508999,1371376513199845377,en,2021-04-20 10:58:29+00:00
4044,4405,minister butime order closure ziwa sanctuary public land dispute urge uwa expedite introduction wild africatembelea uganda africatembeleanews cero nakasongola,1384461110674292743,1022188086283960320,en,2021-04-20 10:57:05+00:00
4045,4406,uwa realise conflict potentially compromise safety take decision ave threat ugwildlife sirf savethe tourismboardug discoverug conservationan,1384459812453371904,819073758,en,2021-04-20 10:51:55+00:00
4046,4407,welcome little furballs impoant job future join unit dog train detect weapon ivory horn well track apprehend poach suspect found conservancy kdogs,1384458958220496896,1223186389631672320,en,2021-04-20 10:48:32+00:00
4047,4408,ziwa sanctuary close public land dispute wildlife uganda softpowernews,1384457572779020290,3784907241,en,2021-04-20 10:43:01+00:00
4048,4409,noelzeek pattyfit cbsnews defend poacher kill horn strange hill die guess know scumbags,1384457524443762689,311540855,en,2021-04-20 10:42:50+00:00
4049,4410,banham zoo run zoological society east anglia new resident female name belle relocate cotswold wildlife park cow hope successfully breed male zimba,1384456027626745858,44861089,en,2021-04-20 10:36:53+00:00
4050,4411,planet target attain population almost achieve animal reintroduce ,1384455602416590848,2189053751,en,2021-04-20 10:35:12+00:00
4051,4412,muracasardis first actual horn who demade nonexternallyhired aisttennogen,1384452628441182208,1271587250,en,2021-04-20 10:23:23+00:00
4052,4413, uganda wildlife authority close ziwa sanctuary ban tourism activity decision follow unsolved conflict concern ownership facility,1384452382273196032,44861089,en,2021-04-20 10:22:24+00:00
4053,4414,patuhaire uganda wildlife authority close ziwa sanctuary animal safety due dispute sanctuar,1384450442550149123,32569299,en,2021-04-20 10:14:42+00:00
4054,4415,digusting kill hunt animal make room human animal populationhow nohern white left whole planet overpopulation need watch extinctionthe factsthismorning itv schofe,1384448571945193472,354989547,en,2021-04-20 10:07:16+00:00
4055,4416,chimprepos ziwa sanctuary close public ownership conflictchimpreposnews tourism ugwildlife tourismboardug uga,1384447826470572032,268787277,en,2021-04-20 10:04:18+00:00
4056,4417,research paper publish dentinogenic ghost cell tumor sumatran cero observe female tabin wildlife reserve sabah euthanized apparently first repo dgct veterinary medicine,1384447211275177984,41572208,en,2021-04-20 10:01:51+00:00
4057,4418,ziwa sanctuary close public ownership conflictchimpreposnews tourism ugwildlife tourismboardug uganda news,1384446748748394497,388368711,en,2021-04-20 10:00:01+00:00
4058,4419,uwa temporarily close zziwa sanctuary wildlife authority uwa issue press release indicate tha,1384446484708397058,969255395897298945,en,2021-04-20 09:58:58+00:00
4059,4420,gcicuganda line uganda wildlife authority uwa mandate protect wildlife resource uganda uganda ,1384445774809993221,1229314232,en,2021-04-20 09:56:09+00:00
4060,4421,ubctvuganda statement ugwildlife close ziwa sanctuary public ubcupdates full statement,1384444537293189122,1228289864124289024,en,2021-04-20 09:51:14+00:00
4061,4422,cbsnews last paragraph suspect poacher park kill elephant body apparently eat lion,1384444137139695617,2326568887,en,2021-04-20 09:49:38+00:00
4062,4423,thebrinknews uganda wildlife authority close ziwa sanctuary uganda ugandanews read ,1384443296576069633,1098245188001165312,en,2021-04-20 09:46:18+00:00
4063,4424,yay nepal population grows high decade pandemic pause tourism wwfnepal cnn,1384442560354127873,1865005904,en,2021-04-20 09:43:22+00:00
4064,4425,uganda wildlife authority close ziwa sanctuary animal safety due dispute sanctuary land owner ngo run ziwa population southern white home wild country,1384442382549147648,467453309,en,2021-04-20 09:42:40+00:00
4065,4426,jointly launch government wwf tarai arc landscape tal programme aim secure large area mega wildlife specie building connectivity forest protect area,1384439459169570818,44861089,en,2021-04-20 09:31:03+00:00
4066,4427,uganda wildlife authority close ziwa sanctuary,1384438953541980163,48713626,en,2021-04-20 09:29:02+00:00
4067,4429,everycounts conservationpaners makingadifference savingaspecies olpejeta teamwork bemore helpingsnature ,1384437420330917893,1356417503702831106,en,2021-04-20 09:22:57+00:00
4068,4430,assam jakhalabondha police nagaon district arrest hardcore poacher sniper nagaland operation carry early hour monday kaziranga area,1384436963827240964,44861089,en,2021-04-20 09:21:08+00:00
4069,4431,thv suspect poacher park kill elephant body apparently eat lion htt,1384436875574849537,1359266513556033550,en,2021-04-20 09:20:47+00:00
4070,4433,cnn wildlife always consider good news wait see happens enough,1384433457959473160,861466616,en,2021-04-20 09:07:12+00:00
4071,4434, ugwildlife close famous ziwa sanctuary unsolved management conflict funduganda rfu ziwa sanctuary wildlife ranch zrwr,1384429327853436930,1229716760351268864,en,2021-04-20 08:50:47+00:00
4072,4435,update ziwa sanctuary close till fuher notice ugwildlife,1384427585862504451,826091101819908103,en,2021-04-20 08:43:52+00:00
4073,4436,chrisrunumi uwa ugwildlife announce temporary closure ziwa sanctuary activity track boat cruise,1384427036987609088,711179964805201920,en,2021-04-20 08:41:41+00:00
4074,4437,horni wake cup good stuff farmdirectcoffee conservation,1384426931035140096,445193336,en,2021-04-20 08:41:16+00:00
4075,4438,africa alive announce new arrival zoo fuher strengthens commitment conservation africaalive kessingland suffolk,1384426796087644161,1275059001382715393,en,2021-04-20 08:40:44+00:00
4076,4439,statement ugwildlife close ziwa sanctuary public ubcupdates full statement,1384425274679382016,360472444,en,2021-04-20 08:34:41+00:00
4077,4440,lonewalker ugwildlife newvisionwire dailymonitor softpowernews ugindependent chimprepos nbstv ntvuganda utauganda visi,1384421669532585985,1014150925743685634,en,2021-04-20 08:20:21+00:00
4078,4441,planet accord conservationist transformation outstanding hold renew hope longterm future ,1384421610644545538,1019944680748978178,en,2021-04-20 08:20:07+00:00
4079,4443, back long waysmy first rule rogue trader hardcover blister metal mini blister space marine orks blister metal dreadnought box quidat time ,1384420617085128707,33168144,en,2021-04-20 08:16:11+00:00
4080,4444, ziwa sanctuary nakasongola uganda currently close wildlife reservation aimsugandawildlife,1384419129222893568,2291156251,en,2021-04-20 08:10:16+00:00
4081,4445,read join protection ranger morning patrol boranawildlife safari purpose idea new blog ,1384419061694611459,17814692,en,2021-04-20 08:10:00+00:00
4082,4446, onehorned calf shift kaziranga manasnationalpark calf rescue kaziranga flood constitutes female male membernews assamwildlife save wildlifenews conservation,1384418428430155776,1126485363390705665,en,2021-04-20 08:07:29+00:00
4083,4447, hope arrest sends strong message poacher determine stop track ensure survival specie,1384417903571787777,922483076982296576,en,2021-04-20 08:05:24+00:00
4084,4448,bbc nature elephant secret life africa giant,1384414594207264769,398157610,en,2021-04-20 07:52:15+00:00
4085,4449,xoxallieee hornier ,1384413145276502016,1070193662141874176,en,2021-04-20 07:46:29+00:00
4086,4450,mutesijanet ugwildlife take security endanger white specie nakasongola base ziwa sanct,1384412315718664192,445618924,en,2021-04-20 07:43:11+00:00
4087,4451, people attempt poach park ranger say,1384412024713666560,451751944,en,2021-04-20 07:42:02+00:00
4088,4452,wildnetorg captivate many childhood tragically illegal poach put specie risk extin,1384411146908749825,78661261,en,2021-04-20 07:38:33+00:00
4089,4453,zambia conservation say,1384409923526746112,114695223,en,2021-04-20 07:33:41+00:00
4090,4454,conservation nepal focus habitat expansion nepalnews nepal nepali ,1384409724678983680,794118109753999360,en,2021-04-20 07:32:54+00:00
4091,4455,micsafaris definitely update murchison fall itinerary temporal closure ziwa sanctuary ugwildlife,1384408998825299968,2360155996,en,2021-04-20 07:30:01+00:00
4092,4456,ugwildlife close ziwa sanctuary fuher notice,1384408399643877376,1072928043755339777,en,2021-04-20 07:27:38+00:00
4093,4457,ziwa sanctuary close public fuher noticetourismug wildlifesafety lettourismthrive stateoftoursmtoday,1384407873296506880,4834467387,en,2021-04-20 07:25:32+00:00
4094,4458,lifeindia number domestic chicken successful specie eahbut lead horrible life die,1384405685681627136,16377736,en,2021-04-20 07:16:51+00:00
4095,4460,ugwildlife newvisionwire dailymonitor softpowernews ugindependent chimprepos nbstv ntvuganda utauganda visituganda tourismboardug ugwildlife want believe dispute pay arent resolve safety wont good idea reintroduce protectedareas guarantee full time security join team ,1384403820957118465,912401636,en,2021-04-20 07:09:26+00:00
4096,4461,uwa ugwildlife announce temporary closure ziwa sanctuary activity track boat cruise birding others sanctuary take place fuher noticedetails ,1384402875393187842,863046938127683584,en,2021-04-20 07:05:41+00:00
4097,4463, uganda wildlife authority ugwildlife announces temporary closure ziwa sanctuary immediate effect uganda,1384402118287691777,819280371951042560,en,2021-04-20 07:02:40+00:00
4098,4464,ugwildlife close ziwa sanctuary due conflict pay potentially threaten existence endanger specie detail ntvnews,1384401993226199040,479217587,en,2021-04-20 07:02:10+00:00
4099,4465, ugwildlife take security endanger white specie nakasongola base ziwa sanctuary due unending disagreement pay manage country sole sanctuary,1384401314709389313,1296458363639922688,en,2021-04-20 06:59:29+00:00
4100,4466, line uganda wildlife authority uwa mandate protect wildlife resource uganda uganda wildlife act ugwildlife close ziwa sanctuary publicfull statement ,1384399272158896131,765577387811667968,en,2021-04-20 06:51:22+00:00
4101,4467,yashar suspect poacher kill herd breeding elephant encounter flee park ranger man,1384399231880945665,1118561369819963392,en,2021-04-20 06:51:12+00:00
4102,4468,info slot gacor hokindobet aprilslotpragmaticsweet bonanza xmasgates olympustemujin treasureswild west goldgreat megawaysslothabanerokoi gatetreasure tombbikini islandslotjokerromahighway kingslucky drumagenslotterpercaya,1384397034933743619,993995365647990784,en,2021-04-20 06:42:28+00:00
4103,4469,target attain population almost achieve animal reintroduce protect area plan india conservation,1384396664505397250,905818825328926720,en,2021-04-20 06:41:00+00:00
4104,4470,news sanparks nab poacher sanparks say suspect poacher arrest pretoria skop section kruger national park suspect found weekend possession ammunition silencer high calibre hunt rifle,1384396244739665921,1158386916326350849,en,2021-04-20 06:39:20+00:00
4105,4471,joybhattacharj mar mission fir kitne horn bache hain ,1384395566252130306,1357211098026545152,en,2021-04-20 06:36:38+00:00
4106,4472,abramjee crimewatch even investigate poach visit kruger national park look effos ,1384394859117793280,34806919,en,2021-04-20 06:33:49+00:00
4107,4473, crimewatch even investigate poach visit kruger national park look effos cuail trade horn tune tuesday april dstv enca,1384394759784079361,174365756,en,2021-04-20 06:33:26+00:00
4108,4475,boltsandbombers well still release lion tiger zoo ive always want see happens lion walk local supermarket,1384393312195420161,955222638,en,2021-04-20 06:27:41+00:00
4109,4476, move canon wildlifeconservation wildlife canonphotography wildlifephotography wild southafricasafari instagramsouthafrica south africa,1384387254949318657,52679625,en,2021-04-20 06:03:36+00:00
4110,4478,lot love beautyremastered behalf afamcdk olpejeta highly appreciate kindness love suppo dollar matter wildlife conservation thank muchwe love ,1384379361000886272,973910373136064512,en,2021-04-20 05:32:14+00:00
4111,4479, march flower photograph findthebeautychallenge organize beautyremastered select photo earn usd donate olpejeta towards save nohern white ,1384379326762819586,973910373136064512,en,2021-04-20 05:32:06+00:00
4112,4480,come crimewatch investigate poach abramjee visit kruger national park look effos cuail trade horn catch late episode tonight dstv,1384378820938059776,301309392,en,2021-04-20 05:30:06+00:00
4113,4481,grepakeppa cnn care anything poacher actually try poach extremely endanger elephant give help handfoot lion clean uppoachers big international problem,1384377783405666305,1354528373679263750,en,2021-04-20 05:25:58+00:00
4114,4482,stariplarmy state horn,1384374414171467779,1303644565195247616,en,2021-04-20 05:12:35+00:00
4115,4483,south africa single horn fetch poacher international poach industry use helicopter sophisticated tech egregiously wipe specie wildlife sho term thrill profit wwf ,1384373653106688003,181396285,en,2021-04-20 05:09:33+00:00
4116,4484,greenhornetco jimjordan ,1384371971690008576,927886775049060352,en,2021-04-20 05:02:53+00:00
4117,4485,britneyment horn update moi,1384371929428242433,981052038263066624,en,2021-04-20 05:02:43+00:00
4118,4486,south africa poacher kill elephant eat lion cnn april ,1384370146802733058,181396285,en,2021-04-20 04:55:38+00:00
4119,4487,doctornikumoni baharul islam poacher arrest amoni involve anowar hussain rafiqul islam ,1384367136034881547,1266951830,en,2021-04-20 04:43:40+00:00
4120,4488, good count go manasnationalpark please take note largescale tree fell log manas animal cant survive smuggler continue tree fell moefcc ntcaindia,1384367109694627840,203063155,en,2021-04-20 04:43:33+00:00
4121,4489,aiyrham fully suppo elephant hunt people try kill friend,1384364197903880200,1232662543249707011,en,2021-04-20 04:31:59+00:00
4122,4490, poacher accomplice suspect want poach smother nature action,1384360250434719747,11744152,en,2021-04-20 04:16:18+00:00
4123,4491,eeeeeeeeeeeeee feel fall exhibit florida zoo,1384358442362621952,1209400325712568320,en,2021-04-20 04:09:07+00:00
4124,4493,check vtg small plastic animal gorilla elephant lion zebra safari africa assoed ebay,1384352045566545921,4309432582,en,2021-04-20 03:43:42+00:00
4125,4494,clintmallet threetwoprince mikedmw call doesnt even horn beast spot weld front sole purpose ram everyone call call trukk thing,1384336692413272065,213691488,en,2021-04-20 02:42:41+00:00
4126,4495,naplesresists pattyarquette yeah especially see get close personal canberra zoo theyre amaze beautiful creature hate slowly go love see wild ,1384333234230554627,1362934043789074433,en,2021-04-20 02:28:57+00:00
4127,4497,sathr naturesweb rare mammal often confuse hippo pig anteater closest living relative point actually horse tapir living fossil theyve eocene survive wave extinction animal,1384325393868640260,960933635296841728,en,2021-04-20 01:57:48+00:00
4128,4498,playmobilusa fun playmobil zoo fact know name big horn cero actually mean nose horn ,1384324309544472576,608349633,en,2021-04-20 01:53:29+00:00
4129,4499,team nagaon well lead jakhalabandha bust poacher planning big rifle attach silencer believe spread noise poachersnagaonpolice,1384323234418466817,181491054,en,2021-04-20 01:49:13+00:00
4130,4500,showbiz record wildaboutmusic rumour session somebody crack beer spue tape wipe fast perhaps cocaine rescue,1384318547611070464,18199947,en,2021-04-20 01:30:35+00:00
4131,4501, late rare studio wildlife news thanks vegankitty natureworldnews book algerie,1384316428581576707,973866358705475584,en,2021-04-20 01:22:10+00:00
4132,4503,ban horn trade south africa,1384309022329765888,18430448,en,2021-04-20 00:52:44+00:00
4133,4504,silver earring aluminum lightweight uganda africa etsy,1384306293632946177,18498000,en,2021-04-20 00:41:54+00:00
4134,4505,nepal population grows high decade pandemic pause tourism cnn ecosearch,1384303963894272002,1266563068223504389,en,2021-04-20 00:32:38+00:00
4135,4508,karmic age elephant poacherskilled,1384296621794463745,132733246,en,2021-04-20 00:03:28+00:00
4136,4509,understand determinant intention purchase horn vietnam theory plan behaviour theory interpersonal behaviour,1384295748972519424,1050553288272146432,en,2021-04-20 00:00:00+00:00
4137,4510,showbiz record wildaboutmusic mine arrive today good remastering expand track list capture music remember first conce reignite love farmer daughter much bought beach boy surf usa album original,1384295404364173328,22084396,en,2021-04-19 23:58:38+00:00
4138,4511,vegaslamb cant imagine stupidity people let botswana safari hunt endanger ,1384294389422297088,1294817294883917824,en,2021-04-19 23:54:36+00:00
4139,4512, bull get horn get obituary,1384290286403145734,27436134,en,2021-04-19 23:38:17+00:00
4140,4513,sheldricktrust zoomies,1384289513598447619,3184721929,en,2021-04-19 23:35:13+00:00
4141,4514,go zoo dog home spending day talk dog compare animalpoppy look red pandathat wolverine run circle poppylook poop look poppy poop,1384289401916641280,167923110,en,2021-04-19 23:34:46+00:00
4142,4515,thetweetofgod poacher law defyinand pa supplyin say eat lot meat eatbut turn lion,1384289187533266945,1074510035089117184,en,2021-04-19 23:33:55+00:00
4143,4516,charrleemims ban horn trade south africa,1384286284542210054,455175861,en,2021-04-19 23:22:23+00:00
4144,4517, get fleetwoodmac box set live record king packagers actually saw tour tusk favorite album mine spin vinyl great note wildaboutmusic course,1384284441246273538,34364421,en,2021-04-19 23:15:04+00:00
4145,4519,poach illegal trade horn great threat currently face african remain wild survive national park reserve,1384280667580616705,52762709,en,2021-04-19 23:00:04+00:00
4146,4520,kevdgrussing headline underplays thiselephants werent target he poacheroh even bettera nearby pride ,1384280567173111811,3178144612,en,2021-04-19 22:59:40+00:00
4147,4522,eastern black chesterzoo chester july photography animalphotography zoophotography zoo animal cero easternblack black conservation chesterzoo chester,1384272745953857544,1255938716016746501,en,2021-04-19 22:28:35+00:00
4148,4523,semtechcorp worldwildlife black remain critically endanger see advanced sensor use lora help protect spe,1384271921509027840,15018490,en,2021-04-19 22:25:19+00:00
4149,4524,presumaly also subscribe stop poacher monthly use horn currency,1384267812177211395,175379280,en,2021-04-19 22:08:59+00:00
4150,4525,joydeepghosh savethe assam manas national park huge success,1384265934131515397,22474997,en,2021-04-19 22:01:31+00:00
4151,4526,savethe assam manas national park huge success,1384265908294619140,22474997,en,2021-04-19 22:01:25+00:00
4152,4528,check item etsy shop wildlife safari animal wild airbrush canvasa aforsale print etsystore walla canvas airbrusha,1384264693674516482,467573017,en,2021-04-19 21:56:36+00:00
4153,4529,clarencesandpa poacher kill elephant,1384261839169622030,95552200,en,2021-04-19 21:45:15+00:00
4154,4530,jimengelhorn ,1384259034178416642,1279540960079351811,en,2021-04-19 21:34:06+00:00
4155,4531,enca tomorrow episode crimewatch investigate poach abramjee visit kruger national park look eff,1384258978075484160,2672523784,en,2021-04-19 21:33:53+00:00
4156,4533,knx poacher arrest told park ranger group run herd breeding elephant ,1384258555432235018,1174071553,en,2021-04-19 21:32:12+00:00
4157,4534,olpejeta nohern white film follow sandra get know najin fatu last remain nohern white ,1384255885828972545,450740193,en,2021-04-19 21:21:36+00:00
4158,4535, contribution momentumtechnology pitch competition consists different level inkind service winner platformlearn help reduce cost time market stauphelp cleantech,1384253680799522822,951276798410571777,en,2021-04-19 21:12:50+00:00
4159,4536,blue check tribute nationalgrilledcheesemonth feature favorite variation classic prove perfection,1384253322077478914,625906744,en,2021-04-19 21:11:24+00:00
4160,4537,breitbanews black people endanger specie somethingwhites asian die toomore impoantly die thats woh put margarita,1384253245397233679,1343954745170518017,en,2021-04-19 21:11:06+00:00
4161,4538,atinypenguinn follow nat geo wild saw picture brain go fedora guy next ,1384251410363998213,1151699977011437568,en,2021-04-19 21:03:49+00:00
4162,4539,sideshow jennife hell yeah meat eater anytime animal mistreat want animal winslaughtering elephant simply get horn ivory warrant death penalty imo,1384250734334472193,1043423847708590081,en,2021-04-19 21:01:07+00:00
4163,4540,check tribute nationalgrilledcheesemonth feature favorite variation classic prove perfection exist ,1384250572929261582,14176304,en,2021-04-19 21:00:29+00:00
4164,4541,fun playmobil zoo fact know name big horn cero actually mean nose horn,1384250488388952065,46659683,en,2021-04-19 21:00:09+00:00
4165,4543,sophiegreena realafrica hate penguin,1384249837810450439,874331419,en,2021-04-19 20:57:34+00:00
4166,4545,mirrorroyal dont know dare show face know feel national resentment maybe he skin completely self obsess,1384247487301505027,1374650983062585346,en,2021-04-19 20:48:13+00:00
4167,4546, many animal go extinct sadthe sumatran world small face extinction due deforestation poach estimate left world,1384247035457458181,2184934963,en,2021-04-19 20:46:25+00:00
4168,4547, horniest individual right,1384245635633729539,3394378457,en,2021-04-19 20:40:52+00:00
4169,4548,accord conservationist transformation outstanding hold renew hope longterm future state flagship specie conservation greateronehorned,1384245417462882304,905818825328926720,en,2021-04-19 20:40:00+00:00
4170,4549,suspect poacher meet endvia elephant cant say deserve ,1384243710439817219,1376614144460255232,en,2021-04-19 20:33:13+00:00
4171,4550, first actual horn who demade nonexternallyhired aisttennogen,1384242763475021824,247149518,en,2021-04-19 20:29:27+00:00
4172,4551,lukewebb elephant poacher say poacher spit face conservationist,1384241078157471754,227975146,en,2021-04-19 20:22:45+00:00
4173,4552,felt good back colchesterzoo girl love see baby run paddock today,1384239485605478400,839765131496128512,en,2021-04-19 20:16:25+00:00
4174,4553,klinfl elephant amaze creature here zoo,1384238215410847747,439226210,en,2021-04-19 20:11:23+00:00
4175,4554,lopeztony white left till extinction ,1384236442700845061,1016797762661146625,en,2021-04-19 20:04:20+00:00
4176,4555,ranger routine patrol spot poacher ran elephant herd try flee,1384235352009838603,117733767,en,2021-04-19 20:00:00+00:00
4177,4556,happy monday want invite anyone interested wildvetadventures join instagram account lot photo video travel meeting elephant giraffe chimpanzee jaguar travelphotography staywild,1384233391336288261,271355000,en,2021-04-19 19:52:12+00:00
