,Unnamed: 0,tweet,tweet_id,author_id,lang,created_at
2707,3007,rzss spot rzss wildgenes expes wildgenes zoobased conservation genetics lab tucked edinbu,1386786478957662210,1154270209,en,2021-04-26 20:57:16+00:00
2708,3008, lax elephant copernicus brief film savingsurvivors ladyrocketspace satellite initiative invite torybruno ulalaunch lead sponsor humanitarian satellite help locate protect poach elephant lion poacher,1386785570295255041,29351945,en,2021-04-26 20:53:39+00:00
2709,3009,today phone case redbubble store use code phonea design animal manatee dinosaur yutyrannus endanger fish ocean iphone redbubble redbubbleaist aistsontwitter,1386783002559135750,386890659,en,2021-04-26 20:43:27+00:00
2710,3010,mirrornow due sustain effos year population assam manas national park saw massive jumphttps,1386781360090669064,1337133310284345354,en,2021-04-26 20:36:56+00:00
2711,3011,ajplus herd elephant south africa kill suspect poacher flee ranger kruger national parkwildl,1386780079091552263,761007001824403456,en,2021-04-26 20:31:50+00:00
2712,3012, crazy summer april alicecooper release timeless teenage national anthem school band first big hit peaked hot propel album name way billboard ,1386779864384950272,19301925,en,2021-04-26 20:30:59+00:00
2713,3013,newsnepals population grows high decade pandemic pause tourism cnn,1386779766301339651,346683276,en,2021-04-26 20:30:36+00:00
2714,3014,nypost lol never win national election ,1386775925715505156,636565826,en,2021-04-26 20:15:20+00:00
2715,3015,tradesman job plumber dublin install whole house filter install plumbing system aquasana ,1386774315522273283,333491282,en,2021-04-26 20:08:56+00:00
2716,3016, membership update,1386772939660484609,1002648443746177026,en,2021-04-26 20:03:28+00:00
2717,3017,listentothis wild wild west escape club nowplaying napster,1386771292544815111,2893157425,en,2021-04-26 19:56:55+00:00
2718,3018, absolutely enjoy henryvilaszoo happy move mean else lunch polar bear close lion roar see kid favorite zoo wildlife familytrips,1386770048904089601,993797880,en,2021-04-26 19:51:59+00:00
2719,3019, friend olpejeta recently announce incredible news mission save nohernwhite extinction creation viable nwr embryo read amaze progress rio photographer,1386769549765201921,1089108642832547842,en,2021-04-26 19:50:00+00:00
2720,3020,news jchabalala horn longer profitable something renember chinese national found dead freezer van long ago whats go dark economy,1386769295699546114,346276294,en,2021-04-26 19:48:59+00:00
2721,3023,natgeoindia ami vitale study nohern white really really fascinate love see whole process person way capture photo caretaker pejata conservatory beautiful heawarming,1386765951618535429,805623661407457280,en,2021-04-26 19:35:42+00:00
2722,3024,beautiful day back office lovely enjoy cherry blossom sun spring conservation marwellwildlife britishvets vetlife beauty,1386765150087155713,200244154,en,2021-04-26 19:32:31+00:00
2723,3025,jptparis gun club break hand mother juno red thegunclub robinguthrie http,1386764042363150345,2176235186,en,2021-04-26 19:28:07+00:00
2724,3026,jeremyhance talk thiswildlifepodcast encounter paicular chase dinosaur mammal ,1386763679639773188,809884691373375488,en,2021-04-26 19:26:40+00:00
2725,3027,walkswiths tear bravewilderness theewt wildernessfdnsa coyotepeterson thanks retweet suppo,1386762420329144320,301363649,en,2021-04-26 19:21:40+00:00
2726,3028,horni thank ,1386760175910985729,301363649,en,2021-04-26 19:12:45+00:00
2727,3029,rachkara put endanger national park suicide,1386759277503729667,1243575243073097728,en,2021-04-26 19:09:11+00:00
2728,3030,here nice new job lose yourssteven busulwa animal keeper run charge uganda wildlife conservation education center entebbe uganda april ,1386753500156203019,1957550522,en,2021-04-26 18:46:13+00:00
2729,3031, real help especially get closer look dog killer picture award pdsa gold medal help track poacher excellent track use smell hearing ,1386751616204873728,824248389336494080,en,2021-04-26 18:38:44+00:00
2730,3032,put endanger national park suicide,1386750715079454721,819783126893281280,en,2021-04-26 18:35:09+00:00
2731,3033,lovetotrade onlycrownking wild drew diligence wild combo rare specie drewdiligencee wild much prop ,1386746310506827776,377700495,en,2021-04-26 18:17:39+00:00
2732,3034, baby nohern white card scientist say yes new embryo nohernwhite extinction poach ivory,1386745941080817667,254427395,en,2021-04-26 18:16:11+00:00
2733,3035,npmetcalfe netball superleague playoff hope take blow saracensmavs still fight say bos,1386745492214853634,2420324095,en,2021-04-26 18:14:24+00:00
2734,3036,wild onlycrownking people learn early journey he research pump follow,1386745145131995139,1316556563495215104,en,2021-04-26 18:13:01+00:00
2735,3037, anyone else play game back day man much fun charge character crazy creative game kill something ironically game story already us excuse transform character,1386743304793083908,377350514,en,2021-04-26 18:05:42+00:00
2736,3038, buddy beri black he really cool spent weekend garden talk story weed horn great help animalstories giraffe black friend storytime kidsbooks childrensbooks worktogether childrensauthor funshi,1386742502745645058,2789225341,en,2021-04-26 18:02:31+00:00
2737,3039,cssmjcksn work coz horn pretty much make keratine need large amount stuff cause burn ,1386741829178101763,928231981258891264,en,2021-04-26 17:59:51+00:00
2738,3040,ckmandal onehorned population wild water buffalo increase countryhowever retaliatory killing rem,1386739358368104450,2687005844,en,2021-04-26 17:50:02+00:00
2739,3041,zha afraid surrogate specie cant distantly related closest living relative case year divergentwork try white white surrogate awesome colleague frozenzoo,1386736605579386882,1182709305650417665,en,2021-04-26 17:39:05+00:00
2740,3043,ideasupeace want know dehorn process impoant read aicle wildli,1386736532648693760,1622723593,en,2021-04-26 17:38:48+00:00
2741,3044, offer cero encounter day visit zoo early secure spot meet learn jenny marmetschke lupo centralfloridazoo animalencounter,1386734317452279818,16513277,en,2021-04-26 17:30:00+00:00
2742,3045,want know dehorn process impoant read aicle wildlifeprotection dehorn peacebuilding,1386729536226828289,1238590952463388672,en,2021-04-26 17:11:00+00:00
2743,3046, full moon tonight think many kill tonight full moon illuminates ground make easy see,1386729210966855684,260808778,en,2021-04-26 17:09:42+00:00
2744,3047,sighting expect kruger safari late april guarantee course include dwarf mongoose elephant leopard simon vegter kruger national park,1386728312525950980,1344476419,en,2021-04-26 17:06:08+00:00
2745,3049,jessicakirson noooo horn,1386722008449290241,571085593,en,2021-04-26 16:41:05+00:00
2746,3050,genome sequence raise alarm survival sumatran population,1386721399054561281,1303576196731383808,en,2021-04-26 16:38:40+00:00
2747,3051,helping world veterinary day send gratitude incredible wildlife vet work hard ,1386720341414883329,123929960,en,2021-04-26 16:34:28+00:00
2748,3052,shahidreza place place chitwannationalpark nepal,1386716796451950595,871823728145039361,en,2021-04-26 16:20:22+00:00
2749,3053, call horn sledgehammer call thepolyswinger bigdick thickdick bull hotwife gih gihy massivecock swinger swinger,1386714886856642567,1382711977416536066,en,2021-04-26 16:12:47+00:00
2750,3054,neweranewspaper imperative african country continent recognise face similar issue poachin,1386714602734510085,225983350,en,2021-04-26 16:11:39+00:00
2751,3055, talk thiswildlifepodcast encounter paicular chase dinosaur mammal hilarity travel world mental health issue amyjturner mongabay hcibooks,1386713210158342145,324599106,en,2021-04-26 16:06:07+00:00
2752,3056,new sexy fuckin twitch channel trailer new scheduleill see guy mon wed fri pmpm estand tues thurs go dark estspread news there wild loose get weird see soon fuck link bio,1386711676557352963,867474714188447745,en,2021-04-26 16:00:02+00:00
2753,3057,mickbognor tonyjon lynettejane michaelrosenyes restrain greed stop cause damage specie ecosystem palm oil deforestation hell ivory horn ,1386708407479152642,256526258,en,2021-04-26 15:47:02+00:00
2754,3059, generous donation allow project peril international foundation plant seedling way kamba national park protect sumatran many specie read blog,1386703814326046725,39120710,en,2021-04-26 15:28:47+00:00
2755,3060, southern white offspring see serengeti national park park beginning ,1386702283006791686,1882605714,en,2021-04-26 15:22:42+00:00
2756,3061,kenya announce thursday new nohern white embryo produce effos rescue iconic giant land mammal extinction gather momentum,1386702153998295042,9366272,en,2021-04-26 15:22:11+00:00
2757,3064,imagine human rubbish horn arent safe left ,1386697370553913344,369229662,en,2021-04-26 15:03:11+00:00
2758,3065, deter poach attempt ezemvelo kzn wildlife dehorn spioenkop nature reserve last week operation take day complete,1386696751013302274,41572208,en,2021-04-26 15:00:43+00:00
2759,3066,saksak ill trade find berry,1386695246713663493,196386788,en,2021-04-26 14:54:45+00:00
2760,3067,matt welte incredibly thorough professional recommend client trust resource say amy google summitwebmarketing,1386693226476687363,2255165954,en,2021-04-26 14:46:43+00:00
2761,3068,sugrivatoes conservation effo didnt want admixture specie guess go probably stupid idea,1386693076010381315,2324305661,en,2021-04-26 14:46:07+00:00
2762,3069,warsdr jasper humphreys marjanman discus connection conflict biodiversityby highlight illegal wildlife trade africa political social dynamicswatch marjancentre kclesrg,1386692951456292869,65354167,en,2021-04-26 14:45:37+00:00
2763,3070, youre fan african conservation late fund raise initiative aprilthe able bid follow painting fund raise auction towards protection ,1386692597519986698,1255950842890522627,en,2021-04-26 14:44:13+00:00
2764,3071,acaciaafrica day see fluffy earsquiz white ceratotherium simum black diceros ,1386690588452421633,717741886975283200,en,2021-04-26 14:36:14+00:00
2765,3072,ztzoo push staff zoo close today,1386688897997025282,1303733445898764288,en,2021-04-26 14:29:31+00:00
2766,3073, take whale skeleton last yearlast week get giraffe waykeepernh tell remove metre giraffe call spoticus dublindeadzoo necessary renovationspic credit keepernh,1386688581708746752,2961870766,en,2021-04-26 14:28:15+00:00
2767,3074,congratulation africaalive new southern white belle,1386688210961674241,41572208,en,2021-04-26 14:26:47+00:00
2768,3075,people dont want best way maintain population animal legal hunt tiger wed whole lot tiger run ,1386685398005424128,1351597112958578688,en,2021-04-26 14:15:36+00:00
2769,3076, zoo talk staffif guy cdm animal troubleops staff say pickup animal take homei feel happy find hiss wtf haha animal hea warm whatshappeninglnmyanmar,1386685146955350019,919793035692597249,en,2021-04-26 14:14:37+00:00
2770,3077,maverick mutospseudoroids round beetle bros round fighter base beetle horn pierce heaven get hornyou decide gravity beetle herculious anchus,1386684982316265472,1249592864,en,2021-04-26 14:13:57+00:00
2771,3078,free delivery global shipping available ostrich egg african wildlife leopard lion elephant bison ebay ebay,1386683849120301056,1041912878,en,2021-04-26 14:09:27+00:00
2772,3079,warmup sketch make sketch random specie character design get pretty happy furrya ,1386683400359141384,1366181691128242176,en,2021-04-26 14:07:40+00:00
2773,3080,bolla bolla photography wildlifephotography captivewildlife zoo zoo cero white wildlifewarriors,1386683117721858048,1341413540758958087,en,2021-04-26 14:06:33+00:00
2774,3081,bolla photography wildlifephotography captivewildlife zoo zoo cero white wildlifewarriors protectourwildlife get print awesome product suppo redbubble rbandme findyouhing redbubble,1386682997269835780,2228351172,en,2021-04-26 14:06:04+00:00
2775,3082,tackle illegal wildlife market key save thanks suppo edunaturevn paner vietnam training future generation stop illegal wildlife trade find savethe env endpoaching,1386681662084460550,41572208,en,2021-04-26 14:00:46+00:00
2776,3083,kiwicgfx vetpaw vet use skill help save elephant africa wohy organisation need sup,1386681356319608833,826225554277924866,en,2021-04-26 13:59:33+00:00
2777,3084,uganda closure sanctuary mean local global wildlife news visit wildtrails news ,1386679962824974343,2897029440,en,2021-04-26 13:54:01+00:00
2778,3086,lepajeeyt gate olympus great megawayswild west goldrelease krakenfruit payusername canadaty chance goodluck,1386679544464089091,1376878627808112640,en,2021-04-26 13:52:21+00:00
2779,3087,samaemme effectively poach player mind mandem decide make news know smuggle,1386678704093413377,1290681075778424832,en,2021-04-26 13:49:00+00:00
2780,3088,leerichardzoo check quick video calf ayubus morning adventure,1386676558753116163,52749272,en,2021-04-26 13:40:29+00:00
2781,3089, effectively poach player mind mandem decide make news know smuggle good ahead shine bright diamond,1386676361184612355,358032443,en,2021-04-26 13:39:42+00:00
2782,3090, onehorned population wild water buffalo increase countryhowever retaliatory killing remain challenge conserve endanger speciesmy story late counting arna,1386676055814008840,872168798,en,2021-04-26 13:38:29+00:00
2783,3092,enjoy immersive closeup experience view wildlife roam beautiful landscape solio conservancy safari soliolodge meetinkenya kenya theresmoremagic,1386675319491420162,1358714019755008002,en,2021-04-26 13:35:34+00:00
2784,3093,wildlifedisease biorescue creates new nohern white embryo physorgcom,1386674443519410180,875763528904343552,en,2021-04-26 13:32:05+00:00
2785,3094,biorescue creates new nohern white embryo physorgcom,1386674171468554241,2436455767,en,2021-04-26 13:31:00+00:00
2786,3095,thepostsynaptic biorescue creates new nohern white embryo,1386669671428984834,111995707,en,2021-04-26 13:13:07+00:00
2787,3096,check quick video calf ayubus morning adventure,1386668537863974919,750745070094028800,en,2021-04-26 13:08:37+00:00
2788,3097,igadsecretariat igad leadership walk big belly igad work common person igad nothing org maintains corrupt status quo horn africa bad situation long time paly thanks igad,1386663179015573517,3099088677,en,2021-04-26 12:47:19+00:00
2789,3098,bitch hit market morning,1386660285369442311,30290893,en,2021-04-26 12:35:49+00:00
2790,3099, wild,1386660005550637056,1303452870541541377,en,2021-04-26 12:34:42+00:00
2791,3100, baby nohern white card scientist say yes new embryo,1386656325938171904,51816066,en,2021-04-26 12:20:05+00:00
2792,3101,henockyebyo say year african union full corrupt big belly igad ethiopianinterest org issue eucopresident eucommission eueeas expect useless something never happen,1386655375672369153,3099088677,en,2021-04-26 12:16:19+00:00
2793,3102,people let save ziwa sanctuary nakasongola district animal face extinction go land wrangle endanger specie need protectedziwasanctuary,1386652633323216896,1384827427298451457,en,2021-04-26 12:05:25+00:00
2794,3103,check ceramic figurine vintage handmade south africa collectable great condition ebay,1386652199032434690,1348976822197903360,en,2021-04-26 12:03:41+00:00
2795,3104,africatvl know pregnancy last month animal longer gestation period elephant carr,1386651269964652546,976166899,en,2021-04-26 12:00:00+00:00
2796,3105,abramjee crimewatch enca dstv tomorrow tuesday april poach join sanparksknp airwing patro,1386651101123026947,821695768088182784,en,2021-04-26 11:59:19+00:00
2797,3106,michaeltomlin ddoniolvalcroze dont know sure skull round dome see huge veebrae suppoed large neck muscle necessary hold heavy horn,1386650809597894659,224289366,en,2021-04-26 11:58:10+00:00
2798,3107, successfully harvest egg last nohern white yet breakthrough highly commend olpejeta biorescue project ,1386647252521918468,1290897377709170688,en,2021-04-26 11:44:02+00:00
2799,3108, sing close extinction analyse modern historical sumatran cero genome evaluate genetic status remain populationsin sho human disturbance minimise large specie diversity still save,1386639532502790146,358654036,en,2021-04-26 11:13:21+00:00
2800,3109, push staff zoo close today,1386639132647174144,1339607999002931201,en,2021-04-26 11:11:46+00:00
2801,3110, love happy customer there really nothing else market match veesus discover studio marchi us veesus pointclouds deliver project faster well,1386634277023109120,1397121732,en,2021-04-26 10:52:28+00:00
2802,3111,uwecentebbezoo average adult southern white male weighs female wei,1386633848746909698,816651579210235905,en,2021-04-26 10:50:46+00:00
2803,3112, african wildlife foundation panered wildaid education nature vietnam produce public service announcement discourage horn use read full aicle browser wildlife animal wild savetheplanet savewildlife,1386632803920617474,1368606714925350915,en,2021-04-26 10:46:37+00:00
2804,3113, honour eah day last week compile list favourite sustainable propeies bit help planet carbon offset costa rica bear rehabilitation peru conservation namibia eahday,1386632546809749505,512255424,en,2021-04-26 10:45:36+00:00
2805,3114,give live ready make memory generate free donation book day ticket event trust giveasyoulive retailer conservation onlineshopping,1386628872800804864,519683539,en,2021-04-26 10:31:00+00:00
2806,3116, baby nohern white card scientist say yes new embryo rfien,1386626104463708161,18052384,en,2021-04-26 10:20:00+00:00
2807,3117,think charity appeal provide medicine water aid food even eye operation ensure african survive grow kill elephant wildlife also suppo prevent,1386625909042696192,629783798,en,2021-04-26 10:19:13+00:00
2808,3118,imagine charm smoking flatulent indigenous specie,1386618524421050368,3141676846,en,2021-04-26 09:49:53+00:00
2809,3119,vinodphirse avinash cibilofficial finance inditrade nsitharamanoffc nsitharaman finance minister holiday,1386617876224696325,1373907271650930690,en,2021-04-26 09:47:18+00:00
2810,3120, friend kariegagameres call help fund vital conservation work find help conservation southafrica,1386617799766802436,1089108642832547842,en,2021-04-26 09:47:00+00:00
2811,3121,avinash cibilofficial finance inditrade nsitharamanoffc nsitharaman finance minister holiday,1386617632594403329,1361281204872302594,en,2021-04-26 09:46:20+00:00
2812,3122,africa baby nohern white card scientist say yes new embryo newspaper feedly,1386615549556371465,187517194,en,2021-04-26 09:38:03+00:00
2813,3123, wild sumatran left wild critically endanger hunt deforestation palmoil sumatra boycott brand destroy home boycottwildlife find ,1386614981584736257,1351436889316683778,en,2021-04-26 09:35:48+00:00
2814,3124,incarceratedso commercial show endanger elephant tiger etc need savinghelp think ,1386609996151017479,1245319744179363842,en,2021-04-26 09:15:59+00:00
2815,3125,pillar eah save powerful new documentary lasthornsafrica,1386609670605975554,28742976,en,2021-04-26 09:14:42+00:00
2816,3126, imperative african country continent recognise face similar issue poach wildlife crime,1386608475036393473,466508944,en,2021-04-26 09:09:57+00:00
2817,3127,lion waterbuck african wild dog baby great sighting enjoy safari last week april simon vegter kruger national park,1386607506106036226,1344476419,en,2021-04-26 09:06:06+00:00
2818,3128,global bicycle car carrier market growth analysis thule group yakima product sari cycling group rack mont blanc group valley bugler newspaper,1386607367018532868,450104511,en,2021-04-26 09:05:32+00:00
2819,3130,africa baby nohern white card scientist say yes new embryo global wildlife news visit wildtrails news ,1386604461972279296,2897029440,en,2021-04-26 08:54:00+00:00
2820,3131,uganda cou rule dispute sanctuary land global wildlife news visit wildtrails news ,1386604454972071938,2897029440,en,2021-04-26 08:53:58+00:00
2821,3132,great news international consoium scientist conservationist work towards prevent extinction nohern white announces successful production new embryo,1386597043846721543,810777826001616896,en,2021-04-26 08:24:31+00:00
2822,3133,africa baby nohern white card scientist say yes new embryo,1386596483634401280,735123199,en,2021-04-26 08:22:18+00:00
2823,3134, crimewatch enca dstv tomorrow tuesday april poach join sanparksknp airwing patrol focus skukuza cou reopen also visit pilansberg see measure place curb poach,1386595848730169345,174365756,en,2021-04-26 08:19:46+00:00
2824,3136,conflict illegal wildlife trade africa today marjancentre kclesrg talk key economic driver illegal wildlife trade richard milburn south africa war marjanman register,1386593401408217096,65354167,en,2021-04-26 08:10:03+00:00
2825,3137, happy paicipated impoant studygenome sequence historical modern sumatran give impoant clue future conservation effoscongrats hero johannanystrmand nic,1386587525263855618,16595229,en,2021-04-26 07:46:42+00:00
2826,3138,vishal avinash cibilofficial finance inditrade nbfcs run goon mafia,1386587203288010759,1202833982343151616,en,2021-04-26 07:45:25+00:00
2827,3139, closure trigger persistent misunderstanding uwa realize conflict potentially compromise safety take decision ave threat statement read conservation uganda,1386586416126251009,869959916,en,2021-04-26 07:42:17+00:00
2828,3140,dailyexpress incredible rescue blind chance survive wild worldday http,1386584874312769537,78661261,en,2021-04-26 07:36:10+00:00
2829,3141,avinash cibilofficial finance inditrade nbfcs run goon mafia,1386582805606506497,1259852726424526849,en,2021-04-26 07:27:56+00:00
2830,3142,wlovewildlife gdmoon jungle animal shower cuain tropical forest elephant lion flamingo shower cuain giraffe zebra monkey leopard ,1386581825850535937,1104113232,en,2021-04-26 07:24:03+00:00
2831,3143,check ostrich egg african wildlife leopard lion elephant bison ebay,1386581822356721664,1041912878,en,2021-04-26 07:24:02+00:00
2832,3144,gdmoon jungle animal shower cuain tropical forest elephant lion flamingo shower cuain giraffe zebra monkey leopard parrot wildlife zoo bathroom cuains set hook xin ylwhgd weloveelephants elephant product,1386581701749469184,867382475428958208,en,2021-04-26 07:23:33+00:00
2833,3145,candycorn havent see type commission market long badge commission azureparagon gest,1386581655842955264,887363870083473409,en,2021-04-26 07:23:22+00:00
2834,3146, elephant die poach natural cause conflict human due trading body pa illegally trophy traditional medicine lucrative black marketstopthekillingpaner ,1386581252803899392,1120681181882798080,en,2021-04-26 07:21:46+00:00
2835,3147,matoc ladywarrior nsfw weapon horn touch touchim alright good pack gum,1386580557388156934,925448127175258112,en,2021-04-26 07:19:00+00:00
2836,3148, embryo developed save white kenya extinction,1386579560469237760,3402412635,en,2021-04-26 07:15:03+00:00
2837,3149,slot rekomendasi buanatogel aprilwild west goldsweet bonanzatemujin treasureswild boostergreat megawaysaztec gemssitusslotterpercaya agenslotonline,1386578880668995585,2496394296,en,2021-04-26 07:12:21+00:00
2838,3150,china africa wildlife elephant go extinct china demand ivory devastate population elephant kill min horn use alternative medicine pa tiger,1386578872309895171,1230926617565966336,en,2021-04-26 07:12:19+00:00
2839,3151,craftygreenpoet baxu giant excellent sho film poach affect community namibia ,1386578860880416768,2919790961,en,2021-04-26 07:12:16+00:00
2840,3152,ugwildlife move aim ensure safety take security ziwa sanctuary ,1386578717925859328,869890802566221824,en,2021-04-26 07:11:42+00:00
2841,3153,info slot gacor hokindobet aprilslotpragmatictemujin treasurebonanza goldcongo cashsweet bonanza megawaysslothabanerohey sushiwild truckstreasure tombsslotjokeraladdinaztecagreat blue,1386578699386974210,993995365647990784,en,2021-04-26 07:11:37+00:00
2842,3154,vietnam horn fastmoving commodity even idle year yearlong undercover data journalism investigation discovers find full story wildeye asia ddj wildlifecrime vietnam journalismmatters,1386573713726971904,1261286213228597249,en,2021-04-26 06:51:49+00:00
2843,3155,ivan caer visit secret orphanage care rescue baby set mission save newly orphan discover blood sweat tear go save endanger specie caers war season tonight discoverydiscovery,1386568222946861058,859285064,en,2021-04-26 06:30:00+00:00
2844,3156,hodilu exclusive mass dehorn operation kzn witness,1386566910154838018,1530626425,en,2021-04-26 06:24:47+00:00
2845,3157,rudzanicogitat citypress broaden patronage network return discredit individual david mahlobo implicate horn pouch smuggle praise singer tire,1386565091399700480,2280202457,en,2021-04-26 06:17:33+00:00
2846,3158,sanparks announce suspect poacher arrest kruger national park poach kruger,1386564196490350593,519683539,en,2021-04-26 06:14:00+00:00
2847,3159,deadzoodiary shot yet black skull nose left image bullet brain right shot ahur eyre zimbabwe eyre shot die boer war mafeking follow year age nmireland,1386562140274835456,198927560,en,2021-04-26 06:05:49+00:00
2848,3160,mrbeast thank please join save extinctionwe drop close pound supplementary drought feed year need urgent assistance,1386561160728678401,7986572,en,2021-04-26 06:01:56+00:00
2849,3162,africanparks worldday september celebrate malawi regionally significant conservation stronghol,1386559140923908098,2948635943,en,2021-04-26 05:53:54+00:00
2850,3163,zoosvictoria know tapir closely related horse dont let snout confuse ,1386555878191640578,18354502,en,2021-04-26 05:40:56+00:00
2851,3164,farm panda binance sma chain stas hour marketcap less pre mine pnda coin almost fully dripped ensure liquidity thebaoman pandaswap also integrates model well know enhance mechanism safemoon,1386553931870916608,938713970357260288,en,2021-04-26 05:33:12+00:00
2852,3165,footy adamwesterhout westcoasteagles freodockers newspeh fmpeh pehwildcats include wafl,1386544272778809344,2954604164,en,2021-04-26 04:54:50+00:00
