,Unnamed: 0,tweet,tweet_id,author_id,lang,created_at
0,0,abc fresno chaffee zoo need help name new family member,1608137570936049666,501400370,en,2022-12-28 16:27:29+00:00
1,1,hope kruger national park youtube,1608136018288431107,1409958595341467648,en,2022-12-28 16:21:19+00:00
2,2,dashdobrofsky enough drug kill ,1608134886392487943,1517830326470520834,en,2022-12-28 16:16:49+00:00
3,3,dineshdsouza romney change pay democrat bill sign insane already hyper inflation go send great recession watch stock market tank price roof romney rich say great deal,1608134584209936388,1698441469,en,2022-12-28 16:15:37+00:00
4,4,sinoufc hippo face wild,1608132841837318145,1146164445795762176,en,2022-12-28 16:08:41+00:00
5,5,newsmax horn old govern anymore useless,1608131392478609410,1592872386541633550,en,2022-12-28 16:02:56+00:00
6,6,hodilu first time year zimbabwe population black white surpass individual accordi,1608131336169996298,340362533,en,2022-12-28 16:02:42+00:00
7,7,challenge remain generation gonadal somatic cell allow pgclcs oogenesis many however impoant step road undo damage weve do nohern white sconservation biology synbio,1608130779154112512,1606852626708037633,en,2022-12-28 16:00:30+00:00
8,8, fresno chaffee zoo need help name new family member,1608130758085844997,16688247,en,2022-12-28 16:00:25+00:00
9,9,hodilu december biswanath police collaboration bongaigaon police arrest notorious poacher assam,1608130396423704579,1479129212644741124,en,2022-12-28 15:58:58+00:00
10,10, say telegram join puru saxena mentorship program trade,1608124325298667523,4488714621,en,2022-12-28 15:34:51+00:00
11,11,nbcsandiego float feature giraffe wildlife safari truck represent park ability connect wildlif,1608124272798748673,57228415,en,2022-12-28 15:34:38+00:00
12,12, international endanger specie day sweet baby david sheldrick wildlife orphanage nairobi kenyasome fine photo sale website ,1608121474790920194,14052086,en,2022-12-28 15:23:31+00:00
13,13,thehuntercotw nice research stuff tranquilizer gun track collar knock research lion anything track game camera scout area,1608121336273969158,237767545,en,2022-12-28 15:22:58+00:00
14,14,fresnozoo special announcement baby need name vote name option ,1608120672102014977,145081604,en,2022-12-28 15:20:20+00:00
15,15,toafrika lake nakuru national park worldfamous birding wildlife destination kenya home large number anima,1608120593928572928,34856314,en,2022-12-28 15:20:01+00:00
16,16, beautiful heaening story reminds lewawildlife sought human help injured arent brute people sometimes thinkannamerzrescuer swithoutborders hornsbelongons,1608119742417756160,247440708,en,2022-12-28 15:16:38+00:00
17,17,goodwolfpac arctic shark caribbean red wolf black best speciesrelated story year,1608118693401067521,1381633563385339907,en,2022-12-28 15:12:28+00:00
18,18,cincinnatizoo wonderful moment baby,1608115859142107137,64058834,en,2022-12-28 15:01:12+00:00
19,19,tomcottonar nothing compassionate voting debt tax payer pay nation border protection cotton stalk,1608114255655485441,346133927,en,2022-12-28 14:54:50+00:00
20,20,boulezian thats he breenging idiot diplomatic skill ,1608111989124898821,248721698,en,2022-12-28 14:45:50+00:00
21,21,international union conservation nature reveals zims endanger black make comeback first time year zimbabwe population surpass individual accord international union conservation natu,1608107491815981057,1380421518799278083,en,2022-12-28 14:27:57+00:00
22,22,ugandawaka mom pregnant month give bih single calf female reproduce ,1608107439802523650,1277218591297986567,en,2022-12-28 14:27:45+00:00
23,23, say telegram join puru saxena mentorship program trade thank later,1608106013864992769,3189720390,en,2022-12-28 14:22:05+00:00
24,24,mistoverde cbmshots factually incorrect superman kill civilian snyder want epic final battle deliver want bad look marc webb spiderman crack joke ram civilian car,1608105943434141698,1229235462377701377,en,2022-12-28 14:21:48+00:00
25,25,chesterzoo female great onehorned born october public vote call new calf jiya meaning sunshine,1608104520873312261,832195765548130304,en,2022-12-28 14:16:09+00:00
26,26,savethe christmas lunch fotawildlife great onehorned maya get special brunch day hay pellet,1608103119451262978,44861089,en,2022-12-28 14:10:35+00:00
27,27,dierenpark amersfoo dpamersfoo raise record amount euro suppo twenty global nature conservation project recipient international foundation ngo enganged conservation,1608102180762058755,44861089,en,2022-12-28 14:06:51+00:00
28,28,philconnorsii usmcorps harryjsisson enough fent system kill ,1608098139008811009,59750685,en,2022-12-28 13:50:48+00:00
29,29,contdmarma stokemarma make anthemic indie missile strong horn let explode eardrum today,1608098053889658884,759423603045756929,en,2022-12-28 13:50:27+00:00
30,30,designweek lose free exhibition feature lifesize projection nohern white open natural history museum mosyandesign mosyanorganizer,1608097826424119296,1854562957,en,2022-12-28 13:49:33+00:00
31,31,today driver tour truck tourist drove park road park right next pair park rule kwskenya take immediate action driver tour company mintourismke savethe wildlifedirect,1608097705795911681,21990241,en,2022-12-28 13:49:04+00:00
32,32,madukhal enjoy amaze view kenya day trip visit lake nakuru national park also know sanctuary book,1608096012324724736,1588421382412591107,en,2022-12-28 13:42:20+00:00
33,33,planet nothing terrify poacher hear offleash pack baying hound bearing ,1608095873052844033,862224374056747008,en,2022-12-28 13:41:47+00:00
34,34, nothing terrify poacher hear offleash pack baying hound bearing antipoachingdogs kruger,1608095421951315970,905818825328926720,en,2022-12-28 13:40:00+00:00
35,35,stillultra sherrytapscott bchkdh wheather pokeintexas riccigeri llpretty pragmaticm jimjorsey brianhallteachr missyleroy calipatriot auditdavotepa usvetret retiredcsuite randal horsywoman brunelshawn coolname maryjwilhite therazor fvallrun crazy new craze old scientific validity horn china human placenta make give strength youth hard yea stoopid,1608095403311874049,1516458010121424896,en,2022-12-28 13:39:55+00:00
36,36,mom pregnant month give bih single calf female reproduce year couesy naturelovers bih wildlife traveler videoviral african natgeotravel naturelover wildlifeshots,1608093589975826433,2588698528,en,2022-12-28 13:32:43+00:00
37,37,wildlenseindia conclude night day terai arc wildlife tour different tiger leopard sloth elephant bird,1608093535152279552,888272343579086851,en,2022-12-28 13:32:30+00:00
38,38, first time year zimbabwe population black white surpass individual accord iucn specie survival commission african specialist group,1608092180861575170,44861089,en,2022-12-28 13:27:07+00:00
39,39,careforwild love ,1608088874093256706,237287161,en,2022-12-28 13:13:59+00:00
40,40, lose free exhibition feature lifesize projection nohern white open natural history museum,1608088249821544448,41337901,en,2022-12-28 13:11:30+00:00
41,41,robeovalentun amaze matobo national park matopos hill south bulawayo zimbabwe pinnacle ,1608087889619083265,97979745,en,2022-12-28 13:10:04+00:00
42,42,rwmalonemd isnt company promotes ancient chinese remedy pretty sure internationally respect medical laboratory conduct study many subject use chinese die hope erection,1608087043019796480,839139219222077440,en,2022-12-28 13:06:42+00:00
43,43,savethe take lot save especially youre deal poach crisis right ranger kwazulunat,1608083713795018752,22230837,en,2022-12-28 12:53:28+00:00
44,44,jamesrodriguez madonna record recordsuk mikekillmon always like songi never wan girl,1608082711083876352,375243206,en,2022-12-28 12:49:29+00:00
45,45,lowke think right thingif dont take care next dinosaursdid know baby eventually kill mom separate horn dangerous specie,1608081027427082242,3363611393,en,2022-12-28 12:42:48+00:00
46,46,trophyxpose people try persuade world kill big game necessary viable ever take place nowadays bare face liar line pocket andor seeker blood self gratification god help planet,1608079015952130051,400773433,en,2022-12-28 12:34:48+00:00
47,47,deadlinewh kimberlyeatkins nicolledwallace medium carry water lefty carry water biden regime expect corrupt dojfbi carry corrupt demand,1608078301318492160,1507052855219433489,en,2022-12-28 12:31:58+00:00
48,48,lintpop scientiapercept megafant ingridingwah wendilin kesterlowers truthswordsa sicutlupus onkelfester mucusmucous darkcowboygod eiiw mindfuldamage dirkfasshauer galcondude tessfromwessex mirandaisrisen umfpt timmbosliceeee cannauk remofjacob hubie flaffenbam takethathistory wastedaerospace spikeinthemidge heatheist xxschlitzmaltxx briannazarenus cholingman heathenwombat clayster rkdoctr sidneyst melanie thhuxley gotaqu omnimomo serpent ravenlove knitman catinabox remofjacob warrensm crispycurry missp maidelk truthwiththord mean grow large mate successfullyeg white grazer black nibbler leaf thorn,1608078004864819200,860778319704457217,en,2022-12-28 12:30:47+00:00
49,49,nigelfarage dear value platinum customer thank update autodelivery set ensures prompt efficient delivery even time unprecedented demand product delivery service ltd,1608076653934043142,1251247297234681857,en,2022-12-28 12:25:25+00:00
50,50, december biswanath police collaboration bongaigaon police arrest notorious poacher assam police want criminal base criminal confession rifle use poach recover,1608073915896659969,44861089,en,2022-12-28 12:14:32+00:00
51,51,zyumiiko maybe le adultes utilisent horn jsp,1608071831088414720,1277992032494067719,en,2022-12-28 12:06:15+00:00
52,52,lake nakuru park worldfamous birding wildlife destination kenya park home hundred specie animal include critically endanger black inquiry infokenyaparkscokelake nakuru wildlife safari,1608070391435517953,1356961376737099776,en,2022-12-28 12:00:32+00:00
53,53, recent go school event laokhuwa bongaon school laokhuwa assam attract student teacher include visual presentation population distribution habit habitat impoance conservation,1608067029050986498,82949737,en,2022-12-28 11:47:10+00:00
54,54,leisasnewman josefszentjobi uncle ted true conservationist great american guitar knock ball hundred yard,1608064408311459840,1511757138028380162,en,2022-12-28 11:36:45+00:00
55,55,kenyagameparks pejeta conservancy large black sanctuary east africa home black elephant lion,1608063576803102723,4037623755,en,2022-12-28 11:33:27+00:00
56,56,olpejeta celebrate bih critically endanger black provide scholarship child ,1608063287153037313,2669447159,en,2022-12-28 11:32:18+00:00
57,57,careforwild milk milk milk breakfast time bomas whilst aquazi mavic enjoy milk bottle jock ,1608062773686308866,841539400022519809,en,2022-12-28 11:30:16+00:00
58,58,mintourismke release ivory stockpile repo tonne ivory horn,1608062155860967424,2605340502,en,2022-12-28 11:27:48+00:00
59,59,movetheworldus chineseresponsible horn ivory trade ,1608061407462887430,1027992064385003521,en,2022-12-28 11:24:50+00:00
60,60,trafficwltrade corruption manifest illegal horn supply chaintake look new visual guide produ,1608060554681389057,285049799,en,2022-12-28 11:21:27+00:00
61,61,international day agree common day einstein bihdaythe papyrus suggests result yet babylonian clay tablet suggests piwhich closest approximation ,1608057344285462529,1466988164954742786,en,2022-12-28 11:08:41+00:00
62,62,ilfanilyas trophyxpose long long life specie endanger specie end bullet shoot gun,1608056372146622464,1554497968895832066,en,2022-12-28 11:04:50+00:00
63,63, read new business member secure link business profile digital marketing platform grow business dominate competitionbusinessdirectory citationdirectory businesslistings seo lead,1608053731135836162,1439977589892915204,en,2022-12-28 10:54:20+00:00
64,64, say swahiliit time feedand boy feedpoacherselephantskrugernationalparksouthafricasafrica,1608052986236002309,856218099003133952,en,2022-12-28 10:51:22+00:00
65,65,lhga need wild black dog need zodd save gut general purple need lose child arc need gut full uncensored line trust hilarious need see grifeth get tour plz,1608052936281554946,1223317261303328769,en,2022-12-28 10:51:10+00:00
66,66,careforwild human kind well do kindness towards daisy care daisy zebra cute,1608052487851737091,2859256697,en,2022-12-28 10:49:23+00:00
67,67, walk bongani mkhaya expectation high bit nervous see foot recently rain track animal easy,1608049656432402433,17249167,en,2022-12-28 10:38:08+00:00
68,68,oprincipe historydefined sure paicular image represent painting cave also mammoth megaloceros deer meter antler aurochs wild cow various feline bear,1608044611896836098,1497259745257918469,en,2022-12-28 10:18:06+00:00
69,69,digold zoo time timethe mammal favourite type want tonightheabeat increase heabeatyou,1608043134885236736,375531322,en,2022-12-28 10:12:14+00:00
70,70,fawnfallowhea look poach orphan tiny baby left mum bit bloody keratin thank goo,1608042322901483520,2580674796,en,2022-12-28 10:09:00+00:00
71,71,newscientist survive nohern white female aificial embryo allow save,1608041373319725057,995723294518034433,en,2022-12-28 10:05:14+00:00
72,72,valmiki tiger reserve home solitary goh present bihar east india adjacent nepal select potential site great onehorned national conservation strategy,1608039885343948803,41572208,en,2022-12-28 09:59:19+00:00
73,73,daisy still hea extintionisforever stoppoachingnow criticallyendangered,1608039058533683200,196870870,en,2022-12-28 09:56:02+00:00
74,74,johnrobemott trophyxpose bad enough verge extinction murderer feel need ,1608038604445732866,828743253927137280,en,2022-12-28 09:54:13+00:00
75,75,trophyxpose bad enough verge extinction murderer feel need hasten inevitable tragic loss animal kingdom maybe animal go monster murder extinction,1608038518504456192,828743253927137280,en,2022-12-28 09:53:53+00:00
76,76,natureexp lewa conservancy home wide variety wildlife include lion leopard elephant buffalo ,1608030057468936193,1581952473710923776,en,2022-12-28 09:20:16+00:00
77,77,daisy story youtube inhuman individuels murder need burn hell hero care wild great charity,1608029784595959809,748726252895342592,en,2022-12-28 09:19:11+00:00
78,78, month slaughter many elephant shock poach,1608027510163349504,30420638,en,2022-12-28 09:10:08+00:00
79,79,cero keychain key ring hippo handmade wild gift idea felt key chain bag charm pay favour patchyz etsy,1608027500244008960,1935018342,en,2022-12-28 09:10:06+00:00
80,80,teacheroffline msavaarmstrong stand ground opinion hannity fake anyone think skill realize itif,1608026932305661952,1585970042398810113,en,2022-12-28 09:07:51+00:00
81,81, large animal eah also know thick armored skin powerful body passby uwecentebbezoo scene experience thanks ugandauncovered cnn africa day explorewithhilda mbanzandre,1608025681539088384,1341861082353332225,en,2022-12-28 09:02:52+00:00
82,82,lewa conservancy home wide variety wildlife include lion leopard elephant buffalo booking tel infonatureexpeditionscomlewaconservancy conservation wildlife safari,1608024971204337665,1229378627151814657,en,2022-12-28 09:00:03+00:00
83,83, pejeta conservancy large black sanctuary east africa home black elephant lion leopard buffalo many african wildlife specie booking infokenyaparkscokeolpajeta conservation wildlife,1608024959799918592,1356961376737099776,en,2022-12-28 09:00:00+00:00
84,84,worldbankafrica throwback worldbanks firstofitskind wildlife conservation bond protect area critical black,1608019859757203458,1568628449849536514,en,2022-12-28 08:39:44+00:00
85,85,look poach orphan tiny baby left mum bit bloody keratin thank goodness good guy care precious little ,1608017898986930176,4787476299,en,2022-12-28 08:31:57+00:00
86,86,cyrusthavirus thank jesusmy last show benin city african signing outlong time ,1608017801213792256,305991404,en,2022-12-28 08:31:33+00:00
87,87,lake nakuru national park worldfamous birding wildlife destination kenya home large number animal include lion flamingosfor booking infotoafrikacomlake nakuru wildlife safari africa adventure,1608017732397633536,1356960029996441602,en,2022-12-28 08:31:17+00:00
88,88,cherrykumii lunarmetal trade red pandan corgin beaver emu rabbitnr rabbit nfr snow puma puma beetle snow cat therapy dog ant nrn buffalo mmfr cat ground sloth mouse stingray trade,1608010710721925120,1599928889312440320,en,2022-12-28 08:03:23+00:00
89,89,throwback worldbanks firstofitskind wildlife conservation bond protect area critical black survival entire ecosystem southafrica see detail,1608010127591735298,135187648,en,2022-12-28 08:01:04+00:00
90,90,brisgreys group box photography golden sand heat mst lektra zip alabama blue hornet,1608010004711485442,143900943,en,2022-12-28 08:00:35+00:00
91,91,kellog think favorite animal zoo,1608006833809068032,1057750514438455298,en,2022-12-28 07:47:59+00:00
92,92, final cup debate challenge next representative peponischool take sometime get last minute advice iconic ianmbuguakaisorganisation cupdebate internationalschoolskenya debatecompetition internationalschools,1608005184638308354,1426074179963609090,en,2022-12-28 07:41:25+00:00
93,93,box drawbox photography golden sand final shaye milligan sunshine delight street cry lektra rich link zip kyrgios zip alabama re blue hornet re captain bizarrebrisgreys skyracingau bunnybrasch,1607999832094048256,2819249544,en,2022-12-28 07:20:09+00:00
94,94,glimpse samvad session gpsinghips special dgp assam sir discuss depth positive change assam police last year assam police war corruption drug illegal ammunition poach,1607999540434735105,1295607874253512704,en,2022-12-28 07:19:00+00:00
95,95,amaze matobo national park matopos hill south bulawayo zimbabwe pinnacle experience matobo matabeleland noh zimbabwe,1607997110636498944,363341250,en,2022-12-28 07:09:20+00:00
96,96,badcustsvc vickiplatt quite zoo full isnt ,1607995246004113408,1419561207153967109,en,2022-12-28 07:01:56+00:00
97,97,new action movie idea shrek ride honey nut cheerio bee go back time destroy indestructible supergun kill anything get free coupon soy sauce trader joes gesmcoach,1607994996610977793,1486509120970653698,en,2022-12-28 07:00:56+00:00
98,98, celebrate bih critically endanger black provide scholarship child local community fantastic yearwe couldnt do youvideo credit dylan habil pejeta conservancy,1607994901102215169,58425101,en,2022-12-28 07:00:34+00:00
99,99,watch assamese thing street assam people take selfie friendwildflower wildlife viralvideo,1607991564386832384,1582245056471519233,en,2022-12-28 06:47:18+00:00
100,100,npa applaud tougher stance poacher,1607990103015657474,833661731423522817,en,2022-12-28 06:41:30+00:00
101,101,itihasapremi joychoudhury dangerous scope escape imminent death use horn leg,1607989224837640195,1559856331032449024,en,2022-12-28 06:38:00+00:00
102,102,white cell conveed sperm egg cell save specie,1607987695594405888,34819199,en,2022-12-28 06:31:56+00:00
103,103,bbc nature elephant secret life africa giant,1607982209855639552,398157610,en,2022-12-28 06:10:08+00:00
104,104,look bit freshly plaster wall impressive white allows serene sight cool afternoon dylan royal andbeyond phinda south africaandbeyondtravel andbeyondsightings wildwatch travelinspiration traveldeeper,1607979865818501120,102306857,en,2022-12-28 06:00:49+00:00
105,105,nypost left african,1607979809203802118,1589339585586372608,en,2022-12-28 06:00:35+00:00
106,106,utv roll bar grab handle grip utv grab handle polaris rzr gator kawasaki wildcat yamaha yxz txsebq,1607979535835742209,1584579631117639681,en,2022-12-28 05:59:30+00:00
107,107,handmade african soap stone carve kisii keny africanhangings etsy,1607978249988222976,1291158722,en,2022-12-28 05:54:24+00:00
108,108,solarsa natashacon share communal ground towards fair free prosperous south africa post unapologetically first please follow reciprocate citizenactivism stop assault economy unityinpurpose,1607977297377648640,1531555325177905152,en,2022-12-28 05:50:37+00:00
109,109,pachyman inform elephant selectable specie wow awesome news mak,1607972529418960902,1186826558125858816,en,2022-12-28 05:31:40+00:00
110,110,group box photography golden sand heat mst lektra zip alabama blue hornet qldisracingraceqld tabcomaumedia skyracingau gerarddaffy bunnybrasch mmcinallyphotos,1607972319921856513,625184095,en,2022-12-28 05:30:50+00:00
111,111, float feature giraffe wildlife safari truck represent park ability connect wildlife provide lifechanging moment,1607971370641530880,15535860,en,2022-12-28 05:27:04+00:00
112,112,trophyxpose long long life specie endanger specie end bullet shoot gunshoot gunshot gun sad hear see life,1607969516113518593,1554497968895832066,en,2022-12-28 05:19:41+00:00
113,113,handmade pink dot colour soapstone carve ken africanhangings etsy,1607969306461237249,1291158722,en,2022-12-28 05:18:51+00:00
114,114,blue flower handmade kisii soapstone carve africanhangings etsy,1607969185920950273,1291158722,en,2022-12-28 05:18:23+00:00
115,115,handmade pink colour soapstone carve free shipp africanhangings etsy,1607968070420824064,1291158722,en,2022-12-28 05:13:57+00:00
116,116,nvolpewild rescue beetle,1607966361426464774,1449195350854488069,en,2022-12-28 05:07:09+00:00
117,117,jamesrodriguez madonna record recordsuk mikekillmon attractive voice,1607962924517101568,1211004909815918592,en,2022-12-28 04:53:30+00:00
118,118,haaohaoo arctic shark caribbean red wolf black best speciesrelated story yearsome ,1607960283737210881,787935427961446400,en,2022-12-28 04:43:00+00:00
119,119,potatoandwaffle gon get kill shrink send nostril,1607958467444195328,1322631292098404352,en,2022-12-28 04:35:47+00:00
120,120, shiny pebble headand body trucki stay awake sleepmy leg make plastic wrap writewith horn javan sixth great extinction,1607950856061845505,1589878647007367168,en,2022-12-28 04:05:33+00:00
121,121,butagira sneak snack giraffe touch horn tiger pose picture behindthescenes uwecen,1607950487122231298,1545841106658762752,en,2022-12-28 04:04:05+00:00
122,122,frecksandframes lady bug go drive thru zoo kid ram car front despise lady bug home get infest kid bite hard,1607949175223910400,1298803699930804224,en,2022-12-28 03:58:52+00:00
123,123,strang physycal life being fruit sci onlywe know eahcan make giraffeselephantshammer sharkmonkey nose longanteaterszaudo dinosaur tricycle ptera etcso human horn nose power atom etcastella,1607948941886361600,1493569573035126786,en,2022-12-28 03:57:56+00:00
124,124,hippo face wild,1607944340495634432,1541527338835447809,en,2022-12-28 03:39:39+00:00
125,125,awork black african steel rod endanger animal sculpture roland lawar available aist,1607941941018107904,168624461,en,2022-12-28 03:30:07+00:00
126,126,ronjohnsonwi people demand fire mcconnell obvious compromise diy something get pocket fill investigatingspying take bribe vote diy ,1607940834774732801,1519877189596073995,en,2022-12-28 03:25:43+00:00
127,127,jamesrodriguez madonna record recordsuk mikekillmon girl great song love ,1607940382658265091,1579982455712292864,en,2022-12-28 03:23:55+00:00
128,128,rachanimate rogrstahlback vaping edible suck dab okay dont good source cant speak much try different strain need cbd balance thc intake youre try kill tolerance white seem good mix ,1607939486037725185,1293416713246015488,en,2022-12-28 03:20:22+00:00
129,129, humanso real horn born humansimilarif mask unmaskss helmet battleastella,1607939290469654539,1493569573035126786,en,2022-12-28 03:19:35+00:00
130,130,linneathecake found boner pill wild shouldve bought ,1607939137654652937,837519075504947204,en,2022-12-28 03:18:59+00:00
131,131,vickiplatt quite zoo full isnt ,1607939121242329089,1518185107873759232,en,2022-12-28 03:18:55+00:00
132,132,sirletshela belong chinese massage parlourselling horn elephant tusk,1607938412048437250,2865287637,en,2022-12-28 03:16:06+00:00
133,133,antique brass belt buckle african belt buckle wqze,1607929680291860480,1582017605463851008,en,2022-12-28 02:41:24+00:00
134,134,thehuntercotw please add iconic african animal vurhonga savanna dlcno zebra giraffe etc even look africa,1607920074022608896,2398671180,en,2022-12-28 02:03:14+00:00
135,135,incredibly eahs land area rainforest contain world know plant specie mammal specie incl endanger orangutan critically endanger sumatran tiger know bird specie,1607919976954097665,1311183942037327872,en,2022-12-28 02:02:50+00:00
136,136,chenweihua exactly chinese cuisine horn diseased batspangolins give world disease spitroasted labrador insect tapa,1607917495633207296,1364651562224738306,en,2022-12-28 01:52:59+00:00
137,137,josephflowers norasynth villians spiderman image armor honestly understandable scorpion doesnt poison he tank need protection electro harness power,1607914486656294912,1262557422016704515,en,2022-12-28 01:41:01+00:00
138,138,thompsonsafrica cute share charlie abandon hippo raise group become best friend,1607913884119359488,1586013436441464839,en,2022-12-28 01:38:38+00:00
139,139, glueon shoe surprising true story zoo vet patient dzuzcr,1607911302248435713,1584555765217492993,en,2022-12-28 01:28:22+00:00
140,140,paygirlperk watch disney exec kill juice make overprice sangria,1607908579243163649,1261614352878059520,en,2022-12-28 01:17:33+00:00
141,141,ghostwubbers insomniac kill prowler electro vulture put modern twist keep classic design,1607906380828258304,2367936740,en,2022-12-28 01:08:49+00:00
142,142,white calf south africawhitecuddlingcalfcerossavannaherbivoremammalafricananimalafricanwildlifevisitsouthafricanatureperfection animallover wildlifeoneah english naturelife animalphotos wildlife english,1607904490555858947,1487692721913401346,en,2022-12-28 01:01:18+00:00
143,143,read saveproof corrupt democrat gop fbi doj cia others harm united statesonly military save usaelectionfraudhumantrafficking moneylaundering harmfulhealthmandates,1607903639569600512,859219321205248001,en,2022-12-28 00:57:55+00:00
