,Unnamed: 0,tweet,tweet_id,author_id,lang,created_at
2086,2206,plantblazer crispsnr kencaudle slysparkane hombreingles dreadpiratedavy jmichaelsonut badibulgator logicalreterg bigbe umfpt polarisiskey bikinatroll mentalsfun ftfeofficial theguffa tacticalcat thatguym shookone surfpurzel dripsince solarelectrics pdubl thesejustwords carloscastillo jrcgarry dramaebk vixenvalkyria grizzified fabiotaglioni joeeason rdcarney manteo lad unclearwharfair patrickbeatmeat gordonsbrooks thenohernne whoopsbuni sambition greennorm player spotarse flatmack daitouink globerzune dwyed rcgothic praezident worldastage irrelevant one demand prove everything believe evidence anything unicorn isnt even use historical image unicorn,1603909978892410880,2680317103,en,2022-12-17 00:28:32+00:00
2087,2207,tchanathinktank dectchanablackafrican werepreparingtrumpndterm inauguration willbesoonwerewaiting youtraitorssacco,1603907883112058880,1573157001080832002,en,2022-12-17 00:20:13+00:00
2088,2208,eianews assam want poacher arrest follow yearlong manhunt abdul matin alias kala connect ,1603907726580629506,3142506339,en,2022-12-17 00:19:35+00:00
2089,2209,markabrackney cbthunting mariaohisalo animalwatch animaladvocate animaladvocacy protectwldlife marcthevet reallorraine finlandinuk henrysmithuk zacgoldsmith curious prefer elephant poacher trophy hunter,1603905179484553217,1276170894075887619,en,2022-12-17 00:09:28+00:00
2090,2210,markabrackney cbthunting mariaohisalo animalwatch animaladvocate animaladvocacy protectwldlife marcthevet reallorraine finlandinuk henrysmithuk zacgoldsmith refer poacher kill elephant leave meat rot regard preservation specie,1603903934883667973,1276170894075887619,en,2022-12-17 00:04:31+00:00
2091,2211,denverzoo thanks regular training session time spent building trust relationship rudy keeper rudy volunt,1603903758639202304,2235605119,en,2022-12-17 00:03:49+00:00
2092,2212,denverzoo last week rudys stylish practice anklet receive upgrade wore activity tracker monitor moveme,1603903690124931072,2235605119,en,2022-12-17 00:03:33+00:00
2093,2213, dead animal include spot deer gharials blue bull fight electrocution road accident cite cause death wild animal die period poach,1603899741145743361,1539993931630272512,en,2022-12-16 23:47:51+00:00
2094,2214,karilake much suppo kill pay,1603899357169942528,1518709984254693377,en,2022-12-16 23:46:20+00:00
2095,2216,zoo knoxville mourns death beloved polly white zooknoxville,1603891102519525377,166207963,en,2022-12-16 23:13:32+00:00
2096,2217,repadamschiff hey adam dont stop lie know journalist ban ban doxxing elon musk endanger family main stream medium democrat despicable traitor,1603890543473336321,1587934030481211393,en,2022-12-16 23:11:19+00:00
2097,2218, white save specie,1603887873832411137,1159116954575233024,en,2022-12-16 23:00:42+00:00
2098,2219,complicit evil evil well demand name go island arent scream save child pedophilia theyre guilty,1603887691589877760,1516842869503504395,en,2022-12-16 22:59:59+00:00
2099,2220, fun lutri battle tonight face multiple matchup kill faster issue stole game burn run amulet titan twice,1603887299716157441,1456565830016188435,en,2022-12-16 22:58:25+00:00
2100,2221, rudy critically endanger black suppoing conservation right zoo rudy zoo accredit zoosaquariums paicipating research project organize american institute cero science,1603885449558327297,20440823,en,2022-12-16 22:51:04+00:00
2101,2222, work kruger park hectare focus mainly anti poach effos end best protect entirety beautiful natural heritage,1603876791424356352,314644262,en,2022-12-16 22:16:40+00:00
2102,2223,wildlifefurries new wildliferpg vidhey guysheres large video multiple character malefemale focus big,1603876698889519106,1371200308127404033,en,2022-12-16 22:16:18+00:00
2103,2224,ive heard asian use incisor defense instead horn true,1603875422219141120,1487278334081912834,en,2022-12-16 22:11:13+00:00
2104,2225,hey beepboopbotz even mega space cancel still want show lovewe run beepboopbotz night market discord channelif hold willing hold drop discord join ,1603873855403020288,1487844944807088133,en,2022-12-16 22:05:00+00:00
2105,2226,white polly die year zoo knoxville,1603871160453718017,17121146,en,2022-12-16 21:54:17+00:00
2106,2227,clftrader ediekollling kiss hoodie,1603870159944314881,31369000,en,2022-12-16 21:50:19+00:00
2107,2228,zoo knoxville announce friday mourn loss polly southern white cero zoo iconic residentsread ,1603870098657271813,66344113,en,2022-12-16 21:50:04+00:00
2108,2229,trade anyone look new quote trade insurance sure get touch team trade insurance,1603867984573136897,1364163522,en,2022-12-16 21:41:40+00:00
2109,2230,awkward javan world endanger cero specie dozen left main,1603867409554644992,1351436889316683778,en,2022-12-16 21:39:23+00:00
2110,2231, think real question ditch pet stop chinese kill elephant ivory stop kill tusk gbnews gbnews savetheelephants savethes,1603864619927625728,423418255,en,2022-12-16 21:28:18+00:00
2111,2232,kwskenya ati hauna form krisizuru kwstsavowest national park spot dust red ellies wildlifethe newly ,1603863828319592448,1209769777528479744,en,2022-12-16 21:25:09+00:00
2112,2233,head papercraft trophy printable puzzle papercraft pdf template make african wall ecogamishop,1603863547146035209,1193207888573091840,en,2022-12-16 21:24:02+00:00
2113,2234,annmarie black isnt extinct sure come disney animal kingdom theyre help repopulate specie,1603862068851007491,4432031387,en,2022-12-16 21:18:10+00:00
2114,2235,catsouthall callofdistress great youtube spotify soundcloud deezer motown islandrecordsuk record umg officialchas brit mtvema bravomagazin katyperry kimwilde harpersbazaarus,1603859858725359616,1229162222590550017,en,2022-12-16 21:09:23+00:00
2115,2236,jackkalamazoo kuschlichter boneless new,1603858755455799296,1593757976069816326,en,2022-12-16 21:05:00+00:00
2116,2237,knoxville tenn wcyb zoo knoxville mourn loss yearold southern white name polly polly euthanized friday morning due decline health accord zoo official,1603858660555464705,2189688840,en,2022-12-16 21:04:37+00:00
2117,2238,yall okay dolly polly highlight trip zoo favorite animalso hit hard,1603857027591200789,148819090,en,2022-12-16 20:58:08+00:00
2118,2239,dennisheaton use stuff menu white spot pirate pakk triple zoo styx albino etc,1603856479353987072,2321941256,en,2022-12-16 20:55:57+00:00
2119,2240,polly zoo knoxville white die friday morning day deteriorate health,1603852975230836736,6892002,en,2022-12-16 20:42:02+00:00
2120,2241,zoo knoxville mourn loss yearold southern white name polly,1603852266397700114,33764296,en,2022-12-16 20:39:13+00:00
2121,2242,megynkelly tracy soon face major crisis save eah cow reduce confront deer buffalo face face horrible gun bearing hunter aka conservationist largely defend animal dadada,1603850766267125771,1483975301919035394,en,2022-12-16 20:33:15+00:00
2122,2243,solen old crystal alien who try best lifeshes chemist secretary big clothing companya pet owner hyperactive ice living crystalyoungest sibling mother year old emo scorpion,1603839999824105475,1134273545968791552,en,2022-12-16 19:50:28+00:00
2123,2244,kiss clftrader think love pic,1603838552428711956,17013575,en,2022-12-16 19:44:43+00:00
2124,2245, last male nohern white sudan die bring specie back death hyperrealistic projection closest well come see hearing life creation alexandra daisy ginsberg ,1603836517000028160,467519578,en,2022-12-16 19:36:38+00:00
2125,2246, black namibia search survivor african dese jmcofw,1603833399780704274,1580769798199410688,en,2022-12-16 19:24:14+00:00
2126,2247,wild animal elephant lion can soda popped open fun game sentient creature capable feel pain suffer trophy hunter deny basic right live free humaninflicted harm bantrophyhunting,1603831627482030080,1246634306,en,2022-12-16 19:17:12+00:00
2127,2248,karababy phantogram gunshipchonsigns southern crossaesop rockrings saturnhorn different band different genre enjoy,1603830442246930447,1487289638272253953,en,2022-12-16 19:12:29+00:00
2128,2249, least wild animal die past month spot deer gharials blue bull wild elephant dead animal die fight electrocution road accident,1603830189015736320,1540267534007402496,en,2022-12-16 19:11:29+00:00
2129,2250,migerwilde jimmyotx jasonrobergeva levinejonathan cnn washingtonpost nytimes fast reader whats amuse need shohand believe youre right believe bunch belief likely say wrong suspect care rep dem citizen affidavit cool,1603828252468019201,800711002140479488,en,2022-12-16 19:03:47+00:00
2130,2251,trader realhighup tradermayne work guy talk badly youall wait hed make million level trading,1603827768806244352,18873970,en,2022-12-16 19:01:52+00:00
2131,2252,rhisotope happy reconciliation day south africa reconciliationday holiday southafrica december education awareness,1603826667276734464,4888146829,en,2022-12-16 18:57:29+00:00
2132,2253,shadeswfr ahhh yeah make sense sad fate wild babieswhich specie exactly love big eyesheres noodle tax wasabi rat snake,1603826446526447632,1196121900352712708,en,2022-12-16 18:56:37+00:00
2133,2254,otcbitcoin trader tradermayne keep dig hole hahahaahha,1603826167488065536,277137912,en,2022-12-16 18:55:30+00:00
2134,2255,trader realhighup tradermayne go rebuild account go talk shit cancel goodwill,1603825178878038016,18873970,en,2022-12-16 18:51:34+00:00
2135,2256, raise fund save savingthesurvivors thinkdifferent drrob wildography frenchconnector ohlala tobiasschmid roundtable marionawfal,1603818515823067136,256032882,en,2022-12-16 18:25:06+00:00
2136,2257,cbthunting thisisdavina peteregan appgtrophyhunt sirrogergale henrysmithuk edgoncalvescbth unitingafricans animalsmatter trophy hunt reason still exist,1603816421317804057,1276170894075887619,en,2022-12-16 18:16:46+00:00
2137,2258,gopleader take ftx fund use want new leadership demand disappointed ,1603816253134610433,1586035679250841605,en,2022-12-16 18:16:06+00:00
2138,2259,dont make face project coexist legendary gen hornup,1603814207878840337,1452336074387296267,en,2022-12-16 18:07:59+00:00
2139,2260,black population staing thrive zimbabwe first time decade expes say,1603812202288496661,23369246,en,2022-12-16 18:00:01+00:00
2140,2261,seo strong googlebusinessprofile crucial want website social profile rankbad help digitalmarketing google,1603804658673254400,235366725,en,2022-12-16 17:30:02+00:00
2141,2262,noheasttoday assam suspect poacher nabbed follow nearly oneyearlong chase injured police fire,1603799347640295425,350095388,en,2022-12-16 17:08:56+00:00
2142,2263,blainedp brucemontenegr drosenfal gregthegork pmpamet vaushv elonmusk give infinitely dumber rock much less ill stick call seens horn beholden corp dnc give gutless theyre explain inability answer anything,1603796477267976192,1463028332048441350,en,2022-12-16 16:57:31+00:00
2143,2264,glad paicipate workshop grassland management dudhwanp organize upforestup wwfindia crucial subject conserve herbivore provide well habitat iucnssc iucnwcpa iucnforests moefcc ntcaindia sirf savethe,1603796429470076929,818112611342548992,en,2022-12-16 16:57:20+00:00
2144,2265,throw self friend encounter horn,1603795036604342274,4285987159,en,2022-12-16 16:51:48+00:00
2145,2266, least wild animal die past month victim natural death affluently domestic dog biting spot deer gharials blue bull wild elephant die,1603794486982737920,1505485955838320642,en,2022-12-16 16:49:37+00:00
2146,2267,pixio piranha sprout different specie piranha plant dino torch dino get stomp ,1603794430309601280,950441804645715968,en,2022-12-16 16:49:23+00:00
2147,2268, lose installation alexandra daisy ginsberg natural history museum natural history museumas spock say illogical hunt anything extinction,1603792304099233792,82716407,en,2022-12-16 16:40:56+00:00
2148,2269,mother save newborn baby lion happen animal world,1603790551031205888,1256512175067353088,en,2022-12-16 16:33:59+00:00
2149,2270, dead animal include spot deer gharials blue bull fight electrocution road accident blame death animal wild animal die due poach period thanks awareness program,1603790152220184577,1514241717335371786,en,2022-12-16 16:32:23+00:00
2150,2271, dead animal die natural death succumbed domestic dog biting dead animal include spot deer gharials blue bull wild elephant,1603789726729003009,1543925344809336832,en,2022-12-16 16:30:42+00:00
2151,2272, tiedown strap get muscle usausa tiedown strap battlbox survival wilderness prepper everydaycarry prepping gear survivalist survivalkit outdoors,1603786549098840067,3002505221,en,2022-12-16 16:18:04+00:00
2152,2273,fresnozoo sleep zoomies sleep repeat baby blast savanna african adventure sure ,1603786368970534912,1522642240434106368,en,2022-12-16 16:17:21+00:00
2153,2275,savethe repos suggest poach kwazulunatal year far youve help raise ,1603781143224008706,47578298,en,2022-12-16 15:56:36+00:00
2154,2276,leftyjew thing zoo impoant specie preservation wild animal subject poach habitat loss zoo zoo safari park kept white alive california condorshitty one zoo shut ,1603779476122664961,1435623552389050373,en,2022-12-16 15:49:58+00:00
2155,2277,paicipants need online surveytopic public perception dehorn surveycircle conservation animal biology dehorn africa reserve poach survey surveycircle,1603778859064860673,900625214320644097,en,2022-12-16 15:47:31+00:00
2156,2278, anyone look new quote trade insurance sure get touch team trade insurance base right offer quality protection affordable price tradeinsurance publicliability,1603778382797340672,799640480485097472,en,2022-12-16 15:45:37+00:00
2157,2280,hand paint jewelry paint shell russian lacquer miniature painting global curiosity wildlife pendant zoologist gift etsy,1603775628918099968,845084589920063488,en,2022-12-16 15:34:41+00:00
2158,2281,mschlapp isnt white endanger specie,1603767906822926341,1602078369272586240,en,2022-12-16 15:04:00+00:00
2159,2282,indian visit laokhowaburhachapori team member understand suitability habitat translocationboyconser biodiversitymag,1603766978405355522,2504202403,en,2022-12-16 15:00:18+00:00
2160,2283,drwillfowlds elizeroets scary sad saw clip boost number go kill many,1603765728389132288,1464914242705018880,en,2022-12-16 14:55:20+00:00
2161,2284, goriya moriya julha deshi syed illegal islamic settler assamese muslim take responsibilitythe want poacher identify abdul matin arrest assam police almost year search,1603764373977460743,2991999086,en,2022-12-16 14:49:57+00:00
2162,2285,karendoe border impoant biden africa isare impoing smaybe send navy pick illegals africa ,1603760463875280896,944587174350950400,en,2022-12-16 14:34:25+00:00
2163,2286,lavenderwild happy friday anipals join raise fund save irl savingthesurvivors realfrconnector,1603760082650537986,1456722343871528968,en,2022-12-16 14:32:54+00:00
2164,2287,edinahn gestination period month black baby always run mother white,1603757065784156161,1603756180605751299,en,2022-12-16 14:20:55+00:00
2165,2288,hodilu goh found dead chitwan thursday monthold still hornless male year old female ,1603752245035958272,156999670,en,2022-12-16 14:01:46+00:00
2166,2289,thank karen vineyard church long time sponsor event amaze suppo charge event checkpoint sponsor arkark conservation fundraisingforacause conservationheroes rcsponsors,1603750413144133633,216336383,en,2022-12-16 13:54:29+00:00
2167,2290,kiss mentally subtract thiy something point level get back cash market,1603750028690219008,82444051,en,2022-12-16 13:52:57+00:00
2168,2291,indian police arrest want poacher taniyadutta thenationalnews,1603748692166672393,1448917136978726919,en,2022-12-16 13:47:39+00:00
2169,2292,citysfelephants didnt know horn sarc onsooooooo beautiful,1603748489204211714,1600161335995777031,en,2022-12-16 13:46:50+00:00
2170,2293,deborahdavigdor sure hard evidence point hard yard pretty decent payoff longer term thats individual learn friend say crux youre happy get infect youre happy kill maim others,1603740635470495745,396349377,en,2022-12-16 13:15:38+00:00
2171,2294,today day thelost installation alexandra daisyginsberg openbook free visit museum come facetoface nohern white digitally brought back life learn ,1603737252311580675,35749264,en,2022-12-16 13:02:11+00:00
2172,2295,calloway however repoedly first choice head coach former united state national team captain john harkes say offer position prior week unable agree financial term,1603735891775741953,1513266878164180996,en,2022-12-16 12:56:47+00:00
2173,2296,iffklive stateofthea cinema camera red vraptor limited edition showcased today international film,1603735564049842177,712928266,en,2022-12-16 12:55:29+00:00
2174,2298,ericswalwell rest want trump go theyre corrupt cumbags know corrupt follow twitter truth finally come put mask back truth go kill ,1603734574663606272,1456473247,en,2022-12-16 12:51:33+00:00
2175,2299,helping conservation overview africageo sanparks recently release annual repo ,1603733311045738498,450740193,en,2022-12-16 12:46:31+00:00
2176,2300,nosleepuno sleep boy wildin nosleepdiego nosleep psshare nbak ktvwow kcommunity nbamemes ,1603733034641117187,1576241863937429504,en,2022-12-16 12:45:26+00:00
2177,2301, trend continue year end kill rate equal poach kruger,1603731919795011590,869959916,en,2022-12-16 12:41:00+00:00
2178,2302, spent last year reserve interact hippo announce week charlie release wild finally real pod,1603731740668862471,572920649,en,2022-12-16 12:40:17+00:00
2179,2303,happy news long weekend met little guy charlie hippo year ago film work wildlife rehabilitator karen trendler orphanage charlie abandon podherd day old,1603731321452380160,572920649,en,2022-12-16 12:38:37+00:00
2180,2304,live laugh love funny costume tshilive toxically childrenlaugh dwindle populationlove man woman,1603726230091694081,1603083788430573569,en,2022-12-16 12:18:23+00:00
2181,2305,suespurgin friday reflection horn status symbol chinese elitestoppoaching ,1603725712707534850,305529200,en,2022-12-16 12:16:20+00:00
2182,2306,hope beautiful fridaydont forget savingthesurvivors wildography room clubhouse friday est gmt raise fund work help injured ,1603724900115415040,1456722343871528968,en,2022-12-16 12:13:06+00:00
2183,2307,open today lose installation alexandra daisy ginsberg natural history museumvisitors nhmlondon engage emotive lifelike digital recreation nohern white cero,1603724370102427649,426643223,en,2022-12-16 12:11:00+00:00
2184,2308,buffalo big together lion leopard elephant male female african buffalo heavy ridge horn grow straight head curve upwardsemailinfowhiteplainsafariscomcontact buffalo,1603722895938699265,1217316376744022016,en,2022-12-16 12:05:08+00:00
2185,2309,acc chitwan data goh gharials blue bull wild elephant antelope boar tooises leopard spot deer found dead last month none animal die poach period,1603718164239581185,44861089,en,2022-12-16 11:46:20+00:00
2186,2310,watch video listen game ranger victor ngwenya talk impoance nature wildlife conservation future generation star rambo thabo arm surveillance thulathulafund,1603715073805017089,400179207,en,2022-12-16 11:34:03+00:00
2187,2311,tradingjeremy deeply concern number poach chill repo donpinnock dailymaverick southafrica http,1603714759676805120,2716868551,en,2022-12-16 11:32:48+00:00
2188,2312,assam want poacher arrest follow yearlong manhunt abdul matin alias kala connect poach worldfamous onehorned kaziranga national park assam india source,1603713965317660672,44601026,en,2022-12-16 11:29:39+00:00
2189,2314,loveugsafaris giant queen elizabeth national parkdanielfromhungarysafaris tour elephant ,1603710501355388928,968857836,en,2022-12-16 11:15:53+00:00
2190,2315, stateofthea cinema camera red vraptor limited edition showcased today international film festival kerala first time camera contribute success hollywood film exhibit india,1603708746202419200,760458382142832640,en,2022-12-16 11:08:55+00:00
2191,2316,natureandpeace wildlife justice commission unveiled alarm data traffic traffic occurs coun,1603707202551926785,1270033060231249921,en,2022-12-16 11:02:47+00:00
2192,2317, know amaze garden team grow banana zoo handsome sanjay qabid recently enjoy eat banana leaf treat tree wrap hay protect frost see next enclosure,1603707054618705921,34610672,en,2022-12-16 11:02:11+00:00
2193,2318, wildlife justice commission unveiled alarm data traffic traffic occurs country corruption undermines law protect shelp fight poach donate link belowanimalrights herefornature,1603706669686394881,1154474094232051714,en,2022-12-16 11:00:40+00:00
2194,2319,acc awf kunits african country uncovered cache lead arrest suspect ivory horn lion claw hippo teethand pangolin scale recover,1603706656998596608,44861089,en,2022-12-16 11:00:37+00:00
2195,2320,handmade blown glass wild animal collectible figurine figure ornament miniature cool stuff gift idea ,1603706372113125376,709168790949462016,en,2022-12-16 10:59:29+00:00
2196,2321,kenyadan summary ivory traffic network operating africa kill elephant pan,1603703783707418624,2605340502,en,2022-12-16 10:49:12+00:00
2197,2322, early morning tactic curator use need feed little thaba spoil esme mudbath keep side boma thaba finish feed way still feel special wildlife video,1603703446846185472,202622656,en,2022-12-16 10:47:51+00:00
2198,2323,huawei mtnng aah look wise chinese help little african kiddy probably distract poach horn pangolin scale help harden soft dick,1603700478700929024,824917948712308736,en,2022-12-16 10:36:04+00:00
2199,2324,ati hauna form krisizuru kwstsavowest national park spot dust red ellies wildlifethe newly establish view platform ngulia sanctuary also incredible wildlife experiencezurunakws zurukenyaparks zurutsavowest,1603698913457864705,250024481,en,2022-12-16 10:29:50+00:00
2200,2325,loremitours throwback ziwa sanctuary place track ugandauganda wild ,1603698400809164801,891247010506002432,en,2022-12-16 10:27:48+00:00
2201,2326,suzyiam phil fair say industry large construction supermarket road technology company etc well,1603696673665871873,3132858823,en,2022-12-16 10:20:56+00:00
2202,2327,sidduu uttar pradesh record increase population state reintroduction yr agoan interstate ,1603696323244437504,1214885977715396609,en,2022-12-16 10:19:33+00:00
2203,2328,theyouthscat morning reminder china emissionsthe origin covidhas wet marketsand cause tiger ,1603695943802552320,1250565558963240964,en,2022-12-16 10:18:02+00:00
2204,2329, morning reminder china emissionsthe origin covidhas wet marketsand cause tiger pangolin disappearclimatescam,1603695934302752769,1487852874826661894,en,2022-12-16 10:18:00+00:00
2205,2330,hodilu citizen guinea sentence month conspire traffic million dollar horn elephant ivo,1603693058289172480,796209435865661440,en,2022-12-16 10:06:34+00:00
2206,2331, lucky share planet amaze animal image credit askmott olpejeta olpejetaconservancy conservation wildlifeconservation kenya africa laikipia black endanger naturephotography wildlifephotography kenyanwildlife,1603691464650801153,58425101,en,2022-12-16 10:00:14+00:00
2207,2332, demand record upload hoodwink soundtrack stream service,1603691296555614208,2886367516,en,2022-12-16 09:59:34+00:00
2208,2333, late rare studio thanks adonicab travel conservation,1603689794864922624,973866358705475584,en,2022-12-16 09:53:36+00:00
2209,2334,sexpills spot wild,1603689382350929920,1217666731788898306,en,2022-12-16 09:51:58+00:00
2210,2335,markabrackney oleshangay maybe easy well legal horn tradejust say,1603688548426809344,1217402090726789121,en,2022-12-16 09:48:39+00:00
2211,2336,deeply concern number poach chill repo donpinnock dailymaverick southafrica,1603686054757908481,47456979,en,2022-12-16 09:38:45+00:00
2212,2337,gon crash watch watch step friday conservation wildlife safari southafrica hodilu savingsurvivors,1603682540522541056,306757401,en,2022-12-16 09:24:47+00:00
2213,2338, javan world endanger cero specie dozen left main threat palmoil expansion deforestation suppo shop boycottwildlife palmoildetect,1603678908242690048,3323309554,en,2022-12-16 09:10:21+00:00
2214,2339,kevinmillerauth wardcarroll legacy hornet paddle switch design pull emergency pilot override,1603677982379618304,1509988421862797314,en,2022-12-16 09:06:40+00:00
2215,2340,rookiesothersm use mount handlebar also dont cuz expensive ill kill ,1603676076420386816,1535394257648877569,en,2022-12-16 08:59:06+00:00
2216,2341, pack front bumper compatible plug aftermarket replacement oem ugf sbd yiofdlp,1603674724541747200,1584333034320453634,en,2022-12-16 08:53:43+00:00
2217,2342,cincinnatizoo zoo,1603674286580957186,2745174964,en,2022-12-16 08:51:59+00:00
2218,2343,rofikulislam happen animal corridor kaziranga assam kaziranga nationalparks save assam ,1603673267990310915,55518459,en,2022-12-16 08:47:56+00:00
2219,2344,possession horn operation net suspect ermelosouth african police servicedecember read full aicle different page use follow link farmcrimeupdates poach horn poach,1603672835318493186,1599020413358587905,en,2022-12-16 08:46:13+00:00
2220,2345, want poacher arrest police assamthe want poacher identify abdul matin arrest assam police almost year searchmatin arrest police darrang district assam,1603672347818438656,1437799658424725508,en,2022-12-16 08:44:17+00:00
2221,2346,wakilinomad meru national park vast wilderness park receives few visitor deserves public ,1603671944343293952,803500281216507904,en,2022-12-16 08:42:40+00:00
2222,2347,close monitoring protection unit reveal sustain injury eye founately necessitate put animal treatment conservation wildlife animal nature lewaconservancy africa,1603670646650798082,48306484,en,2022-12-16 08:37:31+00:00
2223,2348,happy reconciliation day south africa reconciliationday holiday southafrica december education awareness domore southafrica witsalumni wit wildlife sustainable conservation endangeredspecies nuclear specie animal savethe africa,1603670303795822594,1381013077424893953,en,2022-12-16 08:36:09+00:00
