,Unnamed: 0,tweet,tweet_id,author_id,lang,created_at
1062,1248, mozambican park welcome first white year threaten animal complete kilometre thousandmile truck ride south africa conservationist say,1542925090886754311,380648579,en,2022-07-01 17:36:22+00:00
1063,1249,ktnnewske medicinal explanation chinese need horn medicinal reason people flock quail egg demand high kenyan supply,1542924774690770945,87119115,en,2022-07-01 17:35:07+00:00
1064,1250,good day christianamusk best way contact regard work together unreasonable bend history right direction conservation south africa,1542924409752649729,7986572,en,2022-07-01 17:33:40+00:00
1065,1251, potawatomi zoo host bowling strike spare mishawaka thursday night,1542923488192696320,236481275,en,2022-07-01 17:30:00+00:00
1066,1252,someone presidential manifesto sell hyena testicle addition plant cannabis rear snake expo expo dog meat curb federal expenseswhat next kill elephant tusk rate even prostitution legalize,1542922700271804417,1049626828355379201,en,2022-07-01 17:26:52+00:00
1067,1253,tornadophoenix thomasm debbiesammit priestcraig scoutsweeney lorraineluv say limit population good,1542922417525653504,1521605420548341763,en,2022-07-01 17:25:45+00:00
1068,1254,conveyor tutorial use schedule view filter track impoed object revit video provinggroundio cover workflow track manage revit element impoed use conveyor addinbim,1542922248851431424,1088018172052156416,en,2022-07-01 17:25:04+00:00
1069,1255,thehammerfllwyr linw alexandrahemmin know jimmy john owner huge poacherhunter elephant ,1542921325316132864,903010324114272256,en,2022-07-01 17:21:24+00:00
1070,1256, horn cost ,1542920448895246336,1254439619728494592,en,2022-07-01 17:17:55+00:00
1071,1257,dnjaga johngiks alaminkimathi horn much aphrodisiac sta value,1542919561233793026,841996550335266818,en,2022-07-01 17:14:24+00:00
1072,1258,jennyhkoin recent grant high graduate kenya use drone skill help protect positivevibes koinnews http,1542919292273958915,1851118694,en,2022-07-01 17:13:19+00:00
1073,1259,planet detractor argue indulgence rewilding gain momentum project attract investor create,1542916793433563138,1510313321022504962,en,2022-07-01 17:03:24+00:00
1074,1260,natgeowild learn include get help follow olpejeta amivee story black africa ,1542915957684727808,2255339388,en,2022-07-01 17:00:04+00:00
1075,1261,learn include get help follow olpejeta amivee story black africa kenya wildlife environmentalism conservation ,1542915949786980352,85839993,en,2022-07-01 17:00:03+00:00
1076,1262, pejeta brought black establish black conservation program today decade later generation celebrate huge milestone black conservation bih black ,1542915948390260738,85839993,en,2022-07-01 17:00:02+00:00
1077,1263, early population eastern black stood animal industrialscale poach tragically number plummet less left late ,1542915947001954304,85839993,en,2022-07-01 17:00:02+00:00
1078,1264,henry kosgei kenya wildlife service ranger monitor black meru national park kenya much anthony ochiengs work focus suppoing encourage fuher conservation action include platform tony wild anthony ochieng wpyhorizons,1542915915314089984,2192253985,en,2022-07-01 16:59:54+00:00
1079,1265, recent grant high graduate kenya use drone skill help protect positivevibes koinnews,1542914587279835137,1636695326,en,2022-07-01 16:54:38+00:00
1080,1266,reuters zookeepers cuba national zoo celebrate bih rare baby white,1542913669343895553,3426754587,en,2022-07-01 16:50:59+00:00
1081,1267, girl follow vacation kenya post lion kill caption fuck,1542913204099190784,1338767282751811584,en,2022-07-01 16:49:08+00:00
1082,1268,davramdavram metaphor death kill kill everything else excuse,1542912867816689666,1022480263912345602,en,2022-07-01 16:47:48+00:00
1083,1269,buttergoode good morning morning lspfriday zoo,1542912697821728768,3426754587,en,2022-07-01 16:47:07+00:00
1084,1270,citysfelephants vietnam man arrest trading horn ivory shell companiesstoppoaching stopthetrade ,1542912300700639237,3426754587,en,2022-07-01 16:45:33+00:00
1085,1271,helping nohern white fatus bihdayjoin wish special lady happybihday lea,1542912269553655810,3426754587,en,2022-07-01 16:45:25+00:00
1086,1272,citysfelephants endanger specie africa black black specie cero native,1542912133058465797,3426754587,en,2022-07-01 16:44:53+00:00
1087,1273,louisa london wild table love endanger animal hippo masai giraffe african elephant bengal tiger koala chimpa,1542911900865945603,3426754587,en,2022-07-01 16:43:57+00:00
1088,1274,vetpaw shade nowthis new film antoinejans poach vetpaws mission protect ,1542911834289848326,3426754587,en,2022-07-01 16:43:41+00:00
1089,1275,recfund solana careforwilds recently rescue orphan calf arrive early april adopt fellow,1542911272521531392,3426754587,en,2022-07-01 16:41:27+00:00
1090,1276,linw alexandrahemmin know jimmy john owner huge poacherhunter elephant etc dollar spent fund next kill,1542910248054308870,1539259919840464901,en,2022-07-01 16:37:23+00:00
1091,1277,afamcdk dioramasculpture depict late nohern white sudan grazing pejeta conservancy kenyaolpejeta olp,1542908221014347779,3426754587,en,2022-07-01 16:29:20+00:00
1092,1278,gonarezhou return bad rabbit studio joanna craig buck odonoghue producer world premiere wcff mission inform engage inspire wildlife conservation power film,1542908179578765312,625588793,en,2022-07-01 16:29:10+00:00
1093,1279,happy friday hope wonderful even relaxed weekend black ceainly fridayvibes weekend conservation biodiversity science animal research southafrica innovation empower wit wildlife,1542906517229379584,1381013077424893953,en,2022-07-01 16:22:34+00:00
1094,1280, little drawingcreature design sketchbook decide work bed last night basically want make weird metal horn also add hippo horse element well,1542905854646796290,1531794083705929728,en,2022-07-01 16:19:56+00:00
1095,1281, limited space available kalahari conservation experience depaing september help conservation effos enjoy excellent oppounities see blackmaned lion black african wild dog,1542903371971051520,52536012,en,2022-07-01 16:10:04+00:00
1096,1282,wildtomorrow turn chainchillaz second donation ada direct impact purchasing pair boot ranger protecti,1542901457640235009,1314375800121028608,en,2022-07-01 16:02:27+00:00
1097,1283, suppose reproductive right longnick also suggest get alive mother choice,1542900379486134275,1219420061917745154,en,2022-07-01 15:58:10+00:00
1098,1284,olpejeta type ticket choose dont miss promise special conservation event head,1542900095267622915,2273829730,en,2022-07-01 15:57:03+00:00
1099,1285,afp video ale baby white born june havana stroll curiously mother katherine african grassland,1542898524140044289,1863844777,en,2022-07-01 15:50:48+00:00
1100,1286,chris visit project site driven paners indonesian initiative take peoplefirst approach conservation sumatra team,1542898333353754624,9366272,en,2022-07-01 15:50:02+00:00
1101,1287,jaybies guess take wild guess,1542897818838376451,227978780,en,2022-07-01 15:48:00+00:00
1102,1288, need suck fuck come taste horn make moan wan hear coo moan swallow load suckme fuckme horn,1542897154879934464,1480677808737173505,en,2022-07-01 15:45:22+00:00
1103,1289,dramadelinquent gordonramsay tesco gracademy poach often eatable horn,1542895189299286016,3025167559,en,2022-07-01 15:37:33+00:00
1104,1290, arrest bam bahadur praja sentence year prison kill chitwan national park area past abscond kill long time expect save dyingwildlife,1542894359254708226,158907168,en,2022-07-01 15:34:15+00:00
1105,1291,hodilu hay state universitykansas master student exhibition inhumane mistreatment wild creature envir,1542893461103382529,22230837,en,2022-07-01 15:30:41+00:00
1106,1292, look bird piss always protect wildlife feel scare front pit bull get fire ,1542888545572032512,1516519077019271183,en,2022-07-01 15:11:09+00:00
1107,1293,tourismzambia mosioatunya national park locate livingstone home amaze highly endanger white ,1542888020571033603,135941484,en,2022-07-01 15:09:04+00:00
1108,1294,dont take horn always forlorn,1542887831000997888,1516519077019271183,en,2022-07-01 15:08:19+00:00
1109,1295, type ticket choose dont miss promise special conservation event head website information buy ticket today,1542885629024952321,58425101,en,2022-07-01 14:59:34+00:00
1110,1296,walshfreedom thankful constitutional republic keep flipfloppers power please zoo dont care think joe,1542885441933905923,1509893553346027521,en,2022-07-01 14:58:49+00:00
1111,1297,mind realbirdlawyer sick politician politics prisonslyin runnin lifeyou pathetic preacher hypocritic leaderssmilinand wastin timesick religion full shit opinionsim tire wait dierun ill againmotherfucker still alive,1542870033759698944,3070616868,en,2022-07-01 13:57:35+00:00
1112,1298,nquests real animal fox cutest zoo watch day,1542868665531596802,15703851,en,2022-07-01 13:52:09+00:00
1113,1299,hodilu old zoo indiana potawatomi zoo host bowling thursday nightthe proceeds wildlife,1542861050218917888,185034334,en,2022-07-01 13:21:54+00:00
1114,1300,edwardthembasa wonder animal kill ,1542858610098769926,443463958,en,2022-07-01 13:12:12+00:00
1115,1301,here upclose resaw action smooth easy contact demo place orderthe best resaw africa sawmill resaw sawmill resaws bandsawmill bandsawmill forestry wood timber,1542857460645593088,1542068905707012097,en,2022-07-01 13:07:38+00:00
1116,1302, winery open late last month noh san antonio allows guest get close personal revenue perperson experience donate sirf fuher conservation worldwide,1542857295033503744,44861089,en,2022-07-01 13:06:58+00:00
1117,1303,planet various invasive plant specie tend destroy grassland found abundance kaziranga manas ,1542856845802541058,1019944680748978178,en,2022-07-01 13:05:11+00:00
1118,1304,jeffsmithetc iucn research publish year impact legal hunt populationsmaban,1542855414068510720,701561603267960832,en,2022-07-01 12:59:30+00:00
1119,1305, old zoo indiana potawatomi zoo host bowling thursday nightthe proceeds wildlife conservation program kenya also help suppo national park globe,1542854026424901632,44861089,en,2022-07-01 12:53:59+00:00
1120,1306, dioramasculpture depict late nohern white sudan grazing pejeta conservancy kenyaolpejeta olpejetaescapes helping horni sudanthe pedalingagainst jemumwenda reviewsmb dancingfor,1542852513648500738,973910373136064512,en,2022-07-01 12:47:58+00:00
1121,1307,pntfosterp kevinhaddad cero commonly abbreviate member extant specie oddtoed ungulate family cerotidae also refer member extinct specie superfamily cerotoidea,1542850864611835912,1489451039094984708,en,2022-07-01 12:41:25+00:00
1122,1308, day ranger face dangerous challenge unpredictable wild animal arm poach gang yet lifethreatening situation least dont insurance need help protect rangersplease donate,1542850267582025729,41572208,en,2022-07-01 12:39:03+00:00
1123,1309,visiteast foot track doable rwanda akagera national park white soon fully reintroduce ,1542846625109901313,1203976595356172288,en,2022-07-01 12:24:34+00:00
1124,1310, foot track doable rwanda akagera national park white soon fully reintroduce wild freely roam see couesy naturephotography nature,1542845893614903299,1285603029350326277,en,2022-07-01 12:21:40+00:00
1125,1311, hay state universitykansas master student exhibition inhumane mistreatment wild creature environment present large ceramic head horn cut title highlight poach,1542845332559634436,44861089,en,2022-07-01 12:19:26+00:00
1126,1312, panelist head discussion sidney afande black florence nabwile ceo sstreambrian waweru softwaredevelopment leadnjoroge kinyanjui product manager mdundomoringacareerfairafricatechtalentmoringa,1542843431709540353,2822525797,en,2022-07-01 12:11:53+00:00
1127,1313,marketinglcarey conservation action congratulation finally beacon hope visitrwanda akagera africanparks,1542841595929706498,331621232,en,2022-07-01 12:04:35+00:00
1128,1314, superb starling commonly found eastern africa distinctive metallic blue orange feather make stand make sure pay visit next trip kept house share enclosure rock hyrax africaalive,1542841034501128192,127565294,en,2022-07-01 12:02:21+00:00
1129,1315,hodilu forrangers initiative set pete newland sam taylor panership save international bee,1542837145307516929,185034334,en,2022-07-01 11:46:54+00:00
1130,1316,hyena ball expensive horn poach wrong animal tingiza mitii nyoro makende ruto sakaja,1542835192947146752,1234885642628345856,en,2022-07-01 11:39:09+00:00
1131,1317,elseedug scary thing lifetime cent world killedelseed cmdamba oil,1542834488560222209,1272088436590034944,en,2022-07-01 11:36:21+00:00
1132,1318,wastelessme dont get fascination unicorn theyd skinny real give second look theyd boring zoo deer piss youd swear live ,1542834291029188611,23373153,en,2022-07-01 11:35:34+00:00
1133,1319, hunt suppos conservation actually highcou suspend decision barbaracreecy issue quota hunt expo south africa,1542829406745493510,921066162632478720,en,2022-07-01 11:16:09+00:00
1134,1320, forrangers initiative set pete newland sam taylor panership save international work improve life african ranger donate ,1542826318542372864,44861089,en,2022-07-01 11:03:53+00:00
1135,1321,ryder tory lucky arent get sewage water get viagra powder horn something ,1542825731650117633,2154550493,en,2022-07-01 11:01:33+00:00
1136,1322,conservation action congratulation finally beacon hope visitrwanda akagera africanparks,1542824119074422786,2838121605,en,2022-07-01 10:55:08+00:00
1137,1323,explore tsavo west national park glorious game drive spectacle mzima spring ancient land maneaters tsavo vibrant volcanic arena ngulia sanctuary home endanger black scontact safari infopumbaelitesafariscom,1542821479720652803,380785393,en,2022-07-01 10:44:39+00:00
1138,1324,shelly texaswinepod explains winery make splash conservation texsom wine award read txwine,1542819572394385410,292917747,en,2022-07-01 10:37:04+00:00
1139,1325, strong vray grasshopper adobe suite skill harry dobbs design seek architectdesigner join team london,1542818548174798850,821704196,en,2022-07-01 10:33:00+00:00
1140,1326, fascinate highly amuse open exchange session sir konstantin novoselov codiscoverer graphene lindaunobel lino cover horn levitate frog attempt paid beer,1542813216518115328,1008415727324418048,en,2022-07-01 10:11:49+00:00
1141,1327,galactrn good make effo point bullshit commenti couldnt bother oneits claim loss white overplayed someone paint grey white stuck zoo saw ,1542812462919172096,1441714690829086728,en,2022-07-01 10:08:49+00:00
1142,1328,dorling africananimaloftheday blackbacked jackalan undisputed plain dgaf attitude jackal doesnt,1542811512565284864,724601522,en,2022-07-01 10:05:03+00:00
1143,1329,africananimaloftheday blackbacked jackalan undisputed plain dgaf attitude jackal doesnt wait line waterhole roll youre mongoose love freak zebra dark ,1542810584231583746,253775219,en,2022-07-01 10:01:21+00:00
1144,1330, late rare studio thanks ipsnewsunbureau rickg conservation travel,1542808639450275840,973866358705475584,en,2022-07-01 09:53:38+00:00
1145,1331,good morning morning lspfriday zoo,1542806840987230209,2486591854,en,2022-07-01 09:46:29+00:00
1146,1332,accord wajackoya hyena testicle expensive horn poach wrong animalskakamegadecides simba arati ruto nyeri tingizamti,1542803142835830785,1411151011,en,2022-07-01 09:31:47+00:00
1147,1333,earlier week murchison fall national park ziwa sanctuary document retreat team tourism journalist organise tourismboardugthe retreat aim explore new trend best promote destination uganda exploreuganda,1542796773034545152,1158655877542531072,en,2022-07-01 09:06:29+00:00
1148,1334,tds course trump okay kill democrat anyone else try stop fascist instal ,1542795789520470016,39724652,en,2022-07-01 09:02:34+00:00
1149,1336,hyena ball expensive horn poach wrong animal tingiza mitii,1542784076960120832,876033767164571648,en,2022-07-01 08:16:02+00:00
1150,1337,fresnozoo girl conservation fund fully suppoed maternity pen sumatran sanctuary indonesia march,1542782417869705216,1035104292703793157,en,2022-07-01 08:09:26+00:00
1151,1338,poach hyena elephant ,1542777902864941057,297478224,en,2022-07-01 07:51:30+00:00
1152,1339,gidirphotos itsmainakageni really back sell tusk horn rate,1542776307091734529,1502033044701593618,en,2022-07-01 07:45:09+00:00
1153,1340,life span viral cell google search virus coldcommon something get cold stran get covid second time likely different strain zooanotic mutate virus,1542773836805980160,1472674462738829316,en,2022-07-01 07:35:20+00:00
1154,1341,akagerapark update follow historic translocation akagera november africanparks rdbrwanda white kilala plain process fully release wide parkwhites akagera rwanda afric,1542772715978891265,1521216557216669697,en,2022-07-01 07:30:53+00:00
1155,1342,wajackoyah hope give poacher alternative make extra cash kill elephant tusk also kill fisi ball nani alidhani siku moja fisi angekuwa kitu maana saizi,1542772318824501249,4879142554,en,2022-07-01 07:29:18+00:00
1156,1343,yearold swim raise fund black conservation,1542768024436056066,300254843,en,2022-07-01 07:12:14+00:00
1157,1344,yearold swim raise fund black conservation goodthingsguy allcapetown capetown,1542767600777629696,100338337,en,2022-07-01 07:10:33+00:00
1158,1345,versastyle neilros bondeking claredalymep notice even bother come excuse china regard decimation africa wildlife hand china traditional medicine trade clearly something even propaganda spew as cant deny,1542766230838427649,62197880,en,2022-07-01 07:05:07+00:00
1159,1346,wearenato multinational medic company efp battle group close cooperation helicopter mission rapid evacuation wound scenario exercise orange strongeogether readyunited,1542765698404872192,1337783955488182274,en,2022-07-01 07:03:00+00:00
1160,1347, impoant friday reminder mankwegametrackers welcometoouroffice friday stopthepoaching savethe bigfive big white conservation,1542765211895140352,2705966184,en,2022-07-01 07:01:04+00:00
1161,1348,planet zookeepers cuba national zoo especially proud ale pudgy graybrown baby white cero born earlie,1542764196404031488,1101149764731600896,en,2022-07-01 06:57:02+00:00
1162,1349,friday africawhite social cerosamazing snap welcome describe picturewhat go ,1542763674435297280,1417572530,en,2022-07-01 06:54:57+00:00
1163,1350,consider big animal wild weigh upto tonneskgs communicate poo release kg day uganda sanctuary ziwa sanctuaryugwildlife tourismboardug,1542762299924119555,1305071862867800064,en,2022-07-01 06:49:30+00:00
1164,1351,douglasjoyapics jessea lotsohats muellershewrote notoriously weaksightedplus sure many tv savannah zoo game preserve,1542761980741799936,1439420230946770945,en,2022-07-01 06:48:13+00:00
1165,1352,suespurgin thailand allege malaysian godfather wildlife trading boonchingteo arrest bangkok allegedly trading ,1542758956627525632,1600900638,en,2022-07-01 06:36:12+00:00
1166,1353,awfofficial retweet believe horn belongs ,1542756645469429760,2655203862,en,2022-07-01 06:27:01+00:00
1167,1354,siacece fyi legal trade wildlife product estimate usd yeardemand african ivory rhin,1542754703133577217,1671525757,en,2022-07-01 06:19:18+00:00
1168,1355, know great onehorned stay tune safari india sunday zeetvmerannvijaysingha,1542750598650630145,89174552,en,2022-07-01 06:03:00+00:00
1169,1356,concerned apathetic use social medium platform twitter gauge public awareness wildlife conservation case study illegal trade,1542749845168996354,85601740,en,2022-07-01 06:00:00+00:00
1170,1357,ktnnewske seem poach wrong animal hyena testicle expensive horn,1542749388270878720,856119709447720962,en,2022-07-01 05:58:11+00:00
1171,1358, zookeepers cuba national zoo especially proud ale pudgy graybrown baby white cero born earlier month outskis capital havana bih calf,1542744055074865152,905818825328926720,en,2022-07-01 05:37:00+00:00
1172,1359,update follow historic translocation akagera november africanparks rdbrwanda white kilala plain process fully release wide parkwhites akagera rwanda africanparks,1542741767652532225,466268619,en,2022-07-01 05:27:54+00:00
1173,1360,ent laryngoscope market trend forecast repo read,1542741637083942913,1523561924507488256,en,2022-07-01 05:27:23+00:00
1174,1361,kumbe hyena testicle expensive horn elephant tusk even poacher didnt know ittingiza miti,1542741459409014786,1463046220964843524,en,2022-07-01 05:26:41+00:00
1175,1362,wajackoyahtheth seem weve poach wrong animal let spare please,1542734316589006855,1154979805642862592,en,2022-07-01 04:58:18+00:00
1176,1363,fromeast hyena ball expensive horn poach wrong animal tingiza mti,1542730569028714497,1491449322856194053,en,2022-07-01 04:43:24+00:00
1177,1364,info slot buanatogel juli jam wibpragmatic rise samurai iiisweet bonanza xmastreasure wildthe great stickupgates olympusgreat megawayshabanero koi gatedisco beatshot hot fruitpgsoft emoji richesspeed winner,1542727321513107456,2496394296,en,2022-07-01 04:30:30+00:00
1178,1365,hyena ball expensive horn poach wrong animal tingiza mti,1542726576793681920,1498034313518108673,en,2022-07-01 04:27:33+00:00
1179,1366,hyena ball expensive hornselephant tuskswtfwajackoya fifthtingizamtii,1542723029536579585,1388097928888307713,en,2022-07-01 04:13:27+00:00
1180,1367, upgrade status celestial correction general data protection regulation gdpr rule fact apply deadly hideous venomous consult page handbook fuher information,1542713138306461696,1102175142837399552,en,2022-07-01 03:34:09+00:00
1181,1368,morganamache hyena ball expensive horn poach wrong animal wajackoyahthet,1542711652457521155,2672871380,en,2022-07-01 03:28:14+00:00
1182,1369,suemsteo curvycom kfpfitz whalenmona asavagenation hopz troycross styxofficial magatalker groupironbar killbilly ,1542711065074495488,162550599,en,2022-07-01 03:25:54+00:00
1183,1370,timkalyegira true agree updf command tough horn mean well,1542710765513314304,2430551997,en,2022-07-01 03:24:43+00:00
1184,1371,hey canimals check awesome breeding facility,1542707125083811840,1540138861472276480,en,2022-07-01 03:10:15+00:00
1185,1372,black porait black porait rest nose horn grass animal,1542705436142538753,42930140,en,2022-07-01 03:03:32+00:00
1186,1373,goodmangoodwomen space mix jesus christ michael jesus africa america europe abuse allsoulsmatter walkaway obama backtheblue canada soundclick left thy know areits timewake john godalwayswin,1542701429277835265,1519373548392955905,en,2022-07-01 02:47:37+00:00
1187,1374,curvycom kfpfitz whalenmona asavagenation hopz troycross styxofficial magatalker groupironbar killbilly carolyn melissa indymagz msajr rogueliberal fjbfix caroljv thegeneral thank much seat follow wave month cant wait honestly time old new one really think trump dont know theyre many back stabber far right think trump unfit unfit ,1542699521171660800,1537827647266463746,en,2022-07-01 02:40:02+00:00
1188,1375,southernmaid motherfoulker massachusetts governor baker,1542690464645668871,982652139401986049,en,2022-07-01 02:04:03+00:00
1189,1376,rosievaella hehe favorite day zoo adore animal thought share favorite picture highly ,1542689144752701443,1512293497398874113,en,2022-07-01 01:58:48+00:00
1190,1377,reopenchris christinapushaw govrondesantis really suppos slavery profit til death alimony human traffic chance retire hypocrite lie carrier attorney tyrant self interest politician murder johmccain song bird,1542685838806507520,3241908895,en,2022-07-01 01:45:40+00:00
1191,1379,nowplaying next spin work thru reissue poion collection here kevin gray cut steve hoffman remaster lacquer reuse reissue version reach range secondary market,1542681550721978369,2330981760,en,2022-07-01 01:28:37+00:00
1192,1380, save elephant go extinct activist painting tusk pink good idea stop poacher dont wait show airpos get caught,1542679906462711808,834936174762422273,en,2022-07-01 01:22:05+00:00
1193,1381, late rare studio wildlife news thanks lplatosmith wildlife conservation,1542679476798201860,973866358705475584,en,2022-07-01 01:20:23+00:00
1194,1382,wangtta fair ingenious way revive specie otherwise endanger due ecosystem failure argue evolution extinction necessary tragic cute elephant due poach thats cruel,1542677296720490496,1466357090750849025,en,2022-07-01 01:11:43+00:00
1195,1383,positivevibes recent grant high school graduate embark journey kenya help save endanger specie use drone full story ,1542676671710502912,18228178,en,2022-07-01 01:09:14+00:00
1196,1384,check sad aicle many poach south africa canimals,1542672999513354240,1539722929843216384,en,2022-07-01 00:54:39+00:00
1197,1385, nothing old good great driven license btg megawaysTM mechanic inspire african savannah new version let win bet hit lucky combination reel grid able generate way win,1542669876858429441,304385390,en,2022-07-01 00:42:14+00:00
1198,1386, navy demo teamvapor vaporcone hornet fhornet fsuperhornet usnavy navy airshow airshowphotography aviation airplane jet fighterjet shotoncanon canon canoneosr eosr photography pictureoftheday sigma mylensrental,1542666716521570305,2731126335,en,2022-07-01 00:29:41+00:00
1199,1387,timrunshismouth know corrupt people want get licence kill people pay opposition,1542666016416841728,1157374897313763329,en,2022-07-01 00:26:54+00:00
1200,1388,check lora long range technology help well monitor protect poach canimals,1542665613721477120,1539722929843216384,en,2022-07-01 00:25:18+00:00
1201,1389,mikekillmon strikeapose iamjojo express wonderlandmag madonna jojo fashion photoshoot ferocity pride,1542665295093022720,60482594,en,2022-07-01 00:24:02+00:00
1202,1390, zoo huge,1542659949205110784,2701633938,en,2022-07-01 00:02:47+00:00
1203,1391,galehowl today warmup dood blue mountain oni theyre suppose specie beast personal set havi,1542658227758075904,1048837902757638145,en,2022-06-30 23:55:57+00:00
