,Unnamed: 0,tweet,tweet_id,author_id,lang,created_at
1196,1249,aaisy aktivisalam narrative strong indigene community reach help outlike indigene south america protect amazon rancher indigene africa protect poacher,1614513989488365570,1926390913,en,2023-01-15 06:45:05+00:00
1197,1250,olpejeta commit save endanger black white pejeta invest time resource,1614511322854719490,3426754587,en,2023-01-15 06:34:30+00:00
1198,1251,olpejeta tackle issue require global effo protect wild population still exist stop illegal trade ,1614511302147280898,3426754587,en,2023-01-15 06:34:25+00:00
1199,1252, white ablindeye john hagans surreal african series illustration pofolio,1614509000762195969,973451406928633856,en,2023-01-15 06:25:16+00:00
1200,1253,rickyricksmusic castration poacher testicle,1614508197468856320,1442707568581877763,en,2023-01-15 06:22:05+00:00
1201,1254, park inform die due natural cause rule foul play horn hoof yearold found intact nepal,1614507170673860609,869959916,en,2023-01-15 06:18:00+00:00
1202,1255,india blow horn year keep safe poacher,1614505695235170305,713729083620868096,en,2023-01-15 06:12:08+00:00
1203,1257,thenamibian late elephant deadwhat happen wwf joe tagg chirs brown johnny walker nec barry klerk met super squad spy prevent wild life crime wacked know money do exactly,1614504187600961537,1203617396,en,2023-01-15 06:06:09+00:00
1204,1258, park ranger world protect wildlife simply get enough credit amount risk take everyday protect amaze animalsthis ranger protect white zambia visit gadventures kckiwigirl,1614495849643401216,259806870,en,2023-01-15 05:33:01+00:00
1205,1259,ceen horn electronic dance music edm eletronicmusic,1614493903914434560,1614485294757122048,en,2023-01-15 05:25:17+00:00
1206,1260,sandmar porn well horn,1614490897558683648,28762127,en,2023-01-15 05:13:20+00:00
1207,1262,tonight highlight need new tread hold tech suppo kill people second kill people split splatter saber finally collect blood noble eye gouge palette spatula knife,1614486089443549184,1212248469529751553,en,2023-01-15 04:54:14+00:00
1208,1263,blankparkzoo pedicure come shape size tumani eastern black recently spa day large mammal keep,1614485820580184066,1455244938019549187,en,2023-01-15 04:53:09+00:00
1209,1264,levzzzcaps thekillingbloke ibrahimp reality real green goblin tasm vulture morbius doctor octopus kraven hunter upcoming film tasm chameleon venom let carnage,1614478882262126593,1324223340928618496,en,2023-01-15 04:25:35+00:00
1210,1265,housedividedbot house divide emirati national football team rochester ,1614478344434614273,856686480370126849,en,2023-01-15 04:23:27+00:00
1211,1268,poachfree year india assam state reuters story,1614469340723642369,38331159,en,2023-01-15 03:47:40+00:00
1212,1269,blrobinson case many mammalian specie overhuntingand climate change primary cause dec,1614466901324840961,171787746,en,2023-01-15 03:37:59+00:00
1213,1270,anythingbott itshorn win sure,1614465831609548803,1365048104467255299,en,2023-01-15 03:33:44+00:00
1214,1271,elliotmalin hey pop see weve already address rino situation guy go zoo disrespect specific exhibit,1614464951241900032,392516156,en,2023-01-15 03:30:14+00:00
1215,1272, skin troll protection watch tape ayni hand wifey wrong good run trading go well market level hold leveraged cleaning service hand hold pin research thread mega pint good trading day witchy wifey,1614463550910504962,1474857278696308739,en,2023-01-15 03:24:40+00:00
1216,1273,muellerspace raise biography conservationist anna merz publish bedazzle ink truly,1614463369725071360,247440708,en,2023-01-15 03:23:57+00:00
1217,1274, wan mgrr patriot park ranger poacher kill lot park ranger protect interest wildlife wan shoot shoot poacher age ,1614461823960449024,1560319296609435649,en,2023-01-15 03:17:48+00:00
1218,1275, research park ranger africa dyed horn pink hue also give horn toxin apparently cause vomit human drink medicine product use horn ,1614461820978200576,1560319296609435649,en,2023-01-15 03:17:48+00:00
1219,1276,savethe muddy condition cotswildtweets restrict visitor parking make southern white calf pretty happy htt,1614458359062601730,77230556,en,2023-01-15 03:04:02+00:00
1220,1277,kiss clftrader baaaaaby,1614455631578021890,864215590709456896,en,2023-01-15 02:53:12+00:00
1221,1278,shunpseudonyms fascnate yep pretty much large land animal gorilla elephant giraffe hippo etc eat vegan diet human need kill eat flesh body innocent animal healthy strong,1614453804971302916,611112003,en,2023-01-15 02:45:56+00:00
1222,1279,scientist create third nohern white embryo big win specie,1614453299649953796,1315942066594217985,en,2023-01-15 02:43:56+00:00
1223,1280, scientist determine extinction know extinct,1614452432851054592,1254889778887131136,en,2023-01-15 02:40:29+00:00
1224,1281,mcmg heath major player bullet club get motor city machine gun retain tag title let see happens hardtokill impactwrestling,1614450418448318464,958090272092643329,en,2023-01-15 02:32:29+00:00
1225,1282,logicaisoiution scav loot pool change kill raid,1614443531602653184,1360403350647263235,en,2023-01-15 02:05:07+00:00
1226,1283,cbthunting stoppedthese precious living being murder stop permanentlythe last nohern white diedthey survive flood droughthuge stormsall kind problem murderer man destroyed themthey last yr,1614443053259042816,2358357278,en,2023-01-15 02:03:13+00:00
1227,1284,kiss clftrader bailey white cant fathom shes bad pa life,1614440747108802560,864215590709456896,en,2023-01-15 01:54:03+00:00
1228,1285,kiss clftrader bad penelope come emma pass brain tumor hardest thing ever,1614437191081668608,864215590709456896,en,2023-01-15 01:39:55+00:00
1229,1286,rare late rare studio wildlife news thanks thetribunechd wildlife conservat,1614434637484277762,439439615,en,2023-01-15 01:29:46+00:00
1230,1287,rare heabreaking tourer notice animal pain elephant pain feeling saw horn leave agony kill elephant tusk,1614432637275484162,1345573464569040896,en,2023-01-15 01:21:50+00:00
1231,1288, late rare studio wildlife news thanks thetribunechd wildlife conservation,1614432287835230208,973866358705475584,en,2023-01-15 01:20:26+00:00
1232,1289,justinwhang canon judy hopps get married rail officer buffalo officer officer polar bear officer nick wilde,1614431641807773698,1522950228671971328,en,2023-01-15 01:17:52+00:00
1233,1290,cetrahead warhammer brilliant mark khorne group choppy boy need painting inspire guidance approach red black blend,1614429360248815616,835528100,en,2023-01-15 01:08:48+00:00
1234,1291, really extinct shit wild,1614428117065687042,215533923,en,2023-01-15 01:03:52+00:00
1235,1292,jdavidclifton cbthunting go throw grenade trophy hunt control conservation wildlife people root isnt everyone arm poacher cut horn leave die agony pangolin lion etc scale etc,1614426771037847555,507558934,en,2023-01-15 00:58:31+00:00
1236,1293,sandiegozoo think he baby,1614411397974089728,1560347790278025218,en,2023-01-14 23:57:26+00:00
1237,1294, push call super wildcard weekend reminds someone try give nickname ryan call noi wont ryan,1614411210904018945,103092333,en,2023-01-14 23:56:41+00:00
1238,1295,blrobinson love black conservation challenge allow permit kill non productives help pay protection reproduce bison climate change bunch noise rich get richer ,1614408640081072129,1554970059352580097,en,2023-01-14 23:46:28+00:00
1239,1296,distchannel lion versus lioness promptly back mother enter fray shamwaritv,1614408604907630592,197193504,en,2023-01-14 23:46:20+00:00
1240,1297, case many mammalian specie overhuntingand climate change primary cause decline bison population rocket sciencethe obvious effect overhunting animal number often lose climatechange noise,1614406826467942400,1299185094264066051,en,2023-01-14 23:39:16+00:00
1241,1298,johnlew see assumption leigh whilst there plenty equally abysmal name murdochisation love club always preposterous name history association club city random marketing rubbish,1614405309321154560,95886486,en,2023-01-14 23:33:14+00:00
1242,1299,day bihday celebration weekend girl continue hot tub hail storm game newmarket poker hero thjanuary january weekendbreak twitterdiary,1614404446724968450,114575877,en,2023-01-14 23:29:48+00:00
1243,1300,killa ride ride wolf golden albatross squid puffin,1614398093340078080,1137727106606088192,en,2023-01-14 23:04:34+00:00
1244,1301,beautiful stranger cayman islandswhen time saw videofollow honor madonna complete discography madonnafans madonnacollector madonna record recordsuk williamorbit mikekillmon,1614397275127832576,15746198,en,2023-01-14 23:01:19+00:00
1245,1303,selecta jerry play hornz booom hornz boom wprbtune ,1614392058239754242,1512093721818509314,en,2023-01-14 22:40:35+00:00
1246,1304, wild clarkconnors big chip shoulder recent graduate new japan dojo mean represent legacy mean opponent aspirationsredcarpetrumble,1614389268583165953,1495514857856126979,en,2023-01-14 22:29:30+00:00
1247,1305,berlinbridge germany already sent tiger panther elephant wasp lynx maens bumblebee hornet king tiger even furniture van mobelwagens russia lessthansatisfactory result maybe time let leopard attack russia leopardsforukraine,1614387613670019072,1029391743706378240,en,2023-01-14 22:22:55+00:00
1248,1306,wisemanryder bryanjohnsen kimbecause mucusmucous bumpuslumpus briannazarenus tjonfire sariellaforever nuckchorris tjmair murphyyuiko ozziemalone sophiscnews mirandaisrisen skepticsplinter kerridwinr thegodpaicle thecatheist fearlessexpress edwardtankx rchchnce charlesthornt bzblues sicutlupus catheri tkthekitsune heathenwombat aprilligeia mobiusone hesanaughtyboy thetakingtree stevieanntas fuckstration mckrukie maqa leiabryant dvinelocs nrxia infidale nosciencedenial godfly lily caityshoes reddeadrisen godlessliz meknowhu richterblmnt rkdoctr gimmesomeloki think mastodon human occupy ecological niche think mastodon also go extinct arent guess ,1614386267294412800,2715026036,en,2023-01-14 22:17:34+00:00
1249,1307,potus easy fix lol tell ukrainian student national security aka laundering scheme sure aka traitor jump ,1614383770446200832,1586539330129928192,en,2023-01-14 22:07:39+00:00
1250,1308, nickname senior school fat slow horn namesake incredibly thick skin didnt care hater nothing change odd year ,1614383171155693568,1588990784426196993,en,2023-01-14 22:05:16+00:00
1251,1309, optical device mount battery back helmet layer armor base dense flexible material wearable comms glove eye protection combat,1614378910132670465,770623863868751872,en,2023-01-14 21:48:20+00:00
1252,1310,mikekillmon madonna linktree record guyoseary maverick mightyzee time go slowly wait ,1614378661129461762,59879586,en,2023-01-14 21:47:21+00:00
1253,1311,ajenglish wander wild mozambique year go extinct locally,1614376505001365504,1325254260083339267,en,2023-01-14 21:38:47+00:00
1254,1312,roncerod mikekillmon madonna record maverick choreographer work previous conveyor belt shot someone choreography right ,1614373937164726273,1232513621936287745,en,2023-01-14 21:28:34+00:00
1255,1313,edinahn gestination period month black baby always run mother white,1614373352747204608,1614184447242297345,en,2023-01-14 21:26:15+00:00
1256,1314,wearewilderness move past bucketlist mentality slow savour moment wild loc,1614371325094551553,1293526782352785408,en,2023-01-14 21:18:12+00:00
1257,1315,biswanathpol big fillip conservation major setback poachersa gun use hunt early,1614368246840590337,2974191132,en,2023-01-14 21:05:58+00:00
1258,1316,biswanathpol dominationpatrolling remote riverine area adjoin kaziranga national park joint team biswanath policeforest,1614367944716488705,2974191132,en,2023-01-14 21:04:46+00:00
1259,1317,biswanathpol area domination poacher remote riverine area vicinity kaziranga national park osc biswana,1614367598564765696,2974191132,en,2023-01-14 21:03:23+00:00
1260,1318,western black nohern white extinct wild ,1614365725774479360,233028392,en,2023-01-14 20:55:57+00:00
1261,1319,suddenly hungry great dayvideo oregon zoo,1614365077213437952,64487437,en,2023-01-14 20:53:22+00:00
1262,1320,superboy theaist true impale theyre go extinct micheal shouldnt provoke difficult time specie,1614362090143195136,1585100722445721601,en,2023-01-14 20:41:30+00:00
1263,1321,adamsgibson irvineemerson mikekillmon madonna record maverick look pretty heavy right dont know thats butt implant here hop ,1614359522042335232,1493063783849160705,en,2023-01-14 20:31:18+00:00
1264,1322,naturea hakankapucu wow joke baby buddy up human aint pal history treat thema specie least wipe lifetimeyou great judge charactercongratulations,1614359223000879105,1277085510402531329,en,2023-01-14 20:30:06+00:00
1265,1323,african tree wooden animal wall decor forest wall signafrican african rack animaldecor ukwalldecor peterborougha peterborough ukwalla,1614359195653906434,1512036782589849604,en,2023-01-14 20:30:00+00:00
1266,1324,remysenpaii webheadedjosh bro yes sandman dumb major force even ramiverse literally try kill hit full force,1614355886595624960,1435691936971636745,en,2023-01-14 20:16:51+00:00
1267,1325,gtii follow mesedona gtii public coamro geneva roth lender naked sho llc dont know name kramers usingits playbook use many llcs hide avidtrader video,1614355025370693632,1491400296660152323,en,2023-01-14 20:13:25+00:00
1268,1326, note roommate replace showerhead get sharp edge say touch showerhead say wash as say let water run body cincinnati zoo,1614352982845317127,1267900837931765760,en,2023-01-14 20:05:18+00:00
1269,1327,kiss use continuous chas dont use tos use tradestation rollover adjustment automatically people use tos tell tab hit tell tos adjustment cha show low ,1614349696734203905,863478133894328320,en,2023-01-14 19:52:15+00:00
1270,1328,ntvkenya bado nationafrica wako kwa rumour creation story make money pig compete strong gachagua compete iria gachagua undisputed mtkenya leader hao wengine panya kwa store,1614348816290906112,630355288,en,2023-01-14 19:48:45+00:00
1271,1329,weekendvinyl heaven hell blacksabbathspinning first dio era sabs album warner remaster yr old year still sound totally different band compare never say die come fin killer album vinyl,1614347902268186626,128589663,en,2023-01-14 19:45:07+00:00
1272,1330,rid bike great way raise awareness fund impoant cause save nohern white fatu najin extinctionolpejetaescapes olpejeta helping,1614346000487047168,973910373136064512,en,2023-01-14 19:37:34+00:00
1273,1331,renoomokri wrong dangote produce cheaper brand believe monopoly dangote dominant market nigeria dont beleive competitive open market,1614345685385502721,2935513464,en,2023-01-14 19:36:19+00:00
1274,1332,jdnastarz mikekillmon madonna record maverick nkm suppose group dance solo perf think pdp,1614343557816680449,25007208,en,2023-01-14 19:27:51+00:00
1275,1333,roncerod mikekillmon madonna record maverick early choreo nobody know ,1614342799268220928,1232513621936287745,en,2023-01-14 19:24:51+00:00
1276,1334,mikekillmon madonna record maverick wish release remix material girl,1614342440311201793,1232513621936287745,en,2023-01-14 19:23:25+00:00
1277,1335,oleshangay sharjah dubai section depend animal originates section name africa area indi,1614341579929681921,983865741215592448,en,2023-01-14 19:20:00+00:00
1278,1336,mikekillmon madonna record maverick step performance,1614340016532262912,25007208,en,2023-01-14 19:13:47+00:00
1279,1337,possumct riebvjanbeeck everything chinese disgust poach year far guess market horn destine ,1614338598198722560,1249730552506265600,en,2023-01-14 19:08:09+00:00
1280,1338,kiss trade mostly civilize ill add move sync always move bang buck neveheless always screen time pull ,1614337589338578944,863478133894328320,en,2023-01-14 19:04:08+00:00
1281,1340,kansascityzoo join sunday calf gender reveal pay calf yet able see publi,1614335562433036288,1053385856,en,2023-01-14 18:56:05+00:00
1282,1341,jamesotron make time peter attack cemetery end smash mother grave walk away ,1614335322619367424,460221832,en,2023-01-14 18:55:08+00:00
1283,1342,hornedaist nsfwgex itsminosnsfw comm midnightgator ram thing full throttle want get ram bigtime ltsorry long update guy tough sta year mestay safe yall love lot ,1614330402688339969,1050083505999306752,en,2023-01-14 18:35:35+00:00
1284,1343,create safe white many conservation initiative possible sustain suppo guest choose tswalu also choose conservation thisisafrica safarimoments conservation naturephotography,1614330399659905030,214934802,en,2023-01-14 18:35:34+00:00
1285,1344,suespurgin chubby unicorn get fly lesson oxpecker stoppoaching endangeredspecies endwildlifetrade,1614329441378779136,1322055476,en,2023-01-14 18:31:46+00:00
1286,1345,mattnick see amaze spiderman thedevilpig colour thanks josh post killer ,1614328656037384194,715895075331514368,en,2023-01-14 18:28:39+00:00
1287,1346,forgiatoblow ryan wasnt caught fence planning kill donald trump,1614327192623742976,1585837808903770113,en,2023-01-14 18:22:50+00:00
1288,1347,hardtokill josh alexander bully ray chris sabin alex shelley ace austin chris bey matt cardona brian myers heath joe hendry moose masha slamovich deonna purrazzo taylor wilde killer kelly rich swann steve maclin jonathan gresham eddie edward mickie james jordynne grace,1614326480401731585,1106395943648284672,en,2023-01-14 18:20:00+00:00
1289,1348,akubae buffaloas hand promise tabatya danger sthe horn lock favor,1614325653372915718,67958057,en,2023-01-14 18:16:43+00:00
1290,1349,hardtokill josh alexander bully ray chris sabin alex shelley ace austin chris bey brian myers matt cardona heath joe hendry moose masha slamovich deonna purrazo taylor wilde killer kelly rich swann steve maclin eddie edward jonathan gresham mickie james jordynne grace,1614325011791093760,1106395943648284672,en,2023-01-14 18:14:10+00:00
1291,1350, year poach ozone track completely close scientist found climateresistant wheat good news indie bookshop thrive week good news blogweekly roundup,1614324376899407873,14764614,en,2023-01-14 18:11:38+00:00
1292,1351, make time peter attack cemetery end smash mother grave walk away say sorry,1614323802971820036,392414460,en,2023-01-14 18:09:21+00:00
1293,1352,rare dodge poacher world top reserve first time ,1614321394430652417,295878639,en,2023-01-14 17:59:47+00:00
1294,1353,quick test fit einhorn revolver signalis build also yes chiappa,1614317944280055808,367571594,en,2023-01-14 17:46:05+00:00
1295,1354,georgebturner eahs nohern white single image,1614317771214704640,1559949845036679176,en,2023-01-14 17:45:23+00:00
1296,1355,scienceworld scientist create third nohern white embryo big win specie,1614317737253158914,1165123935995912192,en,2023-01-14 17:45:15+00:00
1297,1357,mikekillmon madonna record maverick know put show,1614313141864652801,24064661,en,2023-01-14 17:27:00+00:00
1298,1358,lifelongrepubl dineshdsouza think confuse trump far sound horn middle nose get head spin forgot mcconnellites spin crap demoncrats dang ninja tules,1614307446834470913,1272539246751092736,en,2023-01-14 17:04:22+00:00
1299,1359, new critically endanger javan born national park indonesia bring total popn java recovery nationalparks nature wildlife biodiversity news conservationoptimism conservation letnaturethrive,1614306712000790531,917495877241065479,en,2023-01-14 17:01:27+00:00
1300,1360, true medic learn patientsa patient work zoo taught bad sex,1614304943522848769,891032413962457088,en,2023-01-14 16:54:25+00:00
1301,1361,hardtokill meet greet information hardtokillfallout tonight atlantapre show walkingweapon joehendry thetreymiguel realtaylorwilde post show wearerosemary thetayavalkyrie fearhavok heathxxii,1614304825021435908,1011089368990265344,en,2023-01-14 16:53:57+00:00
1302,1362,jimmyrad warnermusic record riaa madonna guyoseary happy new year gift zoom pixelfun madonna make madonna discsfollow appreciate dont reply command ppixelfun delete,1614304687053733893,1470869833826844673,en,2023-01-14 16:53:24+00:00
1303,1363,mikekillmon madonna record maverick old footage,1614302857188233216,80147238,en,2023-01-14 16:46:08+00:00
1304,1364,catsofberuthiel ttrpgkids magpieofficial haha almost ceainly love idea dragon hybrid drake snake tail ostrich leg dragon frog hop horn possibility,1614302317586554880,90093908,en,2023-01-14 16:43:59+00:00
1305,1365,binoculars impoant tool ranger antipoaching unit monitoring allow ranger monitor identify individual safe distance especially cow young calf binoculars witsforgood conservation wildlife white,1614297783929806849,1381013077424893953,en,2023-01-14 16:25:58+00:00
1306,1366, guy investigate joes stash lol dude best pivotal player world wec enemy nationalism continent find grape use small fruit loom,1614295806634254337,1317959970642604033,en,2023-01-14 16:18:07+00:00
1307,1367,palmoildetect look elephant bairds tapir closely related horse endanger,1614294751930638336,958108574718287872,en,2023-01-14 16:13:55+00:00
1308,1368,fuckthat bazooka put mercy,1614294589279727619,2233607622,en,2023-01-14 16:13:16+00:00
1309,1369,underxcurrent grimnien karajarina savetheplaneto sharkguardian seashepherd ground horn,1614293063387566082,312901539,en,2023-01-14 16:07:13+00:00
1310,1370, officially extinct thats wild,1614291992892289026,2984666271,en,2023-01-14 16:02:57+00:00
1311,1371,meet greet information hardtokillfallout tonight atlantapre show walkingweapon joehendry thetreymiguel realtaylorwilde post show wearerosemary thetayavalkyrie fearhavok heathxxii,1614291250861035524,35338217,en,2023-01-14 16:00:00+00:00
1312,1372, people kill horn fuck go ,1614282779889471489,1054141530624147456,en,2023-01-14 15:26:21+00:00
1313,1373,thetimes police park ranger india claim rare success poacher endanger onehorned ,1614281819616153600,1269883022,en,2023-01-14 15:22:32+00:00
1314,1374,mikekillmon janetjackson madonna record umgcatalog beef theyre actually friend,1614279112327053312,815982510488358912,en,2023-01-14 15:11:46+00:00
1315,1375, feel appreciation watch video squash watermelon horn eat dog tuck nose leg daughter go character play barbies,1614277415756353536,19812671,en,2023-01-14 15:05:02+00:00
1316,1376, grow poach crisis zululand leave increase baby orphan tend please consider donate charity paner helping time need cost care orphan grow,1614276231767228420,2882088209,en,2023-01-14 15:00:20+00:00
1317,1377,laineyaulane fireindomitable rjmyers want africa,1614276025864560640,2421444873,en,2023-01-14 14:59:31+00:00
1318,1378,vetpaw elephant wildlife specie go extinct time actwere dedicate life protect,1614275949414989831,79293663,en,2023-01-14 14:59:12+00:00
1319,1379,irvineemerson mikekillmon madonna record maverick agree expectation significantly recent performance last yr,1614274511578210306,309921305,en,2023-01-14 14:53:29+00:00
1320,1380,tommythornton gray come,1614273106738302978,1518083239143178240,en,2023-01-14 14:47:55+00:00
1321,1381, suspect poachersassam nagaon,1614272748225978371,929076201187975168,en,2023-01-14 14:46:29+00:00
1322,1382,horn elephant ivory seize bust smuggler vadodara,1614269623955750912,3393519423,en,2023-01-14 14:34:04+00:00
1323,1383,yall kill mfn ,1614268519369310214,2947224875,en,2023-01-14 14:29:41+00:00
1324,1384,adamsgibson mikekillmon madonna record maverick way wont move year ago thats fan need low expectation regard,1614264986393628672,1311082271710081024,en,2023-01-14 14:15:39+00:00
1325,1385,blackmambasapu newsblackmambasapu unite specialist paners tackle poach illegal trade pangoli,1614264036031348736,2907401280,en,2023-01-14 14:11:52+00:00
1326,1386,kansascityzoo grow size personality zuris calf steal heas yet week old young calf spending time,1614264002598559744,2907401280,en,2023-01-14 14:11:44+00:00
1327,1387,trafficwltrade wildlifecrimetr johnjurko manmovie see kill eastern cape first year area reserve tighten security shock brutal horrific glorify fingernail,1614259629852172288,959000591400951809,en,2023-01-14 13:54:21+00:00
1328,1389,dallaszoo happen columbus red panda couple year ago hang yard enclosure lol,1614252442182619139,541738393,en,2023-01-14 13:25:48+00:00
1329,1390,trafficwltrade case miss director development nick ahlers speaks film director johnjurko manmovie,1614252299089752064,2525764422,en,2023-01-14 13:25:14+00:00
1330,1391,zwakelem jsteenhuisen actionsa absolutely accept join march poach south africa also crisis maybe skip tit tat condition stick issue ,1614251098826588160,461086983,en,2023-01-14 13:20:27+00:00
1331,1393, roll mud daily routine there good reason cool effect help regulate body temperature also protects sunburn provide relief pesky biting insectsorphanage southafrica,1614249346668679168,869959916,en,2023-01-14 13:13:30+00:00
1332,1394,mikekillmon madonna billboard record someone billboard need slap photo,1614246865624498176,3316319099,en,2023-01-14 13:03:38+00:00
1333,1395,sabcmns underage drinking almost social ill teenage pregnancy violence drug burning infrastructure lack justice racial attack crime prostitution human traffic poach tribalism list endless,1614245307524730883,807252978545655808,en,2023-01-14 12:57:27+00:00
1334,1396, extinct nobody put zoo,1614242928909492224,1447262067128426496,en,2023-01-14 12:48:00+00:00
1335,1397,mikekillmon madonna record maverick let hope put much work new tour fitness tour ready,1614242278804971520,309921305,en,2023-01-14 12:45:25+00:00
1336,1398, boxwood african blossom troublingly curious strong enough endure pleasurable round poem sharesteem,1614240234027495424,1122255864012967936,en,2023-01-14 12:37:17+00:00
1337,1399,kapamareserve beautiful experience guest see safari conservation,1614240092138213378,1328357847432916995,en,2023-01-14 12:36:43+00:00
1338,1400,eawildlife study find experience physical exeion translocation,1614239244557643777,1527526223223885824,en,2023-01-14 12:33:21+00:00
1339,1401,record watch jeff beck performs national anthem comerica park detroit game tiger arizona,1614238819292958723,758815286,en,2023-01-14 12:31:40+00:00
